ID,Artigo,Sentencas,Titulo,DOI
1,17084,The X-ray absorption near edge structure (XANES) spectra of a series of ceria samples doped with trivalent rare earth oxide have been measured at the L-III edges of the dopants and the cerium.,X-ray absorption near edge structure (XANES) measurements of ceria-based solid electrolytes,10.1016/S0167-2738(00)00533-6
2,17084,These spectra give information on the valency of the excited atom and the geometric structure of the direct neighborhood of this atom.,X-ray absorption near edge structure (XANES) measurements of ceria-based solid electrolytes,10.1016/S0167-2738(00)00533-6
3,17084,"By comparing the XANES spectra of the dopants with those of the pure oxides, differences in thr way the dopants are incorporated into the ceria lattice can be observed.",X-ray absorption near edge structure (XANES) measurements of ceria-based solid electrolytes,10.1016/S0167-2738(00)00533-6
4,17084,"These differences together with the mismatch of the ionic radii of the dopants compared to Ce, seem to be responsible for the decreasing ionic conductivity of the lighter rare earth dopants.",X-ray absorption near edge structure (XANES) measurements of ceria-based solid electrolytes,10.1016/S0167-2738(00)00533-6
5,17084,"For Pr, the spectra indicate a partial oxidation to Pr-44 leading to a reduced conductivity.",X-ray absorption near edge structure (XANES) measurements of ceria-based solid electrolytes,10.1016/S0167-2738(00)00533-6
6,17084,(C) 2000,X-ray absorption near edge structure (XANES) measurements of ceria-based solid electrolytes,10.1016/S0167-2738(00)00533-6
7,17084,Elsevier Science B.V.,X-ray absorption near edge structure (XANES) measurements of ceria-based solid electrolytes,10.1016/S0167-2738(00)00533-6
8,17084,All rights reserved.,X-ray absorption near edge structure (XANES) measurements of ceria-based solid electrolytes,10.1016/S0167-2738(00)00533-6
