ID,Artigo,Sentencas,Titulo,DOI
1,19782,The development of spintronic devices is the most promising and interesting way to improve conventional electronics.,Perovskite-Type Thin Slabs: A First-Principles Study of Their Magnetic and Electronic Properties,10.1109/LMAG.2016.2604216
2,19782,They will allow us to continue diminishing the devices' dimensions as well as optimizing the energy requirements for their operation.,Perovskite-Type Thin Slabs: A First-Principles Study of Their Magnetic and Electronic Properties,10.1109/LMAG.2016.2604216
3,19782,"Perovskites stand out among materials that could be used in those devices because their variety permits combinations of optical, electronic, and magnetic properties.",Perovskite-Type Thin Slabs: A First-Principles Study of Their Magnetic and Electronic Properties,10.1109/LMAG.2016.2604216
4,19782,The bulk double perovskite Sr2FeMoO6 (SFMO) is a half-metallic system that has become very attractive after the Kobayashi report about their high Curie temperature (about 470 K).,Perovskite-Type Thin Slabs: A First-Principles Study of Their Magnetic and Electronic Properties,10.1109/LMAG.2016.2604216
5,19782,"SFMO has been used to build solid oxide fuel cell electrodes, but this compound could be used as a laminar system in the development of spintronic devices because of its high spin polarization.",Perovskite-Type Thin Slabs: A First-Principles Study of Their Magnetic and Electronic Properties,10.1109/LMAG.2016.2604216
6,19782,This proposal has been motivated by the exploitation of the magnetoresistive response in manganite applications and the reported experimental work on perovskite thin films.,Perovskite-Type Thin Slabs: A First-Principles Study of Their Magnetic and Electronic Properties,10.1109/LMAG.2016.2604216
7,19782,The inclusion of SFMO laminar systems in spintronic devices could affect magnetic-tunnel-junction-like devices.,Perovskite-Type Thin Slabs: A First-Principles Study of Their Magnetic and Electronic Properties,10.1109/LMAG.2016.2604216
8,19782,"From a crystalline SFMO model system, thin slabs were excised and a supercell was built for each system, setting the appropriate initial separation between image slabs along the [001] direction.",Perovskite-Type Thin Slabs: A First-Principles Study of Their Magnetic and Electronic Properties,10.1109/LMAG.2016.2604216
9,19782,"The geometry optimization and magnetic and electronic properties (density of states, band structures, and magnetic moment distribution) were calculated in the density functional theory scheme using the local density approximation with the Hubbard parameter (LDA + U).",Perovskite-Type Thin Slabs: A First-Principles Study of Their Magnetic and Electronic Properties,10.1109/LMAG.2016.2604216
