ID,Artigo,Sentencas,Titulo,DOI
1,16080,"Solid oxide fuel cells (SOFCs) have received continuous attention as an energy conversion device, and the development of highly electrochemically active materials is important.",Designing highly active and CO 2 tolerant heterostructure electrode materials by a facile A-site deficiency strategy in Pr 1-x BaCo 2 O 5+δ double perovskite,10.1016/j.jpowsour.2024.234344
2,16080,"In this work, highly active and CO 2 tolerant BaBi x Co 1-x O 3 @PrBaCo 2 O 5 + delta heterostructure electrode materials were fabricated by a facile A -site deficiency in Pr 1-x BaCo 2 O 5 + delta double perovskite.",Designing highly active and CO 2 tolerant heterostructure electrode materials by a facile A-site deficiency strategy in Pr 1-x BaCo 2 O 5+δ double perovskite,10.1016/j.jpowsour.2024.234344
3,16080,A -site excess -deficient,Designing highly active and CO 2 tolerant heterostructure electrode materials by a facile A-site deficiency strategy in Pr 1-x BaCo 2 O 5+δ double perovskite,10.1016/j.jpowsour.2024.234344
4,16080,Pr 0.8 BaCo 2 O 5 + delta (PBC80) doubleperovskite oxide were prepared and designed to induce the self -assembly dissolution to form BaCoO,Designing highly active and CO 2 tolerant heterostructure electrode materials by a facile A-site deficiency strategy in Pr 1-x BaCo 2 O 5+δ double perovskite,10.1016/j.jpowsour.2024.234344
5,16080,3- delta (BCO) heterostructure through cationic high -concentration deficiency.,Designing highly active and CO 2 tolerant heterostructure electrode materials by a facile A-site deficiency strategy in Pr 1-x BaCo 2 O 5+δ double perovskite,10.1016/j.jpowsour.2024.234344
6,16080,"However, the surface -dissolved alkaline earth metal (Ba 2 + ) readily forms carbonates with CO 2 , which severely limits the cathode catalytic activity and longterm stability.",Designing highly active and CO 2 tolerant heterostructure electrode materials by a facile A-site deficiency strategy in Pr 1-x BaCo 2 O 5+δ double perovskite,10.1016/j.jpowsour.2024.234344
7,16080,"Thus, bismuth ion -modified PBC80 (BBCO@PBCO) was prepared to further tailor the material properties, which provides more active sites for oxygen reduction reaction (ORR) by strengthening the synergistic interaction between the heterogeneous interfaces.",Designing highly active and CO 2 tolerant heterostructure electrode materials by a facile A-site deficiency strategy in Pr 1-x BaCo 2 O 5+δ double perovskite,10.1016/j.jpowsour.2024.234344
8,16080,"More importantly, BBCO@PBCO exhibits the most stable Area specific resistance (ASR) under CO 2 atmosphere, indicating the incorporation of acidic Bi ions effectively mitigated the adsorption and reaction between the material and the acidic gas CO 2 .",Designing highly active and CO 2 tolerant heterostructure electrode materials by a facile A-site deficiency strategy in Pr 1-x BaCo 2 O 5+δ double perovskite,10.1016/j.jpowsour.2024.234344
9,16080,"These results indicate that the heterostructure induced by A -site deficiency promotes the ORR activity of PrBaCo 2 O 5 + delta cathode, while further modification of Bi ions enhances both the electrochemical activity and the stability of the materials, delivering superior resistance to CO 2 poisoning.",Designing highly active and CO 2 tolerant heterostructure electrode materials by a facile A-site deficiency strategy in Pr 1-x BaCo 2 O 5+δ double perovskite,10.1016/j.jpowsour.2024.234344
