ID,Artigo,Sentencas,Titulo,DOI
1,10642,"As the first part of a two paper series, we present a two-dimensional impedance model of a working solid oxide fuel cell (SOFC) to study the effect of contact degradation on the impedance spectrum for the purpose of non-invasive diagnosis.",Short-stack modeling of degradation in solid oxide fuel cells - Part I. Contact degradation,10.1016/j.jpowsour.2007.10.047
2,10642,"The two dimensional modeled geometry includes the ribbed interconnect, and is adequate to represent co- and counter-flow configurations.",Short-stack modeling of degradation in solid oxide fuel cells - Part I. Contact degradation,10.1016/j.jpowsour.2007.10.047
3,10642,"Simulated degradation modes include: cathode delamination, interconnect oxidation, and interconnect-cathode detachment.",Short-stack modeling of degradation in solid oxide fuel cells - Part I. Contact degradation,10.1016/j.jpowsour.2007.10.047
4,10642,"The simulations show differences in the way each degradation mode impacts the impedance spectrum shape, suggesting that identification is possible.",Short-stack modeling of degradation in solid oxide fuel cells - Part I. Contact degradation,10.1016/j.jpowsour.2007.10.047
5,10642,"In Part II, we present a sensitivity analysis of the results to input parameter variability that reveals strengths and limitations of the method, as well as describing possible interactions between input parameters and concurrent degradation modes.",Short-stack modeling of degradation in solid oxide fuel cells - Part I. Contact degradation,10.1016/j.jpowsour.2007.10.047
6,10642,(c) 2007,Short-stack modeling of degradation in solid oxide fuel cells - Part I. Contact degradation,10.1016/j.jpowsour.2007.10.047
7,10642,Elsevier B.V. All rights reserved.,Short-stack modeling of degradation in solid oxide fuel cells - Part I. Contact degradation,10.1016/j.jpowsour.2007.10.047
