ID,Artigo,Sentencas,Titulo,DOI
1,11304,Lowering the operating temperature of the solid oxide fuel cell by low-cost material is still a challenge.,Structural and electrochemical characterization of low-cost LixCu1-xCoyFe1-yO3-δ cathode material for intermediate temperature solid oxide fuel cell,10.1016/j.ceramint.2020.01.031
2,11304,"The present study reports LixCu1-xCoyFe1-yO3-delta (x = 0.20, 0.40, y = 0.20, 0.40) composite material as a potential cathode for intermediate temperature solid oxide fuel cell (IT-SOFC).",Structural and electrochemical characterization of low-cost LixCu1-xCoyFe1-yO3-δ cathode material for intermediate temperature solid oxide fuel cell,10.1016/j.ceramint.2020.01.031
3,11304,This mixed ionic electronic conducing material (MIEC) is synthesized by sol-gel method.,Structural and electrochemical characterization of low-cost LixCu1-xCoyFe1-yO3-δ cathode material for intermediate temperature solid oxide fuel cell,10.1016/j.ceramint.2020.01.031
4,11304,"The X-Ray Diffraction analysis (XRD) is considered to examine biphasic sharp crystalline, hexagonal and monoclinic structure while Scanning Electron Microscopy (SEM) is used to analyse surface morphology which is found to be porous, distinct almost homogenous particles of varying size of novel composite cathode material.",Structural and electrochemical characterization of low-cost LixCu1-xCoyFe1-yO3-δ cathode material for intermediate temperature solid oxide fuel cell,10.1016/j.ceramint.2020.01.031
5,11304,The results revealed that composite nanostructured particles have appropriate porosity with diffused channels and no crack.,Structural and electrochemical characterization of low-cost LixCu1-xCoyFe1-yO3-δ cathode material for intermediate temperature solid oxide fuel cell,10.1016/j.ceramint.2020.01.031
6,11304,Thermal properties are studied by Thermogravimetric analysis (TGA) that showed different stages of changes with the respective rise of temperature (40 degrees C-800 degrees C).,Structural and electrochemical characterization of low-cost LixCu1-xCoyFe1-yO3-δ cathode material for intermediate temperature solid oxide fuel cell,10.1016/j.ceramint.2020.01.031
7,11304,The investigation of electrical properties was carried out by DC four-probe method that showed conductivities of Li0.2Cu0.8Co0.2Fe0.8O3-delta and Li0.4Cu0.6Co0.4Fe0.6O3-delta was 14.81 Scm(-1) and 11.59 Scm -1 respectively.,Structural and electrochemical characterization of low-cost LixCu1-xCoyFe1-yO3-δ cathode material for intermediate temperature solid oxide fuel cell,10.1016/j.ceramint.2020.01.031
8,11304,"The significant power and current densities as 68.20 mWcm(-2), 736 mAcm(-2) for Li0.2Cu0.8Co0.2Fe0.8O3-delta and 60.1 mWcm(-2), 713 mAcm(-2) for Li0.4Cu0.6Co0.4Fe0.6O3-delta respectively were achieved.",Structural and electrochemical characterization of low-cost LixCu1-xCoyFe1-yO3-δ cathode material for intermediate temperature solid oxide fuel cell,10.1016/j.ceramint.2020.01.031
9,11304,The preliminary results showed that the LixCu1-xCoyFe1-yO3-delta (LCCF) was highly capable cathode material to get IT-SOFC with SDC electrode.,Structural and electrochemical characterization of low-cost LixCu1-xCoyFe1-yO3-δ cathode material for intermediate temperature solid oxide fuel cell,10.1016/j.ceramint.2020.01.031
