ID,Artigo,Sentencas,Titulo,DOI
1,11057,Production costs of two types of solid oxide fuel cells (SOFCs) were estimated to clarify their economical prospects.,PRODUCTION COST ESTIMATION OF SOLID OXIDE FUEL-CELLS,10.1016/0378-7753(93)01831-2
2,11057,In this assessment 2000 kW of SOFC capacity is assumed to be manufactured per month.,PRODUCTION COST ESTIMATION OF SOLID OXIDE FUEL-CELLS,10.1016/0378-7753(93)01831-2
3,11057,Single cells of a planar type with 0.21 W/cm2 are fabricated by co-firing of doctor blade layers and the separators are prepared by firing of press-moulding bodies.,PRODUCTION COST ESTIMATION OF SOLID OXIDE FUEL-CELLS,10.1016/0378-7753(93)01831-2
4,11057,Stacks with 400 W consists of 20 cells and 21 separators.,PRODUCTION COST ESTIMATION OF SOLID OXIDE FUEL-CELLS,10.1016/0378-7753(93)01831-2
5,11057,The materials cost of this type covers nearly 60% of the total (118 000 yen/kW).,PRODUCTION COST ESTIMATION OF SOLID OXIDE FUEL-CELLS,10.1016/0378-7753(93)01831-2
6,11057,"By comparison, the tubular SOFCs with 0.18 W/cm2 are assumed to be made using an electrochemical vapour deposition (EVD) method or a plasma spraying (PS) method on porous support tubes.",PRODUCTION COST ESTIMATION OF SOLID OXIDE FUEL-CELLS,10.1016/0378-7753(93)01831-2
7,11057,The module with 20 tubes is built up by arranging the cells in a suitable order.,PRODUCTION COST ESTIMATION OF SOLID OXIDE FUEL-CELLS,10.1016/0378-7753(93)01831-2
8,11057,The support tube is fired after continuous isostatic pressing.,PRODUCTION COST ESTIMATION OF SOLID OXIDE FUEL-CELLS,10.1016/0378-7753(93)01831-2
9,11057,"Including the cost of support tubes, the overall costs for tubular cell systems by the EVD method and by the PS method are about 617 000 yen/kW and 293 000 yen/kW, respectively.",PRODUCTION COST ESTIMATION OF SOLID OXIDE FUEL-CELLS,10.1016/0378-7753(93)01831-2
