ID,Artigo,Sentencas,Titulo,DOI
1,10909,"A biomass-driven integrated system comprising anaerobic digestion, gasification, proton exchange membrane electrolyzer (PEME), Sabatier reactor, solid oxide fuel cell (SOFC), a gas turbine, steam turbine and organic Rankine cycle (ORC) was proposed in this study.",Thermo-economic analysis and multi-criteria optimization of an integrated biomass-to-energy power plant,10.1016/j.renene.2024.120112
2,10909,"Biomass feedstocks in form of animal waste served as input in the digester and converted to biogas, and crop residue was converted to syngas in the gasifier.",Thermo-economic analysis and multi-criteria optimization of an integrated biomass-to-energy power plant,10.1016/j.renene.2024.120112
3,10909,"Upgraded syngas and methane from the bio-conversion process was fed to a SOFC-GT topping cycle, with heat recovery bottoming cycles of steam turbine and organic Rankine cycles.",Thermo-economic analysis and multi-criteria optimization of an integrated biomass-to-energy power plant,10.1016/j.renene.2024.120112
4,10909,"The proposed system was assessed from energy, exergy and economic viewpoints in Engineering Equation Solver (EES) software.",Thermo-economic analysis and multi-criteria optimization of an integrated biomass-to-energy power plant,10.1016/j.renene.2024.120112
5,10909,Parametric analysis was performed to ascertain the effect of design parameters on the plant's performance.,Thermo-economic analysis and multi-criteria optimization of an integrated biomass-to-energy power plant,10.1016/j.renene.2024.120112
6,10909,"Lastly, a multi-criteria optimization was performed using multi-objective genetic algorithm (MOGA) in MATLAB to maximize exergy efficiency and minimize levelized cost of electricity, as well as selection of best ORC working fluid from six preselected candidates (MM, MDM, cyclopentane, cyclohexane, R1233zd(E), and R600a).",Thermo-economic analysis and multi-criteria optimization of an integrated biomass-to-energy power plant,10.1016/j.renene.2024.120112
7,10909,"According to the results, at optimum point the plant can attain energy and exergy efficiencies of 54.81 % and 44.87 %, respectively.",Thermo-economic analysis and multi-criteria optimization of an integrated biomass-to-energy power plant,10.1016/j.renene.2024.120112
8,10909,"The total power output is 9.05 MW, with levelized cost of electricity of 111.8 $/MWh.",Thermo-economic analysis and multi-criteria optimization of an integrated biomass-to-energy power plant,10.1016/j.renene.2024.120112
9,10909,Hydrogen of 0.0023 kg/s with PEME efficiency of 73.73 % was obtained and further used in upgrading the syngas from LHV of 4.20-37.78 MJ/kg.,Thermo-economic analysis and multi-criteria optimization of an integrated biomass-to-energy power plant,10.1016/j.renene.2024.120112
