ID,Artigo,Sentencas,Titulo,DOI
1,1013,"From the analytical model derived earlier [17], analytical expressions for the relative thickness ratio r(s) of a bi-layer electrolyte and the maximum power density of a fuel cell are developed.",Theoretical analysis of the characteristics of the solid oxide fuel cells with a bi-layer electrolyte,10.1016/j.ijhydene.2013.03.035
2,1013,"Using these expressions, together with the other relationships from the analytical model, the characteristics of solid oxide fuel cells (SOFCs) with a bi-layer electrolyte are analyzed and theoretical analysis of the effect of the configuration of a bi-layer electrolyte on the SOFC performance is performed.",Theoretical analysis of the characteristics of the solid oxide fuel cells with a bi-layer electrolyte,10.1016/j.ijhydene.2013.03.035
3,1013,The results show that the effectiveness of the bi-layer electrolyte depends strongly on its configuration.,Theoretical analysis of the characteristics of the solid oxide fuel cells with a bi-layer electrolyte,10.1016/j.ijhydene.2013.03.035
4,1013,"In the analyses, the variations of open circuit voltage and the maximum power density with the thickness ratio at different total electrolyte thicknesses and different operating temperatures are obtained.",Theoretical analysis of the characteristics of the solid oxide fuel cells with a bi-layer electrolyte,10.1016/j.ijhydene.2013.03.035
5,1013,"Furthermore, by taking into considerations of the oxygen partial pressure at the interface between the two layers of electrolytes, an analytical expression for the critical relative thickness ratio, above which, the electrolyte is stable, is obtained.",Theoretical analysis of the characteristics of the solid oxide fuel cells with a bi-layer electrolyte,10.1016/j.ijhydene.2013.03.035
6,1013,"Copyright (C) 2013, Hydrogen Energy Publications, LLC.",Theoretical analysis of the characteristics of the solid oxide fuel cells with a bi-layer electrolyte,10.1016/j.ijhydene.2013.03.035
7,1013,Published by Elsevier Ltd.,Theoretical analysis of the characteristics of the solid oxide fuel cells with a bi-layer electrolyte,10.1016/j.ijhydene.2013.03.035
8,1013,All rights reserved.,Theoretical analysis of the characteristics of the solid oxide fuel cells with a bi-layer electrolyte,10.1016/j.ijhydene.2013.03.035
