ID,Artigo,Sentencas,Titulo,DOI
1,16044,In this paper the design point definition of a pressurised hybrid system based on the Rolls-Royce Integrated Planar-Solid Oxide Fuel Cells (IP-SOFCs) is presented and discussed.,Design and off-design analysis of a MW hybrid system based on rolls-royce integrated planar solid oxide fuel cells,10.1115/1.1839917
2,16044,"The hybrid system size is about 2 MWe and the design point analysis has been carried out using two different lP-SOFC models developed by Thermochemical Power Group (TPG) at the University of Genoa: (i) a generic one, where the transport and balance equations of the mass, energy and electrical charges are solved in a lumped volume at constant temperature; (ii) a detailed model where all the equations are solved in a finite difference approach inside the single cell.",Design and off-design analysis of a MW hybrid system based on rolls-royce integrated planar solid oxide fuel cells,10.1115/1.1839917
3,16044,"The first model has been used to define the hybrid system lay out and the characteristics of the main devices of the plant such as the recuperator the compressor, the expander, etc.",Design and off-design analysis of a MW hybrid system based on rolls-royce integrated planar solid oxide fuel cells,10.1115/1.1839917
4,16044,"The second model has been used to verify the design point defined in the previous step, taking into account that the stack internal temperature behavior are now available and must be carefully considered.",Design and off-design analysis of a MW hybrid system based on rolls-royce integrated planar solid oxide fuel cells,10.1115/1.1839917
5,16044,Apt modifications of the preliminary design point have been suggested using the detailed IP-SOFC system to obtain a feasible solution.,Design and off-design analysis of a MW hybrid system based on rolls-royce integrated planar solid oxide fuel cells,10.1115/1.1839917
6,16044,In the second part of the paper some off-design performance of the Hybrid System carried out using detailed SOFC model are presented and discussed.,Design and off-design analysis of a MW hybrid system based on rolls-royce integrated planar solid oxide fuel cells,10.1115/1.1839917
7,16044,"In particular the influence of ambient conditions is shown, together with the possible part load operations at fixed and variable gas turbine speed.",Design and off-design analysis of a MW hybrid system based on rolls-royce integrated planar solid oxide fuel cells,10.1115/1.1839917
8,16044,Some considerations on the compressor surge margin modification are reported.,Design and off-design analysis of a MW hybrid system based on rolls-royce integrated planar solid oxide fuel cells,10.1115/1.1839917
