ID,Artigo,Sentencas,Titulo,DOI
1,17394,"Aqueous dispersions of lanthanum strontium manganite (LSM) and yttria-stabilized zirconia (YSZ) particles were controllably freeze-cast and then partially sintered resulting in anisotropic, hierarchically porous ceramics for Solid Oxide Fuel Cell (SOFC) cathodes.",Processing of Hierarchical and Anisotropic Porosity LSM-YSZ Composites,10.1111/jace.12478
2,17394,The resulting microstructures have aligned pores with a characteristic spacing () between pore centers.,Processing of Hierarchical and Anisotropic Porosity LSM-YSZ Composites,10.1111/jace.12478
3,17394,"The effect of freezing rate, slurry viscosity, and solid loading on solidification velocity and resultant microstructures was explored.",Processing of Hierarchical and Anisotropic Porosity LSM-YSZ Composites,10.1111/jace.12478
4,17394,Varying these parameters resulted in samples with a range of independently controllable and reproducible microstructures.,Processing of Hierarchical and Anisotropic Porosity LSM-YSZ Composites,10.1111/jace.12478
5,17394,Homogenous dispersion of LSM and YSZ in the freeze-cast structures was confirmed through elemental mapping.,Processing of Hierarchical and Anisotropic Porosity LSM-YSZ Composites,10.1111/jace.12478
6,17394,Freezing rate was found to have a significant effect on while solid loading affected overall porosity and ceramic wall- to-pore size ratio but had only a small influence on .,Processing of Hierarchical and Anisotropic Porosity LSM-YSZ Composites,10.1111/jace.12478
7,17394,Viscosity was found to have a complex albeit small impact on but a significant effect on particle dispersion and colloid stability.,Processing of Hierarchical and Anisotropic Porosity LSM-YSZ Composites,10.1111/jace.12478
