ID,Artigo,Sentencas,Titulo,DOI
1,19408,"TiC and crystalline (Ti,Nb)3SiC2 based dual-layer is prepared on SUS430 alloy by DC magnetron sputtering followed by annealing at 1000 degrees C for 20 h. The oxidation of TiC/TNSC coated alloy at 800 degrees C for 500 h follows the parabolic law with a low rate constant of 5.4 x 10-15 g2 cm-4","TiC and (Ti,Nb)3SiC2 based dual-layer coating on SUS430 for solid oxide fuel cell interconnects",10.1016/j.ijhydene.2024.03.157
2,19408,s-,"TiC and (Ti,Nb)3SiC2 based dual-layer coating on SUS430 for solid oxide fuel cell interconnects",10.1016/j.ijhydene.2024.03.157
3,19408,1.,"TiC and (Ti,Nb)3SiC2 based dual-layer coating on SUS430 for solid oxide fuel cell interconnects",10.1016/j.ijhydene.2024.03.157
4,19408,The formed oxide scale is composed of Cr2O3/MnCr2O4 dominated inner layer and outer layer of Nb-doped TiO2 and SiO2 uniform mixture.,"TiC and (Ti,Nb)3SiC2 based dual-layer coating on SUS430 for solid oxide fuel cell interconnects",10.1016/j.ijhydene.2024.03.157
5,19408,"Owing to the barrier effect of TiC layer and dense oxide scale, outward diffusion of Cr and Mn is efficiently suppressed, resulting in the low Cr content in the outer oxide layer, which is beneficial to the reduced volatilization of Cr oxide.","TiC and (Ti,Nb)3SiC2 based dual-layer coating on SUS430 for solid oxide fuel cell interconnects",10.1016/j.ijhydene.2024.03.157
6,19408,"Furthermore, the ASR of the formed oxide scale at 800 degrees C is 15.87 m Omega cm2, suggesting excellent conductivity.","TiC and (Ti,Nb)3SiC2 based dual-layer coating on SUS430 for solid oxide fuel cell interconnects",10.1016/j.ijhydene.2024.03.157
7,19408,"It is concluded that the TiC/(Ti,Nb)3SiC2 coating can significantly improve the oxidation resistannce and electrical property of SUS430 alloy, endowing it potential application as SOFC interconnect protective coating.","TiC and (Ti,Nb)3SiC2 based dual-layer coating on SUS430 for solid oxide fuel cell interconnects",10.1016/j.ijhydene.2024.03.157
