ID,Artigo,Sentencas,Titulo,DOI
1,14032,"Rapid oxygen ion conduction, which is important in solid oxide fuel cell (SOFC) electrolytes, is often dramatically hindered by the presence of even small concentrations of impurities such as SiO2, which is ubiquitous in ceramic processing.",Improving SiO2 impurity tolerance of Ce0.8Sm0.2O1.9: Synergy of CaO and ZnO in scavenging grain-boundary resistive phases,10.1016/j.jpowsour.2016.05.135
2,14032,"In this study, rapid degradation of the grain boundary (GB) conduction of Ce0.8Sm0.2O1.9 (SDC) is observed with increasing SiO2 addition from 0 to 1 wt%.",Improving SiO2 impurity tolerance of Ce0.8Sm0.2O1.9: Synergy of CaO and ZnO in scavenging grain-boundary resistive phases,10.1016/j.jpowsour.2016.05.135
3,14032,Nearly complete GB conduction recovery is achieved through synergy between CaO and ZnO in the SDC + x wt% Si systems.,Improving SiO2 impurity tolerance of Ce0.8Sm0.2O1.9: Synergy of CaO and ZnO in scavenging grain-boundary resistive phases,10.1016/j.jpowsour.2016.05.135
4,14032,"Scanning electron microscopy (SEM) combined with energy dispersive spectroscopy (EDS) demonstrate the formation of a Ca-, Si-, and Sm-containing secondary phases, which is related to the enhancements in GB conductivity and reductions in activation energy.",Improving SiO2 impurity tolerance of Ce0.8Sm0.2O1.9: Synergy of CaO and ZnO in scavenging grain-boundary resistive phases,10.1016/j.jpowsour.2016.05.135
5,14032,The scavenging effect of CaO is verified in this study and ZnO is observed to promote the scavenging reaction.,Improving SiO2 impurity tolerance of Ce0.8Sm0.2O1.9: Synergy of CaO and ZnO in scavenging grain-boundary resistive phases,10.1016/j.jpowsour.2016.05.135
6,14032,"Compared with the single-addition case (CaO/ZnO), the much higher SiO2 impurity tolerance of the combined system suggests the commercial potential of the scavenger + promoter strategy presented in this work.",Improving SiO2 impurity tolerance of Ce0.8Sm0.2O1.9: Synergy of CaO and ZnO in scavenging grain-boundary resistive phases,10.1016/j.jpowsour.2016.05.135
7,14032,(C) 2016,Improving SiO2 impurity tolerance of Ce0.8Sm0.2O1.9: Synergy of CaO and ZnO in scavenging grain-boundary resistive phases,10.1016/j.jpowsour.2016.05.135
8,14032,Elsevier B.V. All rights reserved.,Improving SiO2 impurity tolerance of Ce0.8Sm0.2O1.9: Synergy of CaO and ZnO in scavenging grain-boundary resistive phases,10.1016/j.jpowsour.2016.05.135
