ID,Artigo,Sentencas,Titulo,DOI
1,1467,"Electrolysis of water produces high-purity hydrogen directly, with no need for additional clean-up process.",Intermediate temperature reversible fuel cells,10.1111/j.1744-7402.2007.02132.x
2,1467,Efficiency and cost of electrolysis are favorable with high-temperature steam electrolyzers where a portion of the required energy can be supplied as thermal energy.,Intermediate temperature reversible fuel cells,10.1111/j.1744-7402.2007.02132.x
3,1467,"With the similarity in requirements, much of the materials and designs aspects for the high-temperature electrolyzers have been derived from solid oxide fuel cell development.",Intermediate temperature reversible fuel cells,10.1111/j.1744-7402.2007.02132.x
4,1467,Lanthanum gallate electrolyte-based cells were evaluated in fuel cell and electrolysis modes of operation.,Intermediate temperature reversible fuel cells,10.1111/j.1744-7402.2007.02132.x
5,1467,A modified nickel anode is shown to lower the reactivity with the gallate.,Intermediate temperature reversible fuel cells,10.1111/j.1744-7402.2007.02132.x
