ID,Artigo,Sentencas,Titulo,DOI
1,10115,"To utilize the waste heat from coalbed methane, this study presents a novel solid oxide fuel cell (SOFC) system combined with a transcritical carbon dioxide cycle, lithium bromide absorption refrigeration cycle, ammonia vapor compression refrigeration cycle, and water heating cycle to provide power, cooling, and heating.",Proposal and analysis of a novel CCHP system based on SOFC for coalbed methane recovery,10.1016/j.energy.2023.128996
2,10115,"An Aspen Plus model is developed to perform thermodynamic and exergy analyses, assessing system performance.",Proposal and analysis of a novel CCHP system based on SOFC for coalbed methane recovery,10.1016/j.energy.2023.128996
3,10115,The results indicate that critical parameters such as current density and operating temperature of the SOFC have a significant influence on the overall system.,Proposal and analysis of a novel CCHP system based on SOFC for coalbed methane recovery,10.1016/j.energy.2023.128996
4,10115,Increasing current density and air preheating temperature enhance thermal efficiency while raising the SOFC operating temperature reduces it.,Proposal and analysis of a novel CCHP system based on SOFC for coalbed methane recovery,10.1016/j.energy.2023.128996
5,10115,"For the specified coalbed methane flow, the system achieves electrical efficiency, thermal efficiency, and exergy efficiency of 52.46%, 86.30%, and 75.58%, respectively.",Proposal and analysis of a novel CCHP system based on SOFC for coalbed methane recovery,10.1016/j.energy.2023.128996
6,10115,"Additionally, the cooling capacity, power generation, and heat production are obtained as 1567.72 kW, 4879.1 kW, and 2476.43 kW, respectively.",Proposal and analysis of a novel CCHP system based on SOFC for coalbed methane recovery,10.1016/j.energy.2023.128996
7,10115,"The SOFC system has the largest exergy destruction, accounting for 48.8% of the total exergy destruction, but the overall exergy efficiency remains at around 75%.",Proposal and analysis of a novel CCHP system based on SOFC for coalbed methane recovery,10.1016/j.energy.2023.128996
8,10115,"The results illustrate that the proposed integrated system provides a high level of efficiency and reliability, thereby offering a new avenue for the efficient and rational utilization of CBM.",Proposal and analysis of a novel CCHP system based on SOFC for coalbed methane recovery,10.1016/j.energy.2023.128996
