ID,Artigo,Sentencas,Titulo,DOI
1,1011,"In the present work, cost-effective nanocomposite electrolyte (Ba-SDC) oxide is developed for efficient low-temperature solid oxide fuel cells (LTSOFCs).",Composite electrolyte with proton conductivity for low-temperature solid oxide fuel cell,10.1063/1.4934940
2,1011,Analysis has shown that dual phase conduction of O-2 (oxygen ions) and H+ (protons) plays a significant role in the development of advanced LTSOFCs.,Composite electrolyte with proton conductivity for low-temperature solid oxide fuel cell,10.1063/1.4934940
3,1011,Comparatively high proton ion conductivity (0.19 s/cm) for LTSOFCs was achieved at low temperature (460 degrees C).,Composite electrolyte with proton conductivity for low-temperature solid oxide fuel cell,10.1063/1.4934940
4,1011,"In this article, the ionic conduction behaviour of LTSOFCs is explained by carrying out electrochemical impedance spectroscopy measurements.",Composite electrolyte with proton conductivity for low-temperature solid oxide fuel cell,10.1063/1.4934940
5,1011,"Further, the phase and structure analysis are investigated by X-ray diffraction and scanning electron microscopy techniques.",Composite electrolyte with proton conductivity for low-temperature solid oxide fuel cell,10.1063/1.4934940
6,1011,"Finally, we achieved an ionic transport number of the composite electrolyte for LTSOFCs as high as 0.95 and energy and power density of 90% and 550 mW/cm(2), respectively, after sintering the composite electrolyte at 800 degrees C for 4 h, which is promising.",Composite electrolyte with proton conductivity for low-temperature solid oxide fuel cell,10.1063/1.4934940
7,1011,"Our current effort toward the development of an efficient, green, low-temperature solid oxide fuel cell with the incorporation of high proton conductivity composite electrolyte may open frontiers in the fields of energy and fuel cell technology.",Composite electrolyte with proton conductivity for low-temperature solid oxide fuel cell,10.1063/1.4934940
8,1011,(C) 2015,Composite electrolyte with proton conductivity for low-temperature solid oxide fuel cell,10.1063/1.4934940
9,1011,AIP Publishing LLC.,Composite electrolyte with proton conductivity for low-temperature solid oxide fuel cell,10.1063/1.4934940
