ID,Artigo,Sentencas,Titulo,DOI
1,11774,The new compositions of BaCe0.5Zr0.3Y0.15-xYbxZn0.05O3-delta perovskite electrolytes (x = 0.1 and 0.15) were prepared by solid state synthesis and final sintering at 1500 degrees C.,Enhancement of proton conductivity through Yb and Zn doping in BaCe0.5Zr0.35Y0.15O3-δ electrolyte for IT-SOFCs,
2,11774,"The obtained ceramics were investigated using X-ray diffraction, scanning electron microscopy, thermo-gravimetric analysis and impedance spectroscopy.",Enhancement of proton conductivity through Yb and Zn doping in BaCe0.5Zr0.35Y0.15O3-δ electrolyte for IT-SOFCs,
3,11774,The refinement of XRD data confirmed cubic crystal structure with Pm-3m space group for both samples.,Enhancement of proton conductivity through Yb and Zn doping in BaCe0.5Zr0.35Y0.15O3-δ electrolyte for IT-SOFCs,
4,11774,SEM morphology showed larger and compacted grains which enables obtaining of high density and high protonic conductivity.,Enhancement of proton conductivity through Yb and Zn doping in BaCe0.5Zr0.35Y0.15O3-δ electrolyte for IT-SOFCs,
5,11774,The relative densities of the samples were about 99% of the theoretical density after sintering at 1500 degrees C.,Enhancement of proton conductivity through Yb and Zn doping in BaCe0.5Zr0.35Y0.15O3-δ electrolyte for IT-SOFCs,
6,11774,"The protonic conductivities at 650 degrees C were 2.8x10(-4) S/cm and 4.2x10(-3) S/cm for x = 0.1 and 0.15, respectively.",Enhancement of proton conductivity through Yb and Zn doping in BaCe0.5Zr0.35Y0.15O3-δ electrolyte for IT-SOFCs,
7,11774,"The obtained results showed that higher Yb-content increases the ionic conductivity and both of these perovskites are promising electrolyte for intermediate temperature solid oxide fuel cells to get high efficiency, long-term stability and relatively low cost energy system.",Enhancement of proton conductivity through Yb and Zn doping in BaCe0.5Zr0.35Y0.15O3-δ electrolyte for IT-SOFCs,
