ID,Artigo,Sentencas,Titulo,DOI
1,18296,10 mol% gadolinium doped ceria (GDC10) is widely used as a barrier layer between oxygen electrode and electrolyte to prevent interfacial reactions.,Heavily neodymium doped ceria as an effective barrier layer in solid oxide electrochemical cells,10.1016/j.ijhydene.2022.07.213
2,18296,A 50 mol% neodymium doped ceria (NDC50) barrier layer has been proposed and studied in this paper.,Heavily neodymium doped ceria as an effective barrier layer in solid oxide electrochemical cells,10.1016/j.ijhydene.2022.07.213
3,18296,"Symmetrical cells with NDC50 and GDC10 barrier layers, Nd2NiO4+delta(NNO)eCe(0.5)Nd(0.5)O(2-delta)(NDC50) electrode, and YSZ electrolyte have been systematically studied using impedance spectroscopy (EIS) at various temperatures and oxygen partial pressure (pO(2)).",Heavily neodymium doped ceria as an effective barrier layer in solid oxide electrochemical cells,10.1016/j.ijhydene.2022.07.213
4,18296,The NDC50 barrier layer has significantly decreased polarization resistance across a wide temperature and pO(2) range compared to the GDC10 barrier layer.,Heavily neodymium doped ceria as an effective barrier layer in solid oxide electrochemical cells,10.1016/j.ijhydene.2022.07.213
5,18296,The rare earth C-type structure of the NDC50 barrier layer causes barrier free migration of oxygen ions resulting in improved ionic conductivity compared to GDC10.,Heavily neodymium doped ceria as an effective barrier layer in solid oxide electrochemical cells,10.1016/j.ijhydene.2022.07.213
6,18296,Distribution of relaxation time (DRT) modeling has been used to obtain insights into the electrode processes.,Heavily neodymium doped ceria as an effective barrier layer in solid oxide electrochemical cells,10.1016/j.ijhydene.2022.07.213
7,18296,(c) 2022 Hydrogen Energy Publications LLC.,Heavily neodymium doped ceria as an effective barrier layer in solid oxide electrochemical cells,10.1016/j.ijhydene.2022.07.213
8,18296,Published by Elsevier Ltd.,Heavily neodymium doped ceria as an effective barrier layer in solid oxide electrochemical cells,10.1016/j.ijhydene.2022.07.213
9,18296,All rights reserved.,Heavily neodymium doped ceria as an effective barrier layer in solid oxide electrochemical cells,10.1016/j.ijhydene.2022.07.213
