ID,Artigo,Sentencas,Titulo,DOI
1,16676,Segmented-in-series solid oxide fuel cells with relatively short cell lengths of 1.4 mm were fabricated with varying LSM cathode current collector thicknesses.,Effect of cathode sheet resistance on segmented-in-series SOFC power density,10.1016/j.jpowsour.2006.10.075
2,16676,Increasing the LSM thickness from 11 to 91 mu m yielded a factor of 2-3 area-specific resistance decrease and a similar power density increase.,Effect of cathode sheet resistance on segmented-in-series SOFC power density,10.1016/j.jpowsour.2006.10.075
3,16676,"The maximum power density measured at 800 degrees C was 0.53 W cm(-2) calculated based on total array area (including interconnect), and 0.9 W cm(-2) calculated based on active cell area.",Effect of cathode sheet resistance on segmented-in-series SOFC power density,10.1016/j.jpowsour.2006.10.075
4,16676,A segmented-in-series electrical model was used to quantitatively explain the results based on the decreased cathode sheet resistance.,Effect of cathode sheet resistance on segmented-in-series SOFC power density,10.1016/j.jpowsour.2006.10.075
5,16676,The model also showed that the cell lengths were near optimal for maximizing the power density of these cells.,Effect of cathode sheet resistance on segmented-in-series SOFC power density,10.1016/j.jpowsour.2006.10.075
6,16676,(c) 2006 Published by Elsevier B.V.,Effect of cathode sheet resistance on segmented-in-series SOFC power density,10.1016/j.jpowsour.2006.10.075
