ID,Artigo,Sentencas,Titulo,DOI
1,1721,A shielded slot was designed for use in a typical current collector/gas distributor fuel cell and was formed from a series of arches with heights suitable for providing sufficient quantities of fuel gases and reaction areas.,Effect of a shielded slot on a planar solid oxide fuel cell,10.1016/j.ijhydene.2014.06.117
2,1721,The shielded slot was substituted in place of the interconnect and offered several advantages in terms of mechanical support and electrical contact.,Effect of a shielded slot on a planar solid oxide fuel cell,10.1016/j.ijhydene.2014.06.117
3,1721,A three-dimensional (3-D) electrochemical reaction model and a microelectrode model of the planar solid oxide fuel cells (SOFC) were used to predict the performances of the shielded slots in planar SOFCs.,Effect of a shielded slot on a planar solid oxide fuel cell,10.1016/j.ijhydene.2014.06.117
4,1721,"Prior to analyzing the complex arrangement of the shielded slot, a variety of interconnect arrangements were simulated to understand the relationship between the gas supply and the electrical contact arrangements.",Effect of a shielded slot on a planar solid oxide fuel cell,10.1016/j.ijhydene.2014.06.117
5,1721,The reactivity properties were examined and the most effective arrangement of shielded slots was identified in an effort to design an optimal shielded slot.,Effect of a shielded slot on a planar solid oxide fuel cell,10.1016/j.ijhydene.2014.06.117
6,1721,"Copyright (C) 2014, Hydrogen Energy Publications, LLC.",Effect of a shielded slot on a planar solid oxide fuel cell,10.1016/j.ijhydene.2014.06.117
7,1721,Published by Elsevier Ltd.,Effect of a shielded slot on a planar solid oxide fuel cell,10.1016/j.ijhydene.2014.06.117
8,1721,All rights reserved.,Effect of a shielded slot on a planar solid oxide fuel cell,10.1016/j.ijhydene.2014.06.117
