ID,Artigo,Sentencas,Titulo,DOI
1,18663,"First principles total-energy calculations of an ideal BSCF perovskite-type solid solution, the crystal containing basic point defects, and a set of relevant solid-solid solutions are presented.","First principles calculations of (Ba,Sr)(Co,Fe)O3-δ structural stability",10.1016/j.ssi.2012.08.022
2,18663,"Our DFT modeling of defects (Frenkel, Schottky and cation exchange) and disordering in the BSCF perovskites reveals that the material tends to decompose at relatively low temperatures into a mixture of new perovskite and oxide phases.","First principles calculations of (Ba,Sr)(Co,Fe)O3-δ structural stability",10.1016/j.ssi.2012.08.022
3,18663,These new phases are likely to appear at grain boundaries and surface interfaces.,"First principles calculations of (Ba,Sr)(Co,Fe)O3-δ structural stability",10.1016/j.ssi.2012.08.022
4,18663,This instability is predicted to negate advantages of fast oxygen transport chemistry and impede the applicability of BSCF-based SOFC and ceramic permeation membranes.,"First principles calculations of (Ba,Sr)(Co,Fe)O3-δ structural stability",10.1016/j.ssi.2012.08.022
5,18663,We discuss possible mechanisms and origins of defect-induced (in)stability in the context of available experiments.,"First principles calculations of (Ba,Sr)(Co,Fe)O3-δ structural stability",10.1016/j.ssi.2012.08.022
6,18663,"This research explains the observed SOFC performance reduction, the significant scattering in the reported degree of oxygen nonstoichiometry, and provides insights on enhancing mass transport and energy conversion in SOFC and oxygen separation ceramic membranes.","First principles calculations of (Ba,Sr)(Co,Fe)O3-δ structural stability",10.1016/j.ssi.2012.08.022
7,18663,Published by Elsevier B.V.,"First principles calculations of (Ba,Sr)(Co,Fe)O3-δ structural stability",10.1016/j.ssi.2012.08.022
