ID,Artigo,Sentencas,Titulo,DOI
1,17683,"In the present study, the ionic conductivity of the 14 mol%-yttria stabilized zirconia single crystal subjected to the tensile or compressive stress was examined at various temperatures.",Effect of uniaxial stress on ionic conductivity of 14 mol%-yttria-stabilized zirconia single crystal,10.1016/j.ssi.2011.04.009
2,17683,The conductivity was increased by the tensile stress and the improvement in the conductivity was higher at the lower temperature and also for the specimen with the < 100 > orientation.,Effect of uniaxial stress on ionic conductivity of 14 mol%-yttria-stabilized zirconia single crystal,10.1016/j.ssi.2011.04.009
3,17683,"On the other hand, the conductivity was decreased by the compressive stress.",Effect of uniaxial stress on ionic conductivity of 14 mol%-yttria-stabilized zirconia single crystal,10.1016/j.ssi.2011.04.009
4,17683,"The change by the compressive stress was higher at the lower temperature, but it was generally smaller than that in the tensile test.",Effect of uniaxial stress on ionic conductivity of 14 mol%-yttria-stabilized zirconia single crystal,10.1016/j.ssi.2011.04.009
5,17683,The maximum improvement achieved by applying the tensile stress was about 18% at 850 K in the present study.,Effect of uniaxial stress on ionic conductivity of 14 mol%-yttria-stabilized zirconia single crystal,10.1016/j.ssi.2011.04.009
6,17683,The present experimental results qualitatively agreed with the molecular dynamics simulations on the oxygen diffusion.,Effect of uniaxial stress on ionic conductivity of 14 mol%-yttria-stabilized zirconia single crystal,10.1016/j.ssi.2011.04.009
7,17683,The oxygen displacement in the fluorite lattice caused by the applied stress could be attributed to the change in the conductivity.,Effect of uniaxial stress on ionic conductivity of 14 mol%-yttria-stabilized zirconia single crystal,10.1016/j.ssi.2011.04.009
8,17683,(C) 2011,Effect of uniaxial stress on ionic conductivity of 14 mol%-yttria-stabilized zirconia single crystal,10.1016/j.ssi.2011.04.009
9,17683,Elsevier B.V. All rights reserved.,Effect of uniaxial stress on ionic conductivity of 14 mol%-yttria-stabilized zirconia single crystal,10.1016/j.ssi.2011.04.009
