ID,Artigo,Sentencas,Titulo,DOI
1,11182,Asymmetric-porous hollow-fiber has been fabricated by a phase-inversion process and employed as the hydrogen electrode for micro-tubular solid oxide cell (MT-SOC).,Performances of micro-tubular solid oxide cell with novel asymmetric porous hydrogen electrode,10.1016/j.electacta.2010.09.052
2,11182,The microstructure and electrochemical properties of MT-SOC were investigated in detail.,Performances of micro-tubular solid oxide cell with novel asymmetric porous hydrogen electrode,10.1016/j.electacta.2010.09.052
3,11182,The asymmetric-porous hydrogen electrode possesses unique two layer finger-like porous micro-structure with a thin functional layer and a thick fuel delivery layer.,Performances of micro-tubular solid oxide cell with novel asymmetric porous hydrogen electrode,10.1016/j.electacta.2010.09.052
4,11182,"When the MT-SOC was operated in fuel cell mode, maximum power densities of 0.54, 0.71 and 1.25 W/cm(2) were obtained at 800,850 and 900 degrees C, respectively.",Performances of micro-tubular solid oxide cell with novel asymmetric porous hydrogen electrode,10.1016/j.electacta.2010.09.052
5,11182,"On the other hand, when the MT-SOC was operated in electrolysis mode at 900 degrees C with an applied voltage of 1.3 V. current densities of 0.68 A/cm(2) and 2.57 A/cm(2) were obtained at 30 vol.% and 80 vol.% absolute humidity (AH), respectively.",Performances of micro-tubular solid oxide cell with novel asymmetric porous hydrogen electrode,10.1016/j.electacta.2010.09.052
6,11182,These results indicate that novel-microstructured MT-SOC can be effectively fabricated towards high performance fuel cell and electrolysis cell.,Performances of micro-tubular solid oxide cell with novel asymmetric porous hydrogen electrode,10.1016/j.electacta.2010.09.052
7,11182,(C) 2010,Performances of micro-tubular solid oxide cell with novel asymmetric porous hydrogen electrode,10.1016/j.electacta.2010.09.052
8,11182,Elsevier Ltd.,Performances of micro-tubular solid oxide cell with novel asymmetric porous hydrogen electrode,10.1016/j.electacta.2010.09.052
9,11182,All rights reserved.,Performances of micro-tubular solid oxide cell with novel asymmetric porous hydrogen electrode,10.1016/j.electacta.2010.09.052
