ID,Artigo,Sentencas,Titulo,DOI
1,13651,Mixed ionic and electronic conducting (MIEC) materials recently gained much interest for use as anodes in solid oxide fuel cell (SOFC) applications.,Modeling the impedance response and steady state behaviour of porous CGO-based MIEC anodes,10.1039/d1cp01962g
2,13651,"However, many processes in MIEC-based porous anodes are still poorly understood and the appropriate interpretation of corresponding electrochemical impedance spectroscopy (EIS) data is challenging.",Modeling the impedance response and steady state behaviour of porous CGO-based MIEC anodes,10.1039/d1cp01962g
3,13651,"Therefore, a model which is capable to capture all relevant physico-chemical processes is a crucial prerequisite for systematic materials optimization.",Modeling the impedance response and steady state behaviour of porous CGO-based MIEC anodes,10.1039/d1cp01962g
4,13651,In this contribution we present a comprehensive model for MIEC-based anodes providing both the DC-behaviour and the EIS-spectra.,Modeling the impedance response and steady state behaviour of porous CGO-based MIEC anodes,10.1039/d1cp01962g
5,13651,"The model enables one to distinguish between the impact of the chemical capacitance, the reaction resistance, the gas impedance and the charge transport resistance on the EIS-spectrum and therewith allows its appropriate interpretation for button cell conditions.",Modeling the impedance response and steady state behaviour of porous CGO-based MIEC anodes,10.1039/d1cp01962g
6,13651,Typical MIEC-features are studied with the model applied to gadolinium doped ceria (CGO) anodes with different microstructures.,Modeling the impedance response and steady state behaviour of porous CGO-based MIEC anodes,10.1039/d1cp01962g
7,13651,The results obtained for CGO anodes reveal the spatial distribution of the reaction zone and associated transport distances for the charge carriers and gas species.,Modeling the impedance response and steady state behaviour of porous CGO-based MIEC anodes,10.1039/d1cp01962g
8,13651,"Moreover, parameter spaces for transport limited and surface reaction limited situations are depicted.",Modeling the impedance response and steady state behaviour of porous CGO-based MIEC anodes,10.1039/d1cp01962g
9,13651,"By linking bulk material properties, microstructure effects and the cell design with the cell performance, we present a way towards a systematic materials optimization for MIEC-based anodes.",Modeling the impedance response and steady state behaviour of porous CGO-based MIEC anodes,10.1039/d1cp01962g
