ID,Artigo,Sentencas,Titulo,DOI
1,1228,Effects of SO2 in ambient air on the performance and durability of solid oxide fuel cell(SOFC) cathode were evaluated by galvanostatic measurement.,Effect of SO2 on Performance of Solid Oxide Fuel Cell Cathodes,
2,1228,Comparison between two cathode materials was made to consider the cathode degradation mechanisms.,Effect of SO2 on Performance of Solid Oxide Fuel Cell Cathodes,
3,1228,The degradation performance is associated with a slow decomposition of the La0.6Sr0.4Co0.2Fe0.8O3(LSCF) due to the segregation of strontium oxide.,Effect of SO2 on Performance of Solid Oxide Fuel Cell Cathodes,
4,1228,Negligible deterioration for (La0.7Sr0.3)MnO3 (LSM) cathode was caused by SO2 poisoning under a current density of 200 mA/cm(2).,Effect of SO2 on Performance of Solid Oxide Fuel Cell Cathodes,
5,1228,Metal sulphate formation may explain a slight deterioration under increasing high the concentration of SO2.,Effect of SO2 on Performance of Solid Oxide Fuel Cell Cathodes,
6,1228,It was verified that the poisoning mechanism for the two cathode materials resulted from the gradual decomposition of the cathode materials.,Effect of SO2 on Performance of Solid Oxide Fuel Cell Cathodes,
