ID,Artigo,Sentencas,Titulo,DOI
1,13357,La0.2Sr0.25Ca0.45TiO3 is a carefully selected composition to provide optimal ceramic and electrical characteristics for use as an anode support in solid oxide fuel cells.,Preparation via a solution method of La0.2Sr0.25Ca0.45TiO3 and its characterization for anode supported solid oxide fuel cells,10.1039/c3ta12860a
2,13357,"In this study we focus on the process optimization and characterization of A-site deficient perovskite, La0.2Sr0.25Ca0.45TiO3 (LSCTA-), powders prepared via a solution method to be integrated into the SOFC anode supports.",Preparation via a solution method of La0.2Sr0.25Ca0.45TiO3 and its characterization for anode supported solid oxide fuel cells,10.1039/c3ta12860a
3,13357,A Pechini method has been applied to successfully produce single phase perovskite at 900 degrees C. Processing conditions have been modified to yield a powder that displays a similar sintering profile to commercial yttria stabilised zirconia.,Preparation via a solution method of La0.2Sr0.25Ca0.45TiO3 and its characterization for anode supported solid oxide fuel cells,10.1039/c3ta12860a
4,13357,The conductivity behavior of porous bodies under redox has been investigated showing a 2 stage process in both oxidation and reduction cycling that exhibits strong reversibility.,Preparation via a solution method of La0.2Sr0.25Ca0.45TiO3 and its characterization for anode supported solid oxide fuel cells,10.1039/c3ta12860a
5,13357,"For the reduction process, addition of impregnated ceria reduces the onset delay period and increases the apparent rate constant, k values, by 30-50% for both stages.",Preparation via a solution method of La0.2Sr0.25Ca0.45TiO3 and its characterization for anode supported solid oxide fuel cells,10.1039/c3ta12860a
6,13357,"The addition of ceria had less influence on the oxidation kinetics, although the conductivity values of both oxidised and reduced porous bodies were enhanced.",Preparation via a solution method of La0.2Sr0.25Ca0.45TiO3 and its characterization for anode supported solid oxide fuel cells,10.1039/c3ta12860a
