ID,Artigo,Sentencas,Titulo,DOI
1,18135,"The effects of the substitution of Co with Mn in the crystal structure, oxygen content, thermal stability and expansion and electrical properties of GdBaCo2-xMnxO5+delta (0 <= x <= 2) oxides are reported.",Crystal structure and compositional effects on the electrical and electrochemical properties of GdBaCo2-xMnxO5+δ (0 ≤ x ≤ 2) oxides for use as air electrodes in solid oxide fuel cells,10.1039/c7ta10923g
2,18135,Composites of GdBaCo2-xMnxO5+delta-Ce0.9Gd0.1O2-delta (70 : 30 wt%) are used as cathode materials and their electrochemical behaviour is presented.,Crystal structure and compositional effects on the electrical and electrochemical properties of GdBaCo2-xMnxO5+δ (0 ≤ x ≤ 2) oxides for use as air electrodes in solid oxide fuel cells,10.1039/c7ta10923g
3,18135,Layered-type ordering of Ba and Gd cations in the perovskite structure occurs in the whole system when the materials are prepared in argon but only for compositions in the range corresponding to x < 1.4 when the materials are prepared in air.,Crystal structure and compositional effects on the electrical and electrochemical properties of GdBaCo2-xMnxO5+δ (0 ≤ x ≤ 2) oxides for use as air electrodes in solid oxide fuel cells,10.1039/c7ta10923g
4,18135,"The oxygen content increases with increasing the Mn content, causing thermal stability to improve and thermal expansion to decrease.",Crystal structure and compositional effects on the electrical and electrochemical properties of GdBaCo2-xMnxO5+δ (0 ≤ x ≤ 2) oxides for use as air electrodes in solid oxide fuel cells,10.1039/c7ta10923g
5,18135,"However, lowering of the dc conductivity and an increase of electrode polarization resistances are observed by Mn substitution for Co. Cation ordering of the Gd and Ba atoms seems to affect the electrochemical properties of the materials.",Crystal structure and compositional effects on the electrical and electrochemical properties of GdBaCo2-xMnxO5+δ (0 ≤ x ≤ 2) oxides for use as air electrodes in solid oxide fuel cells,10.1039/c7ta10923g
