ID,Artigo,Sentencas,Titulo,DOI
1,10118,Yttria-stabilized Zirconia (YSZ) is deposited on anode substrates by two untreated and thermally assisted slurry spin coating methods.,Fabrication of YSZ electrolyte layers using thermally assisted slurry spin coating method for IT-SOFC application,10.1007/s00706-021-02884-7
2,10118,"During the spin coating process, the heating of the substrate increases the affected area and optimally densifies the particles before sintering.",Fabrication of YSZ electrolyte layers using thermally assisted slurry spin coating method for IT-SOFC application,10.1007/s00706-021-02884-7
3,10118,We find out that the thermally assisted deposition method can reduce the activation energies of both interfacial and Ohmic resistances with respect to the conventional way.,Fabrication of YSZ electrolyte layers using thermally assisted slurry spin coating method for IT-SOFC application,10.1007/s00706-021-02884-7
4,10118,The output power measurements show higher values for the samples prepared by this method.,Fabrication of YSZ electrolyte layers using thermally assisted slurry spin coating method for IT-SOFC application,10.1007/s00706-021-02884-7
5,10118,The electrochemical impedance spectroscopy measurements of single cells also show that both resistances reduce.,Fabrication of YSZ electrolyte layers using thermally assisted slurry spin coating method for IT-SOFC application,10.1007/s00706-021-02884-7
6,10118,Scanning electron microscopy studies show that the porosity of the YSZ layer coated by the proposed method is lower than that of the untreated layer.,Fabrication of YSZ electrolyte layers using thermally assisted slurry spin coating method for IT-SOFC application,10.1007/s00706-021-02884-7
