ID,Artigo,Sentencas,Titulo,DOI
1,15308,An extended surface modeling concept (electrochemical fin) is applied to charge transport within the SOFC electrode microstructure using an analytical modeling approach analogous to thermal fin analysis.,Analytical investigations of varying cross section microstructures on charge transfer in solid oxide fuel cell electrodes,10.1016/j.jpowsour.2010.12.103
2,15308,This model is distinct from similar approaches applied to SOFC electrode microstructure in its application of a governing equation that allows for variable cross-section geometry.,Analytical investigations of varying cross section microstructures on charge transfer in solid oxide fuel cell electrodes,10.1016/j.jpowsour.2010.12.103
3,15308,"The model presented is capable of replicating experimentally observed electrode behavior inclusive of sensitivity to microstructural geometry, which stands in contrast to existing models that apply governing equations analogous to a constant cross-section thermal fin equation.",Analytical investigations of varying cross section microstructures on charge transfer in solid oxide fuel cell electrodes,10.1016/j.jpowsour.2010.12.103
4,15308,"Insights learned from this study include: the establishment of a suite of dimensionless parameters and performance metrics that can be applied to assess electrode microstructure, the definition of microstructure-related transport regimes relevant to electrode design, and correlations that allow performance predictions for electrodes that provide cell structural support.",Analytical investigations of varying cross section microstructures on charge transfer in solid oxide fuel cell electrodes,10.1016/j.jpowsour.2010.12.103
5,15308,"Of particular note, the variable cross-section modeling approach motivates the definition of a sintering quality parameter that quantifies the degree of constriction within the conducting network of the electrode, a phenomenon that exerts influence over electrode polarization.",Analytical investigations of varying cross section microstructures on charge transfer in solid oxide fuel cell electrodes,10.1016/j.jpowsour.2010.12.103
6,15308,One-dimensional models are presented for electrochemical fins of several cross-sectional geometries with the ultimate goal of developing a general tool that enables the prompt performance evaluation of electrode microstructures.,Analytical investigations of varying cross section microstructures on charge transfer in solid oxide fuel cell electrodes,10.1016/j.jpowsour.2010.12.103
7,15308,Such a tool would facilitate SOFC microstructural design by focusing more detailed modeling efforts on the most promising microstructures.,Analytical investigations of varying cross section microstructures on charge transfer in solid oxide fuel cell electrodes,10.1016/j.jpowsour.2010.12.103
8,15308,(C) 2011,Analytical investigations of varying cross section microstructures on charge transfer in solid oxide fuel cell electrodes,10.1016/j.jpowsour.2010.12.103
9,15308,Elsevier B.V. All rights reserved.,Analytical investigations of varying cross section microstructures on charge transfer in solid oxide fuel cell electrodes,10.1016/j.jpowsour.2010.12.103
