ID,Artigo,Sentencas,Titulo,DOI
1,11552,Sluggish oxygen reduction reaction (ORR) kinetics and chemical instability of cathode materials hinder the practical application of solid oxide fuel cells (SOFCs).,Highly Active and Stable Cobalt-Free Hafnium-doped SrFe0.9Hf0.1O3-δ Perovskite Cathode for Solid Oxide Fuel Cells,10.1021/acsaem.8b00198
2,11552,Here we report a Co-free Hf-doped SrFe0.9Hf0.1O3-delta (SFHf) perovskite oxide as a potential cathode focusing on enhancing the ORR activity and chemical stability.,Highly Active and Stable Cobalt-Free Hafnium-doped SrFe0.9Hf0.1O3-δ Perovskite Cathode for Solid Oxide Fuel Cells,10.1021/acsaem.8b00198
3,11552,"We find that SFHf exhibits a high ORR activity, stable cubic crystal structure, and improved chemical stability toward CO2 poisoning compared to undoped SrFeO3-delta.",Highly Active and Stable Cobalt-Free Hafnium-doped SrFe0.9Hf0.1O3-δ Perovskite Cathode for Solid Oxide Fuel Cells,10.1021/acsaem.8b00198
4,11552,The SFHf cathode has a polarization area-specific resistance as low as 0.193 Omega cm(2) at 600 degrees C in a SFHflSm(0.2)Ce(0.8)O(1.9),Highly Active and Stable Cobalt-Free Hafnium-doped SrFe0.9Hf0.1O3-δ Perovskite Cathode for Solid Oxide Fuel Cells,10.1021/acsaem.8b00198
5,11552,(SDC)ISFHf symmetrical cell and has a maximum power density as high as 1.94 W cm(-2) at 700 degrees C in an anode-supported fuel cell (Ni+(ZrO2)(0.92)(Y2O3)(0.08) (YSZ)vertical bar YSZ vertical bar SDC vertical bar SFHf).,Highly Active and Stable Cobalt-Free Hafnium-doped SrFe0.9Hf0.1O3-δ Perovskite Cathode for Solid Oxide Fuel Cells,10.1021/acsaem.8b00198
6,11552,The ORR activity maintains stable for a period air and in CO2-containing atmosphere.,Highly Active and Stable Cobalt-Free Hafnium-doped SrFe0.9Hf0.1O3-δ Perovskite Cathode for Solid Oxide Fuel Cells,10.1021/acsaem.8b00198
7,11552,"The attractive ORR activity is attributed to the moderate concentration of oxygen vacancy and electrical conductivity, as well as the fast oxygen kinetics at the operation temperature.",Highly Active and Stable Cobalt-Free Hafnium-doped SrFe0.9Hf0.1O3-δ Perovskite Cathode for Solid Oxide Fuel Cells,10.1021/acsaem.8b00198
8,11552,The improved chemical stability is related to the doping of the redox-inactive Hf cation in the Fe site of SrFeO3-delta by decreasing oxygen vacancy concentration and increasing metal oxygen bond energy.,Highly Active and Stable Cobalt-Free Hafnium-doped SrFe0.9Hf0.1O3-δ Perovskite Cathode for Solid Oxide Fuel Cells,10.1021/acsaem.8b00198
9,11552,This work proposes an effective strategy in the design of highly active and stable cathodes for SOFCs.,Highly Active and Stable Cobalt-Free Hafnium-doped SrFe0.9Hf0.1O3-δ Perovskite Cathode for Solid Oxide Fuel Cells,10.1021/acsaem.8b00198
