ID,Artigo,Sentencas,Titulo,DOI
1,13055,Solid oxide fuel cells (SOFCs) are power-generating devices with high efficiencies and considered as promising alternatives to mitigate energy and environmental issues associated with fossil fuel technologies.,Nanoengineering of cathode layers for solid oxide fuel cells to achieve superior power densities,10.1038/s41467-021-24255-w
2,13055,Nanoengineering of electrodes utilized for SOFCs has emerged as a versatile tool for significantly enhancing the electrochemical performance but needs to overcome issues for integration into practical cells suitable for widespread application.,Nanoengineering of cathode layers for solid oxide fuel cells to achieve superior power densities,10.1038/s41467-021-24255-w
3,13055,"Here, we report an innovative concept for high-performance thin-film cathodes comprising nanoporous La0.6Sr0.4CoO3-delta cathodes in conjunction with highly ordered, self-assembled nanocomposite La0.6Sr0.4Co0.2Fe0.8O3-delta (lanthanum strontium cobalt ferrite) and Ce0.9Gd0.1O2-delta (gadolinia-doped ceria) cathode layers prepared using pulsed laser deposition.",Nanoengineering of cathode layers for solid oxide fuel cells to achieve superior power densities,10.1038/s41467-021-24255-w
4,13055,"Integration of the nanoengineered cathode layers into conventional anode-supported cells enabled the achievement of high current densities at 0.7 V reaching similar to 2.2 and similar to 4.7 A/cm(2) at 650 degrees C and 700 degrees C, respectively.",Nanoengineering of cathode layers for solid oxide fuel cells to achieve superior power densities,10.1038/s41467-021-24255-w
5,13055,This result demonstrates that tuning material properties through an effective nanoengineering approach could significantly boost the electrochemical performance of cathodes for development of next-generation SOFCs with high power output.,Nanoengineering of cathode layers for solid oxide fuel cells to achieve superior power densities,10.1038/s41467-021-24255-w
