ID,Artigo,Sentencas,Titulo,DOI
1,10390,The performance of solid oxide fuel cells (SOFCs) can be degraded by chromium poisoning where thermally grown Cr2O3 on metallic surfaces forms volatile Cr-containing species that are redeposited on active regions of the cathode.,Alternating-Current Electrophoretic Deposition of Spinel Coatings on Porous Metallic Substrates for Solid Oxide Fuel Cell Applications,10.1007/s11837-021-04763-2
2,10390,This phenomenon is further exacerbated for porous metallic interconnects and metal-supported electrodes due to their large surface-to-volume ratios.,Alternating-Current Electrophoretic Deposition of Spinel Coatings on Porous Metallic Substrates for Solid Oxide Fuel Cell Applications,10.1007/s11837-021-04763-2
3,10390,"In this study, electrophoretic deposition (EPD) of CuNi0.2Mn1.8O4 spinel powders on porous SUS430 metallic substrates using alternating current (AC) was explored.",Alternating-Current Electrophoretic Deposition of Spinel Coatings on Porous Metallic Substrates for Solid Oxide Fuel Cell Applications,10.1007/s11837-021-04763-2
4,10390,"Two-step densification heat treatment was used to form a thin, uniform, protective spinel coating.",Alternating-Current Electrophoretic Deposition of Spinel Coatings on Porous Metallic Substrates for Solid Oxide Fuel Cell Applications,10.1007/s11837-021-04763-2
5,10390,The area-specific resistance (ASR) and weight gain were tracked during 100-h oxidation tests at 700 degrees C in air.,Alternating-Current Electrophoretic Deposition of Spinel Coatings on Porous Metallic Substrates for Solid Oxide Fuel Cell Applications,10.1007/s11837-021-04763-2
6,10390,"The results showed that, despite the considerable complexity of the sample shape, AC EPD was able to form a protective coating layer that significantly limited the growth rate of the thermally grown oxide (TGO) by reducing the k(g) value by a factor of 25.",Alternating-Current Electrophoretic Deposition of Spinel Coatings on Porous Metallic Substrates for Solid Oxide Fuel Cell Applications,10.1007/s11837-021-04763-2
