ID,Artigo,Sentencas,Titulo,DOI
1,10033,"Metal-supported solid oxide fuel cells with symmetric architecture, having metal supports on both sides of the cell, are scaled up from button cell size to large 50 cm(2) active area cell size.",Scaleup and manufacturability of symmetric-structured metal-supported solid oxide fuel cells,10.1016/j.jpowsour.2020.229439
2,10033,The cells remain flat after sintering assisted by the symmetric structure.,Scaleup and manufacturability of symmetric-structured metal-supported solid oxide fuel cells,10.1016/j.jpowsour.2020.229439
3,10033,"Equivalent performance is achieved for button cells and large cells, and thermal cycling and redox cycling tolerance are demonstrated for the large cells.",Scaleup and manufacturability of symmetric-structured metal-supported solid oxide fuel cells,10.1016/j.jpowsour.2020.229439
4,10033,The catalyst infiltration process is improved to enable high-throughput manufacturing.,Scaleup and manufacturability of symmetric-structured metal-supported solid oxide fuel cells,10.1016/j.jpowsour.2020.229439
5,10033,"The cumbersome lab-scale molten nitrate infiltration process is replaced with a room-temperature process in which a shelf-stable aqueous solution of nitrate salts is applied to the cell by spraying, painting, or other scalable techniques.",Scaleup and manufacturability of symmetric-structured metal-supported solid oxide fuel cells,10.1016/j.jpowsour.2020.229439
6,10033,"A fast-ramp thermal conversion of the nitrate salts to the final oxide catalyst composition is implemented, allowing many infiltration cycles to be accomplished in a single work shift.",Scaleup and manufacturability of symmetric-structured metal-supported solid oxide fuel cells,10.1016/j.jpowsour.2020.229439
7,10033,Increasing the number of infiltration cycles from 5 to 10 led to an increase in peak power density from approximately 0.3 to 0.52 W cm(-2).,Scaleup and manufacturability of symmetric-structured metal-supported solid oxide fuel cells,10.1016/j.jpowsour.2020.229439
