ID,Artigo,Sentencas,Titulo,DOI
1,1317,"In this study, a two-dimensional model including the governing equations of mass, momentum, species, energy and charge, is developed and then applied to investigate the performance and multiphysics transport processes of solid oxide fuel cells with counter-flow arrangement.",Performance and Transport Characteristics of Solid Oxide Fuel Cells with Counter Flow Arrangement,10.20964/2020.02.32
2,1317,"The current density and power density are calculated and presented, and the distributions of species and temperature are also analyzed.",Performance and Transport Characteristics of Solid Oxide Fuel Cells with Counter Flow Arrangement,10.20964/2020.02.32
3,1317,"In addition, temperature distributions of fuel cells with varying operating temperature, anode inlet flow velocity and cathode inlet flow velocity are demonstrated.",Performance and Transport Characteristics of Solid Oxide Fuel Cells with Counter Flow Arrangement,10.20964/2020.02.32
4,1317,The results show that the temperature gradient increases with increasing operating temperature.,Performance and Transport Characteristics of Solid Oxide Fuel Cells with Counter Flow Arrangement,10.20964/2020.02.32
5,1317,"And the local temperature decreases with increasing inlet flow velocities, especially the increasing cathode inlet flow velocity.",Performance and Transport Characteristics of Solid Oxide Fuel Cells with Counter Flow Arrangement,10.20964/2020.02.32
