ID,Artigo,Sentencas,Titulo,DOI
1,18529,"Aerosol deposition is a unique spray coating process to deposit dense ceramic films directly at room temperature just by spraying a dry powder, without any binder or additional sintering step needed.",In- and through-plane conductivity of 8YSZ films produced at room temperature by aerosol deposition,10.1007/s10853-019-03844-7
2,18529,"Therefore, it is a very promising coating method for functional materials that may be used to produce a variety of electrochemical devices, solid oxide fuel cells or gas sensors.",In- and through-plane conductivity of 8YSZ films produced at room temperature by aerosol deposition,10.1007/s10853-019-03844-7
3,18529,"However, functional properties like the electrical conductivity significantly depend on the microstructure of the produced film.",In- and through-plane conductivity of 8YSZ films produced at room temperature by aerosol deposition,10.1007/s10853-019-03844-7
4,18529,"Consequently, anisotropic film properties may occur even for isotropic functional materials.",In- and through-plane conductivity of 8YSZ films produced at room temperature by aerosol deposition,10.1007/s10853-019-03844-7
5,18529,"In this work, films of oxide ion-conducting yttria-stabilized zirconia (YSZ) were produced by aerosol deposition.",In- and through-plane conductivity of 8YSZ films produced at room temperature by aerosol deposition,10.1007/s10853-019-03844-7
6,18529,The orientation-dependent electrical conductivity was measured using two different electrode configurations: one for the in-plane conductivity and another one for through-plane measurements.,In- and through-plane conductivity of 8YSZ films produced at room temperature by aerosol deposition,10.1007/s10853-019-03844-7
7,18529,"A slight anisotropy was observed, attributed to the present film morphology.",In- and through-plane conductivity of 8YSZ films produced at room temperature by aerosol deposition,10.1007/s10853-019-03844-7
8,18529,"In particular, the grain boundaries influenced the total conductivity.",In- and through-plane conductivity of 8YSZ films produced at room temperature by aerosol deposition,10.1007/s10853-019-03844-7
9,18529,"Furthermore, a thermal post-deposition treatment significantly affected the total conductivity of aerosol-deposited YSZ films.",In- and through-plane conductivity of 8YSZ films produced at room temperature by aerosol deposition,10.1007/s10853-019-03844-7
