ID,Artigo,Sentencas,Titulo,DOI
1,14773,"The structure, electrical conducting, thermal expansion and electrocatalytic properties of Ln(0.3)Sr(0.7)Fe(0.7)Cr(0.3)O(3-delta) (Ln = La, Pr, Nd, Sm) perovskites were investigated to evaluate their potential for cathodes of intermediate temperature solid oxide fuel cells (IT-SOFCs).",Property optimization for strontium-rich lanthanum chromium ferrite cathodes: A demonstration of lanthanide replacement effect,10.1016/j.materresbull.2018.05.031
2,14773,Reducing the size of the lanthanide cations enhanced the deformation of the perovskite structures and decreased the dimension of the primitive unit cells.,Property optimization for strontium-rich lanthanum chromium ferrite cathodes: A demonstration of lanthanide replacement effect,10.1016/j.materresbull.2018.05.031
3,14773,"Meanwhile, the oxygen nonstoichiometry (delta) values at elevated temperatures slightly increased.",Property optimization for strontium-rich lanthanum chromium ferrite cathodes: A demonstration of lanthanide replacement effect,10.1016/j.materresbull.2018.05.031
4,14773,"The electrical conductivity degraded with smaller lanthanide cation sizes, while the thermal expansion coefficients (TECs) tended to decrease.",Property optimization for strontium-rich lanthanum chromium ferrite cathodes: A demonstration of lanthanide replacement effect,10.1016/j.materresbull.2018.05.031
5,14773,These property changes were diagnosed with respect to the corresponding structural evolutions.,Property optimization for strontium-rich lanthanum chromium ferrite cathodes: A demonstration of lanthanide replacement effect,10.1016/j.materresbull.2018.05.031
6,14773,Sm0.3Sr0.7Fe0.7Cr0.3O3-delta was identified to be the optimal composition after an overall property assessment.,Property optimization for strontium-rich lanthanum chromium ferrite cathodes: A demonstration of lanthanide replacement effect,10.1016/j.materresbull.2018.05.031
7,14773,"This composition exhibited an average TEC (similar to 14 x 10(-6)K(-1) between 40 and 1000 degrees C) compatible with IT-SOFC electrolytes, eligible electrical conductivity and good electrocatalytic activity.",Property optimization for strontium-rich lanthanum chromium ferrite cathodes: A demonstration of lanthanide replacement effect,10.1016/j.materresbull.2018.05.031
8,14773,The good overall properties of Sm0.3Sr0.7Fe0.7Cr0.3O3-delta demonstrate that this composition is a promising cathode material for IT-SOFCs.,Property optimization for strontium-rich lanthanum chromium ferrite cathodes: A demonstration of lanthanide replacement effect,10.1016/j.materresbull.2018.05.031
