ID,Artigo,Sentencas,Titulo,DOI
1,13709,Nanoionics has become increasingly important in devices and systems related to energy conversion and storage.,Nanoionics and Nanocatalysts: Conformal Mesoporous Surface Scaffold for Cathode of Solid Oxide Fuel Cells,10.1038/srep32997
2,13709,"Nevertheless, nanoionics and nanostructured electrodes development has been challenging for solid oxide fuel cells (SOFCs) owing to many reasons including poor stability of the nanocrystals during fabrication of SOFCs at elevated temperatures.",Nanoionics and Nanocatalysts: Conformal Mesoporous Surface Scaffold for Cathode of Solid Oxide Fuel Cells,10.1038/srep32997
3,13709,"In this study, a conformal mesoporous ZrO2 nanoionic network was formed on the surface of La1- xSrxMnO3/yttria-stabilized zirconia (LSM/YSZ)",Nanoionics and Nanocatalysts: Conformal Mesoporous Surface Scaffold for Cathode of Solid Oxide Fuel Cells,10.1038/srep32997
4,13709,cathode backbone using Atomic Layer Deposition (ALD) and thermal treatment.,Nanoionics and Nanocatalysts: Conformal Mesoporous Surface Scaffold for Cathode of Solid Oxide Fuel Cells,10.1038/srep32997
5,13709,"The surface layer nanoionic network possesses open mesopores for gas penetration, and features a high density of grain boundaries for enhanced ion-transport.",Nanoionics and Nanocatalysts: Conformal Mesoporous Surface Scaffold for Cathode of Solid Oxide Fuel Cells,10.1038/srep32997
6,13709,The mesoporous nanoionic network is remarkably stable and retains the same morphology after electrochemical operation at high temperatures of 650-800 degrees C for 400 hours.,Nanoionics and Nanocatalysts: Conformal Mesoporous Surface Scaffold for Cathode of Solid Oxide Fuel Cells,10.1038/srep32997
7,13709,The stable mesoporous ZrO2 nanoionic network is further utilized to anchor catalytic Pt nanocrystals and create a nanocomposite that is stable at elevated temperatures.,Nanoionics and Nanocatalysts: Conformal Mesoporous Surface Scaffold for Cathode of Solid Oxide Fuel Cells,10.1038/srep32997
8,13709,The power density of the ALD modified and inherently functional commercial cells exhibited enhancement by a factor of 1.5-1.7 operated at 0.8 V at 750 degrees C.,Nanoionics and Nanocatalysts: Conformal Mesoporous Surface Scaffold for Cathode of Solid Oxide Fuel Cells,10.1038/srep32997
