ID,Artigo,Sentencas,Titulo,DOI
1,16577,Spray pyrolysis has been applied to deposit a wide variety of thin films.,Thin film deposition using spray pyrolysis,10.1007/s10832-005-0870-x
2,16577,"These films were used in various devices such as solar cells, sensors, and solid oxide fuel cells.",Thin film deposition using spray pyrolysis,10.1007/s10832-005-0870-x
3,16577,It is observed that often the properties of deposited thin films depend on the preparation conditions.,Thin film deposition using spray pyrolysis,10.1007/s10832-005-0870-x
4,16577,An extensive review of the effects of spray parameters on film quality is given to demonstrate the importance of the process of optimization.,Thin film deposition using spray pyrolysis,10.1007/s10832-005-0870-x
5,16577,"The substrate surface temperature is the most critical parameter as it influences film roughness, cracking, crystallinity, etc.",Thin film deposition using spray pyrolysis,10.1007/s10832-005-0870-x
6,16577,Processes involved in the spray pyrolysis technique are discussed in this review as well.,Thin film deposition using spray pyrolysis,10.1007/s10832-005-0870-x
