ID,Artigo,Sentencas,Titulo,DOI
1,19603,Nanopowders of two different compositions of cerium gadolinium oxides designated as CGO1 (Ce0.9Gd0.1O2) and CGO2 (Ce0.8Gd0.2O1.9) have been synthesized by a sodium alginate (Na-ALG) mediated novel ion-exchange process.,Synthesis and characterization of CexGd1-xO2-δ nanopowders employing an alginate mediated ion-exchange process,10.1016/j.cej.2012.05.063
2,19603,The results indicate that the nanopowders having a final particle size of similar to 7 nm can be obtained after calcination of ion-exchanged alginate precursor at 500 degrees C for 2 h in ambient air.,Synthesis and characterization of CexGd1-xO2-δ nanopowders employing an alginate mediated ion-exchange process,10.1016/j.cej.2012.05.063
3,19603,The chemical structures of Na-ALG solution and CGO beads are analyzed by Fourier transform infrared spectroscopy (FTIR).,Synthesis and characterization of CexGd1-xO2-δ nanopowders employing an alginate mediated ion-exchange process,10.1016/j.cej.2012.05.063
4,19603,X-ray diffraction (XRD) confirms that nanopowders of CGO1 and CGO2 are high purity single phase without any trace of un-reacted impurities.,Synthesis and characterization of CexGd1-xO2-δ nanopowders employing an alginate mediated ion-exchange process,10.1016/j.cej.2012.05.063
5,19603,The mean crystallite size calculated using XRD Rietveld refinement agrees well with that estimated from the morphologies observed by Transmission Electron Microscopy (TEM).,Synthesis and characterization of CexGd1-xO2-δ nanopowders employing an alginate mediated ion-exchange process,10.1016/j.cej.2012.05.063
6,19603,The nominal compositions of CGO1 and CGO2 have been found to be in excellent agreement with that determined by energy dispersive X-ray spectroscopy (EDS) and inductively coupled plasma-atomic emission spectrometry analysis (ICP-AES).,Synthesis and characterization of CexGd1-xO2-δ nanopowders employing an alginate mediated ion-exchange process,10.1016/j.cej.2012.05.063
7,19603,The activation energies (E-a = 1.33 and 1.27 eV) and conductivities at 600 and 700 degrees C for CGO1 and CGO2 are also measured.,Synthesis and characterization of CexGd1-xO2-δ nanopowders employing an alginate mediated ion-exchange process,10.1016/j.cej.2012.05.063
8,19603,(C) 2012,Synthesis and characterization of CexGd1-xO2-δ nanopowders employing an alginate mediated ion-exchange process,10.1016/j.cej.2012.05.063
9,19603,Elsevier B.V. All rights reserved.,Synthesis and characterization of CexGd1-xO2-δ nanopowders employing an alginate mediated ion-exchange process,10.1016/j.cej.2012.05.063
