ID,Artigo,Sentencas,Titulo,DOI
1,15877,"The crystallographic structure of Tb- and Pr-doped ceria is investigated through X-ray and neutron powder diffraction, combining pair distribution function and UV-vis spectroscopy.",Structural characterization of Tb- and Pr-doped ceria,10.1016/j.ssi.2014.10.020
2,15877,"Compared to trivalent dopants, Tb and Pr show peculiar optical and crystallographic properties: whilst Tb have a mixed +3/+4 valence state, Pr is stable mostly in the +4 valence state up to similar to 50% dopant concentration.",Structural characterization of Tb- and Pr-doped ceria,10.1016/j.ssi.2014.10.020
3,15877,"For larger Pr amounts, doping promotes a fluorite to monoclinic phase transformation.",Structural characterization of Tb- and Pr-doped ceria,10.1016/j.ssi.2014.10.020
4,15877,A straightforward method for extracting the dopant oxidation state by the cell parameter dependence on the ionic radius is also proposed.,Structural characterization of Tb- and Pr-doped ceria,10.1016/j.ssi.2014.10.020
5,15877,(C) 2014,Structural characterization of Tb- and Pr-doped ceria,10.1016/j.ssi.2014.10.020
6,15877,Elsevier B.V. All rights reserved.,Structural characterization of Tb- and Pr-doped ceria,10.1016/j.ssi.2014.10.020
