ID,Artigo,Sentencas,Titulo,DOI
1,19077,"Samples of Sm and Mg co-doped ceria electrolytes of Ce0.8Sm0.2-xMgxO2-delta (x = 0, 0.05, 0.10, 0.15 and 0.20) were sintered from powders obtained by solid-state reaction method.",Effect of Sm and Mg co-doping on the properties of ceria-based electrolyte materials for IT-SOFCs,10.1016/j.materresbull.2008.09.021
2,19077,The structures and electrical properties were characterized by X-ray diffraction (XRD) and AC impedance spectroscopy (IS).,Effect of Sm and Mg co-doping on the properties of ceria-based electrolyte materials for IT-SOFCs,10.1016/j.materresbull.2008.09.021
3,19077,The thermal expansion curves of samples were measured and the thermal expansion coefficients between 100 and 800 degrees C were calculated.,Effect of Sm and Mg co-doping on the properties of ceria-based electrolyte materials for IT-SOFCs,10.1016/j.materresbull.2008.09.021
4,19077,Results Showed that co-doping with appropriate ratio of Sm and Mg can improve the electrical performance of ceria-based electrolytes.,Effect of Sm and Mg co-doping on the properties of ceria-based electrolyte materials for IT-SOFCs,10.1016/j.materresbull.2008.09.021
5,19077,"As the substitution amount of Mg for Sm increased up to 50 mol%, the conductivity Of the samples maintained almost unchanged or even slightly higher than that doped only with Sm in intermediate temperature.",Effect of Sm and Mg co-doping on the properties of ceria-based electrolyte materials for IT-SOFCs,10.1016/j.materresbull.2008.09.021
6,19077,The results Suggest that the materials cost for producing the ceria-based intermediate temperature solid oxide fuel cells (IT-SOFCs) may be significantly reduced owing to the cost difference between Mg and Sm. (C) 2008,Effect of Sm and Mg co-doping on the properties of ceria-based electrolyte materials for IT-SOFCs,10.1016/j.materresbull.2008.09.021
7,19077,Elsevier Ltd.,Effect of Sm and Mg co-doping on the properties of ceria-based electrolyte materials for IT-SOFCs,10.1016/j.materresbull.2008.09.021
8,19077,All rights reserved.,Effect of Sm and Mg co-doping on the properties of ceria-based electrolyte materials for IT-SOFCs,10.1016/j.materresbull.2008.09.021
