ID,Artigo,Sentencas,Titulo,DOI
1,11973,Sealant is used in a solid oxide fuel cell (SOFC) stack to separate fuel and oxygen from burning with each other throughout the stack's lifetime cycle.,Evaluation and Application of a Novel BaO-CaO-SiO2-CoO-B2O3 Based Glass-Ceramic Sealing Material for Solid Oxide Fuel Cells,10.1115/1.4037648
2,11973,Various sealing materials have been developed and the glass sealant shows quite a potential for its low leaking rate.,Evaluation and Application of a Novel BaO-CaO-SiO2-CoO-B2O3 Based Glass-Ceramic Sealing Material for Solid Oxide Fuel Cells,10.1115/1.4037648
3,11973,"However, glass sealants usually suffer from fractures during thermal cycle because of their low-temperature brittleness and mismatched coefficient of thermal expansion.",Evaluation and Application of a Novel BaO-CaO-SiO2-CoO-B2O3 Based Glass-Ceramic Sealing Material for Solid Oxide Fuel Cells,10.1115/1.4037648
4,11973,"Recently, we have developed a novel glass-based sealant consisting of BaOCaO-SiO2-CoO and a small amount of Al2O3 powder which is used to adjust the coefficient of thermal expansion (CTE) and reinforce its mechanical performance.",Evaluation and Application of a Novel BaO-CaO-SiO2-CoO-B2O3 Based Glass-Ceramic Sealing Material for Solid Oxide Fuel Cells,10.1115/1.4037648
5,11973,The sealant exhibited a good performance with the leaking rates less than 0.04 sccm cm(-1) under compressive load of 0.17 MPa at 750 degrees C and showed stable leak rates over several thermal cycles.,Evaluation and Application of a Novel BaO-CaO-SiO2-CoO-B2O3 Based Glass-Ceramic Sealing Material for Solid Oxide Fuel Cells,10.1115/1.4037648
6,11973,The well bonded interfaces and chemical compatibility have been identified by microstructure analysis of the seals.,Evaluation and Application of a Novel BaO-CaO-SiO2-CoO-B2O3 Based Glass-Ceramic Sealing Material for Solid Oxide Fuel Cells,10.1115/1.4037648
7,11973,The sealant also demonstrated its applicability in a one-cell stack test.,Evaluation and Application of a Novel BaO-CaO-SiO2-CoO-B2O3 Based Glass-Ceramic Sealing Material for Solid Oxide Fuel Cells,10.1115/1.4037648
