ID,Artigo,Sentencas,Titulo,DOI
1,19671,The feasibility of renewable acetic acid as a direct fuel of SOFCs for sustainable electric power generation was investigated.,Renewable acetic acid in combination with solid oxide fuel cells for sustainable clean electric power generation,10.1039/c3ta10538e
2,19671,"To solve the problem of carbon deposition over conventional nickel cermet anodes, an advanced catalyst for acetic acid catalytic decomposition/internal reforming reaction was exploited.",Renewable acetic acid in combination with solid oxide fuel cells for sustainable clean electric power generation,10.1039/c3ta10538e
3,19671,"A comparative study of coke formation over Ni/Al2O3, Ni/MgO-Al2O3 and Ni-YSZ catalysts was conducted by oxygen-temperature programmed oxidation analysis.",Renewable acetic acid in combination with solid oxide fuel cells for sustainable clean electric power generation,10.1039/c3ta10538e
4,19671,"We found that the Ni/MgO-Al2O3 catalyst is much superior to the other two catalysts in suppressing carbon deposition, especially under the condition of the presence of steam in the acetic acid fuel.",Renewable acetic acid in combination with solid oxide fuel cells for sustainable clean electric power generation,10.1039/c3ta10538e
5,19671,Various cells were fabricated and tested under different conditions.,Renewable acetic acid in combination with solid oxide fuel cells for sustainable clean electric power generation,10.1039/c3ta10538e
6,19671,The differences in OCVs and power outputs of the cells caused by the usage of hydrogen and acetic acid as fuels were studied and explained based on the thermodynamic calculation and EIS measurement.,Renewable acetic acid in combination with solid oxide fuel cells for sustainable clean electric power generation,10.1039/c3ta10538e
7,19671,"After optimization, a peak power density of 1325 mW cm(-2) at a furnace temperature of 800 degrees C was achieved for the cell with a catalyst layer operating on acetic acid fuel.",Renewable acetic acid in combination with solid oxide fuel cells for sustainable clean electric power generation,10.1039/c3ta10538e
8,19671,"The cell was successfully operated continuously on acetic acid-steam fuel for a period of at least 200 h without any noticeable performance degradation, delamination of the catalyst layer and carbon deposition.",Renewable acetic acid in combination with solid oxide fuel cells for sustainable clean electric power generation,10.1039/c3ta10538e
9,19671,The promising results of this work show the possibility of better utilization of the abundant bio-mass or bio-oil for future energy generation.,Renewable acetic acid in combination with solid oxide fuel cells for sustainable clean electric power generation,10.1039/c3ta10538e
