ID,Artigo,Sentencas,Titulo,DOI
1,12503,The performance of solid oxide fuel cells (SOFCs) is considerably influenced by the microstructure and chemical composition of cathode materials.,Performance Improvement of an Inhomogeneous Cathode by Infiltration,10.1002/fuce.201600115
2,12503,Porous La0.85Sr0.15FeO3-Ce0.9Gd0.1O2 composite electrodes were infiltrated by La0.6Sr0.4CoO3 and La0.6Sr0.4FeO3.,Performance Improvement of an Inhomogeneous Cathode by Infiltration,10.1002/fuce.201600115
3,12503,"The effects of infiltration loading, calcination temperature of infiltrated material and co-infiltration of LSC and LSF were investigated using electrochemical impedance measurement, microstructural analysis, and high-temperature X-ray diffraction (HT-XRD).",Performance Improvement of an Inhomogeneous Cathode by Infiltration,10.1002/fuce.201600115
4,12503,A symmetrical cell two-electrode configuration was used to examine the electrochemical performance of the electrodes.,Performance Improvement of an Inhomogeneous Cathode by Infiltration,10.1002/fuce.201600115
5,12503,The electrochemical results revealed that the polarization resistance of the cathodes significantly was decreased by infiltration from 2.59 to 0.034 cm(2) measured at 670 degrees C.,Performance Improvement of an Inhomogeneous Cathode by Infiltration,10.1002/fuce.201600115
6,12503,The best electrode performance was achieved at a calcination temperature of 770 degrees C.,Performance Improvement of an Inhomogeneous Cathode by Infiltration,10.1002/fuce.201600115
7,12503,It was also found that infiltration of LSC improved the stability of the electrodes during 145 h of testing at 620 degrees C in air at open circuit voltage (OCV).,Performance Improvement of an Inhomogeneous Cathode by Infiltration,10.1002/fuce.201600115
