ID,Artigo,Sentencas,Titulo,DOI
1,17764,"In this study, porous Cu-YSZ cermets with various Cu contents are fabricated and their crystal structure and morphological features are investigated by X-ray diffraction and scanning electron microscopy.",Fabrication and structural properties of porous Cu-YSZ cermets for solid oxide fuel cells,10.1016/j.powtec.2014.01.007
2,17764,Carbon black-containing CuO/Y2O3-stabilized ZrO2 (YSZ) composites exhibit a highly porous structure due to the evolution of CO and CO2 gasses during sintering.,Fabrication and structural properties of porous Cu-YSZ cermets for solid oxide fuel cells,10.1016/j.powtec.2014.01.007
3,17764,The porosity of the CuO/YSZ composites decreases with increases of the sintering temperature and CuO content.,Fabrication and structural properties of porous Cu-YSZ cermets for solid oxide fuel cells,10.1016/j.powtec.2014.01.007
4,17764,Highly porous Cu/YSZ cermets are fabricated by reducing the porous CuO/YSZ composites in (Ar + 6% H-2) atmosphere.,Fabrication and structural properties of porous Cu-YSZ cermets for solid oxide fuel cells,10.1016/j.powtec.2014.01.007
5,17764,Higher CuO content and higher sintering temperature reduce the porosity of Cu/YSZ cermets after reduction treatment.,Fabrication and structural properties of porous Cu-YSZ cermets for solid oxide fuel cells,10.1016/j.powtec.2014.01.007
6,17764,"The microstructure and porosity of Cu/YSZ cermets as an anode material are remarkably affected by the CuO content, sintering temperature, and carbon black content.",Fabrication and structural properties of porous Cu-YSZ cermets for solid oxide fuel cells,10.1016/j.powtec.2014.01.007
7,17764,We believe that the porous Cu/YSZ cermets are a promising anode material for high performance of SOFC.,Fabrication and structural properties of porous Cu-YSZ cermets for solid oxide fuel cells,10.1016/j.powtec.2014.01.007
8,17764,(C) 2014,Fabrication and structural properties of porous Cu-YSZ cermets for solid oxide fuel cells,10.1016/j.powtec.2014.01.007
9,17764,Elsevier B.V. All rights reserved.,Fabrication and structural properties of porous Cu-YSZ cermets for solid oxide fuel cells,10.1016/j.powtec.2014.01.007
