ID,Artigo,Sentencas,Titulo,DOI
1,15704,"To decrease the deactivation of the Ni/YSZ electrode during hydrocarbon oxidation in solid oxide fuel cells (SOFCs) and coelectrolysis of H2O and CO2 in a solid oxide electrolysis cell (SOEC), it is very important to first understand oxygen vacancy formation at the triple-phase boundary (TPB) of Ni/YSZ because such vacancies are the active sites for coke formation and sulfur poisoning.",Elucidating the Role of the Electric Field at the Ni/YSZ Electrode: A DFT Study,10.1021/acs.jpcc.6b01292
2,15704,"Furthermore, the effect of the electric fields on oxygen vacancy formation must be investigated because such fields could potentially be used to alter the Ni/YSZ system and directly modify its.",Elucidating the Role of the Electric Field at the Ni/YSZ Electrode: A DFT Study,10.1021/acs.jpcc.6b01292
3,15704,electrocatalytic performance.,Elucidating the Role of the Electric Field at the Ni/YSZ Electrode: A DFT Study,10.1021/acs.jpcc.6b01292
4,15704,"In this study, three scenarios were considered: (i) oxygen vacancy formation in YSZ with and-without a Ni duster, (ii)",Elucidating the Role of the Electric Field at the Ni/YSZ Electrode: A DFT Study,10.1021/acs.jpcc.6b01292
5,15704,"oxygen vacancy formation and oxygen diffusion in YSZ and Ni/YSZ at different oxygen vacancy concentrations, and (iii) the effect of the electric fields on scenarios (i) and (ii).",Elucidating the Role of the Electric Field at the Ni/YSZ Electrode: A DFT Study,10.1021/acs.jpcc.6b01292
6,15704,"Our computational results show that the oxygen-enriched Ni/YSZ (Ni/YSZ+O) electrode is most likely to occur in an oxygen-enriched environment, even in the presence of different electric fields.",Elucidating the Role of the Electric Field at the Ni/YSZ Electrode: A DFT Study,10.1021/acs.jpcc.6b01292
7,15704,Both large negative and positive electric fields could lead to more active TPB vacancies by reducing the vacancy formation energies of the Ni/YSZ+O electrode to a certain degree.,Elucidating the Role of the Electric Field at the Ni/YSZ Electrode: A DFT Study,10.1021/acs.jpcc.6b01292
8,15704,Both charge distribution and effective dipole moments verify the qualitative findings concerning field influences on oxygen vacancy formation in Ni/YSZ.,Elucidating the Role of the Electric Field at the Ni/YSZ Electrode: A DFT Study,10.1021/acs.jpcc.6b01292
9,15704,"Overall, this investigation provides guidance for designing a Ni/YSZ electrode with an improved electrocatalytic performance via the simulated electric fields.",Elucidating the Role of the Electric Field at the Ni/YSZ Electrode: A DFT Study,10.1021/acs.jpcc.6b01292
