ID,Artigo,Sentencas,Titulo,DOI
1,12839,On-board desulfurization is mandatory for operating solid-oxide-fuel-cell-based auxiliary power units (SOFC-based APUs) with commercial sulfur rich fuels.,Integration of an adsorptive desulfurization unit into an SOFC-based auxiliary power unit operated with diesel fuel,10.1016/j.cherd.2018.10.024
2,12839,"In this work, the desulfurization and regeneration performance of an Ag-Al2O3 adsorbent was evaluated over 5 cycles of operation using a system-integrated thermal regeneration approach.",Integration of an adsorptive desulfurization unit into an SOFC-based auxiliary power unit operated with diesel fuel,10.1016/j.cherd.2018.10.024
3,12839,The results from the experimental investigations were further used as boundary conditions to carry out a full integration study of the designed desulfurization unit into a 5.5 kW(el),Integration of an adsorptive desulfurization unit into an SOFC-based auxiliary power unit operated with diesel fuel,10.1016/j.cherd.2018.10.024
4,12839,SOFC-based APU.,Integration of an adsorptive desulfurization unit into an SOFC-based auxiliary power unit operated with diesel fuel,10.1016/j.cherd.2018.10.024
5,12839,The experimental investigations showed high breakthrough capacities of the Ag-Al2O3 adsorbent when desulfurizing a dibenzothiophene-rich diesel fuel.,Integration of an adsorptive desulfurization unit into an SOFC-based auxiliary power unit operated with diesel fuel,10.1016/j.cherd.2018.10.024
6,12839,"In addition, 100% of the initial breakthrough capacity was restored over 5 cycles of operation by using the hot off-gas of an SOFC-based APU; no sign of performance degradation was observed.",Integration of an adsorptive desulfurization unit into an SOFC-based auxiliary power unit operated with diesel fuel,10.1016/j.cherd.2018.10.024
7,12839,"Furthermore, the integration study showed that both the temperature and the available volume flow rate of the hot APU off-gas are sufficient to perform on-board regeneration cycles in real SOFC-based APUs similar to those used in the lab-scale experiments.",Integration of an adsorptive desulfurization unit into an SOFC-based auxiliary power unit operated with diesel fuel,10.1016/j.cherd.2018.10.024
8,12839,(C) 2018 Institution of Chemical Engineers.,Integration of an adsorptive desulfurization unit into an SOFC-based auxiliary power unit operated with diesel fuel,10.1016/j.cherd.2018.10.024
9,12839,Published by Elsevier B.V. All rights reserved.,Integration of an adsorptive desulfurization unit into an SOFC-based auxiliary power unit operated with diesel fuel,10.1016/j.cherd.2018.10.024
