ID,Artigo,Sentencas,Titulo,DOI
1,13983,The poisoning effect by hydrogen chloride (HCl) on state-of-the-art Ni anode-supported solid oxide fuel cells (SOFCs) at 750 degrees C is evaluated in either hydrogen or syngas fuel.,Solid oxide fuel cell anode degradation by the effect of hydrogen chloride in stack and single cell environments,10.1016/j.jpowsour.2016.07.003
2,13983,Experiments are performed on single cells and short stacks and HCl concentration in the fuel gas is increased from 1 ppm(v) up to 1000 ppm(v) at different current densities.,Solid oxide fuel cell anode degradation by the effect of hydrogen chloride in stack and single cell environments,10.1016/j.jpowsour.2016.07.003
3,13983,"Characterization methods such as cell voltage monitoring vs. time and electrochemical impedance response analysis (distribution of relaxation times (DRT), equivalent electrical circuit) are used to identify the prevailing degradation mechanism.",Solid oxide fuel cell anode degradation by the effect of hydrogen chloride in stack and single cell environments,10.1016/j.jpowsour.2016.07.003
4,13983,Single cell experiments revealed that the poisoning is more severe when feeding with hydrogen than with syngas.,Solid oxide fuel cell anode degradation by the effect of hydrogen chloride in stack and single cell environments,10.1016/j.jpowsour.2016.07.003
5,13983,"Performance loss is attributed to the effects of HCl adsorption onto nickel surfaces, which lowered the catalyst activity.",Solid oxide fuel cell anode degradation by the effect of hydrogen chloride in stack and single cell environments,10.1016/j.jpowsour.2016.07.003
6,13983,"Interestingly, in syngas HCl does not affect stack performance even at concentrations up to 500 ppm(v), even when causing severe corrosion of the anode exhaust pipe.",Solid oxide fuel cell anode degradation by the effect of hydrogen chloride in stack and single cell environments,10.1016/j.jpowsour.2016.07.003
7,13983,"Furthermore, post-test analysis suggests that chlorine is present on the nickel particles in the form of adsorbed chlorine, rather than forming a secondary phase of nickel chlorine.",Solid oxide fuel cell anode degradation by the effect of hydrogen chloride in stack and single cell environments,10.1016/j.jpowsour.2016.07.003
8,13983,(C) 2016,Solid oxide fuel cell anode degradation by the effect of hydrogen chloride in stack and single cell environments,10.1016/j.jpowsour.2016.07.003
9,13983,Elsevier B.V. All rights reserved.,Solid oxide fuel cell anode degradation by the effect of hydrogen chloride in stack and single cell environments,10.1016/j.jpowsour.2016.07.003
