ID,Artigo,Sentencas,Titulo,DOI
1,14409,Solid oxide fuel cells (SOFCs) have been attracting considerable attention as prospective power sources with a variety of applications.,Electrophoretic deposition in the solid oxide fuel cell technology: Fundamentals and recent advances,10.1016/j.rser.2019.109440
2,14409,"Much current research is directed towards lowering the SOFC operating temperature in order to reduce the costs related to insulation, materials, start-up and degradation.",Electrophoretic deposition in the solid oxide fuel cell technology: Fundamentals and recent advances,10.1016/j.rser.2019.109440
3,14409,Development of versatile technologies is required to fabricate a SOFC with a thin-film electrolyte membrane to decrease ohmic losses at reduced temperatures and to form graded electrodes that have superior electrochemical performance.,Electrophoretic deposition in the solid oxide fuel cell technology: Fundamentals and recent advances,10.1016/j.rser.2019.109440
4,14409,Electrophoretic deposition (EPD) is one of the most technologically flexible and cost-effective methods currently available for the thin film formation.,Electrophoretic deposition in the solid oxide fuel cell technology: Fundamentals and recent advances,10.1016/j.rser.2019.109440
5,14409,This review briefly highlights the fundamental regularities and mechanisms of EPD and shows the evolution of the mathematical model of EPD considering classical and recent studies in this area.,Electrophoretic deposition in the solid oxide fuel cell technology: Fundamentals and recent advances,10.1016/j.rser.2019.109440
6,14409,"It presents current approaches to overcoming the challenges in the realization of the EPD process such as the choice of dispersion medium and additives, preparation of stable suspensions, bubble-free deposition from aqueous suspensions, formation of substrates with optimized porosity and conductivity and deposition on non-conducting substrates.",Electrophoretic deposition in the solid oxide fuel cell technology: Fundamentals and recent advances,10.1016/j.rser.2019.109440
7,14409,"It also summarizes the latest advances in deposition of different SOFCs' functional layers (dense, porous and multilayered) and entire cell structures, including micro-tubular cells.",Electrophoretic deposition in the solid oxide fuel cell technology: Fundamentals and recent advances,10.1016/j.rser.2019.109440
