ID,Artigo,Sentencas,Titulo,DOI
1,17919,A better understanding of stress evolution and the origin of sintering damage during the co-sintering of dissimilar materials is needed for the co-sintering of next generation integrated ceramic packaging and solid oxide fuel cells.,Co-sintering of multilayer ceramics,10.4028/www.scientific.net/KEM.206-213.257
2,17919,"This requires the determination of the sintering strain history as a function of heating rate, powder characteristics and green body properties.",Co-sintering of multilayer ceramics,10.4028/www.scientific.net/KEM.206-213.257
3,17919,In addition we must quantify the changes in the viscoelastic properties of the porous materials during sintering.,Co-sintering of multilayer ceramics,10.4028/www.scientific.net/KEM.206-213.257
4,17919,In Low Temperature Co-fired Ceramics (LTCC) it is important to monitor liquid phase redistribution during sintering.,Co-sintering of multilayer ceramics,10.4028/www.scientific.net/KEM.206-213.257
5,17919,This paper discusses the establishment of a testing protocol for developing a fundamental understanding of the co-sintering process.,Co-sintering of multilayer ceramics,10.4028/www.scientific.net/KEM.206-213.257
6,17919,"The protocol is based on the determination of the modulus, sintering strain rate and viscosity of the individual components.",Co-sintering of multilayer ceramics,10.4028/www.scientific.net/KEM.206-213.257
7,17919,Some of the tools that will be discussed include cyclic loading dilatometry and asymmetric bilayer experiments.,Co-sintering of multilayer ceramics,10.4028/www.scientific.net/KEM.206-213.257
8,17919,"Results from our current work on co-sintering of laminated structures, and inductors embedded in an LTCC package are presented.",Co-sintering of multilayer ceramics,10.4028/www.scientific.net/KEM.206-213.257
