ID,Artigo,Sentencas,Titulo,DOI
1,12609,The swift advancement of the solid oxide fuel cell (SOFC) sector necessitates a harmony between electrode performance and commercialization cost.,Developing abundant rare-earth iron perovskite electrodes for high-performance and low-cost solid oxide fuel cells,10.1016/j.isci.2024.109982
2,12609,The economic value of elements is frequently linked to their abundance in the Earth's crust.,Developing abundant rare-earth iron perovskite electrodes for high-performance and low-cost solid oxide fuel cells,10.1016/j.isci.2024.109982
3,12609,"Here, we develop abundant rare-earth iron perovskite electrodes of Ln 0.6 Sr 0.4 FeO 3-8 (Ln = La, Pr, and Nd) with high abundant rare-earth metals and preferred iron metal for SOFCs.",Developing abundant rare-earth iron perovskite electrodes for high-performance and low-cost solid oxide fuel cells,10.1016/j.isci.2024.109982
4,12609,All three symmetric electrode materials display a cubic perovskite phase and excellent chemical compatibility with Gd 0.2 Ce 0.8 O 2-8 electrolyte.,Developing abundant rare-earth iron perovskite electrodes for high-performance and low-cost solid oxide fuel cells,10.1016/j.isci.2024.109982
5,12609,All three electrodes possess exceptional surface oxygen exchange ability.,Developing abundant rare-earth iron perovskite electrodes for high-performance and low-cost solid oxide fuel cells,10.1016/j.isci.2024.109982
6,12609,"At 800 degrees C, single cells with La 0.6 Sr 0.4 FeO 3-8 , Pr 0.6 Sr 0.4 FeO 3-8 , and Nd 0.6 Sr 0.4 FeO 3-8 symmetric electrodes attained excellent open circuit voltages of 1.108, 1.101, and 1.097 V, respectively, as well as peak powers of 213.52, 281.12, and 254.58 mW cm -2 .",Developing abundant rare-earth iron perovskite electrodes for high-performance and low-cost solid oxide fuel cells,10.1016/j.isci.2024.109982
7,12609,"The results suggest that overall performance of abundant rare-earth iron perovskite electrodes has a favorable impact on the extensive expansion of SOFCs, presenting significant potential for practical applications.",Developing abundant rare-earth iron perovskite electrodes for high-performance and low-cost solid oxide fuel cells,10.1016/j.isci.2024.109982
