ID,Artigo,Sentencas,Titulo,DOI
1,1290,Some high-temperature alloys have been investigated in order to determine whether they are suitable as metallic interconnect materials in solid oxide fuel cell stacks.,Investigations of metallic alloys for use as interconnects in solid oxide fuel cell stacks,10.1007/BF00355908
2,1290,The requirements for such alloys are formulated.,Investigations of metallic alloys for use as interconnects in solid oxide fuel cell stacks,10.1007/BF00355908
3,1290,"Thermal dilatometry and oxidation tests, as well as theoretical calculations of the stresses that are induced by differences in thermal expansion of the individual materials, have been performed.",Investigations of metallic alloys for use as interconnects in solid oxide fuel cell stacks,10.1007/BF00355908
4,1290,"The results show that a chromium-rich alloy, with dispersions of fine Y2O3 particles, perform best among the samples investigated.",Investigations of metallic alloys for use as interconnects in solid oxide fuel cell stacks,10.1007/BF00355908
5,1290,Improvements are still needed in order to make the alloy fully applicable in a solid oxide fuel cell stack.,Investigations of metallic alloys for use as interconnects in solid oxide fuel cell stacks,10.1007/BF00355908
6,1290,Some suggestions for improvements are put forward.,Investigations of metallic alloys for use as interconnects in solid oxide fuel cell stacks,10.1007/BF00355908
