ID,Artigo,Sentencas,Titulo,DOI
1,18194,Thin films of PrBaCo2O5+delta (PBCO) were prepared on SrTiO3 substrates by spray pyrolysis.,Electrical conductivity relaxation of polycrystalline PrBaCo2O5+δ thin films,10.1016/j.ssi.2012.09.001
2,18194,"Electrical conductivity relaxation was performed to measure the surface exchange coefficient, k(chem),, from 650 to 850 K, in the pO(2) range 0.05-100% at a total pressure of 1 atm.",Electrical conductivity relaxation of polycrystalline PrBaCo2O5+δ thin films,10.1016/j.ssi.2012.09.001
3,18194,"The measured values fell in the range from 3.4 x 10(-9) cm/s to 8.6 x 10(-7) cm/s, with an activation energy of 1.30 eV.",Electrical conductivity relaxation of polycrystalline PrBaCo2O5+δ thin films,10.1016/j.ssi.2012.09.001
4,18194,"These values are significantly lower, and the activation energy higher, than previous reports.",Electrical conductivity relaxation of polycrystalline PrBaCo2O5+δ thin films,10.1016/j.ssi.2012.09.001
5,18194,"This discrepancy, and the discrepancies between prior reports in the literature, are attributed to surface composition.",Electrical conductivity relaxation of polycrystalline PrBaCo2O5+δ thin films,10.1016/j.ssi.2012.09.001
6,18194,The film samples used in this study are shown to be enriched in (Pr + Ba) when compared with the bulk composition.,Electrical conductivity relaxation of polycrystalline PrBaCo2O5+δ thin films,10.1016/j.ssi.2012.09.001
7,18194,(C) 2012,Electrical conductivity relaxation of polycrystalline PrBaCo2O5+δ thin films,10.1016/j.ssi.2012.09.001
8,18194,Elsevier B.V. All rights reserved.,Electrical conductivity relaxation of polycrystalline PrBaCo2O5+δ thin films,10.1016/j.ssi.2012.09.001
