ID,Artigo,Sentencas,Titulo,DOI
1,16915,The impedance response of a Pt/YSZ (yttria-stabilized zirconia) interface at 900 degrees C is modified by the passage of direct currents.,Transient and permanent effects of direct current on oxygen transfer across YSZ-Electrode interfaces,10.1149/1.1837840
2,16915,The initial steady-state impedance spectra are different from those taken after current interruption.,Transient and permanent effects of direct current on oxygen transfer across YSZ-Electrode interfaces,10.1149/1.1837840
3,16915,The latter evolve toward a new steady state.,Transient and permanent effects of direct current on oxygen transfer across YSZ-Electrode interfaces,10.1149/1.1837840
4,16915,The magnitude and equilibration kinetics of this effect are complex functions of the direction and magnitude of the applied current and the history of gas exposure.,Transient and permanent effects of direct current on oxygen transfer across YSZ-Electrode interfaces,10.1149/1.1837840
5,16915,An equivalent circuit that models the evolving changes in the impedance spectra is proposed.,Transient and permanent effects of direct current on oxygen transfer across YSZ-Electrode interfaces,10.1149/1.1837840
6,16915,The analysis of the effect may provide an insight into the mechanism of the anodic and cathodic interfacial reactions in a solid oxide fuel cell.,Transient and permanent effects of direct current on oxygen transfer across YSZ-Electrode interfaces,10.1149/1.1837840
