ID,Artigo,Sentencas,Titulo,DOI
1,10097,The decrease in cathodic polarization resistance is crucial for the development of advanced solid oxide fuel cells (SOFCs).,Interfacial energy barrier: A crucial factor affecting cathodic polarization resistance of solid oxide fuel cells,10.1002/er.7994
2,10097,This can be achieved by using functional ceramic catalysts for enhancing the oxygen reduction reaction.,Interfacial energy barrier: A crucial factor affecting cathodic polarization resistance of solid oxide fuel cells,10.1002/er.7994
3,10097,"In addition to the bulk and surface properties of the catalysts, the cathode/electrolyte interfacial energy barrier also affects the cathodic polarization resistance of SOFCs.",Interfacial energy barrier: A crucial factor affecting cathodic polarization resistance of solid oxide fuel cells,10.1002/er.7994
4,10097,"Accordingly, in this study, cells with different interface structures were designed and tested to determine the effect of the interface on the cell performance.",Interfacial energy barrier: A crucial factor affecting cathodic polarization resistance of solid oxide fuel cells,10.1002/er.7994
5,10097,"The cell with the cathode/electrolyte interface formed by employing Nd1/2Ba1/2Co1/3Fe1/3Mn1/3O3-delta as the cathode and Gd0.1Ce0.9O1.95 as the electrolyte exhibited an interfacial polarization resistance of 0.12 omega cm(2) at 750 degrees C, which was 69.8% of the total cathodic polarization resistance.",Interfacial energy barrier: A crucial factor affecting cathodic polarization resistance of solid oxide fuel cells,10.1002/er.7994
6,10097,"By comparison, the cell with the cathode/electrolyte interface formed by employing Nd1/2Ba1/2Co1/3Fe1/3Mn1/3O3-delta as the cathode and La0.8Sr0.2Ga0.8Mg0.2O3 as the electrolyte demonstrated a decreased in the cathodic polarization resistance from 0.140 to 0.088 omega cm(2) at 750 degrees C. Therefore, different interfacial energy barriers resulted in variable oxygen anion diffusions through the cathode/electrolyte heterogeneous interface.",Interfacial energy barrier: A crucial factor affecting cathodic polarization resistance of solid oxide fuel cells,10.1002/er.7994
7,10097,The above-mentioned findings can provide useful data for the design and development of high-performance SOFCs.,Interfacial energy barrier: A crucial factor affecting cathodic polarization resistance of solid oxide fuel cells,10.1002/er.7994
