ID,Artigo,Sentencas,Titulo,DOI
1,14259,"Ni-YSZ anode of solid oxide fuel cells (SOFCs) with three different compositions are examined and compared through electrochemical measurement, microstructural analysis, and numerical simulation.",Effect of Composition Ratio of Ni-YSZ Anode on Distribution of Effective Three Phase Boundary and Power Generation Performance,10.1002/fuce.201200174
2,14259,"Three-dimensional (3D) microstructure of the porous anodes is directly observed using focused ion beam and scanning electron microscope (FIB-SEM), and microstructural parameters such as phase connectivity and three-phase boundary (TPB) density are quantified to correlate the microstructure to the performance.",Effect of Composition Ratio of Ni-YSZ Anode on Distribution of Effective Three Phase Boundary and Power Generation Performance,10.1002/fuce.201200174
3,14259,3D numerical simulation using the obtained microstructure is conducted considering the various transport phenomena and the electrochemical reaction in the anodes to predict their overall electrochemical performance.,Effect of Composition Ratio of Ni-YSZ Anode on Distribution of Effective Three Phase Boundary and Power Generation Performance,10.1002/fuce.201200174
4,14259,"The performance of the Ni:YSZ=30:70 anode is measured significantly lower than those of the Ni:YSZ=50:50 and 70:30 anodes, which is attributed to the elongation of the ionic transport pathways.",Effect of Composition Ratio of Ni-YSZ Anode on Distribution of Effective Three Phase Boundary and Power Generation Performance,10.1002/fuce.201200174
5,14259,"The poor connectivity of the Ni phase in the Ni:YSZ=30:70 anode shifts the electrochemically active region far from the anode-electrolyte interface, resulting in higher Ohmic loss.",Effect of Composition Ratio of Ni-YSZ Anode on Distribution of Effective Three Phase Boundary and Power Generation Performance,10.1002/fuce.201200174
6,14259,The amount and distribution of the effective TPB associated with the phase connectivity are essentially important to explain the anode performance.,Effect of Composition Ratio of Ni-YSZ Anode on Distribution of Effective Three Phase Boundary and Power Generation Performance,10.1002/fuce.201200174
7,14259,The 3D numerical simulation qualitatively reproduces the anode performance and gives detailed information about the internal states of the anodes such as the distribution of the charge-transfer current.,Effect of Composition Ratio of Ni-YSZ Anode on Distribution of Effective Three Phase Boundary and Power Generation Performance,10.1002/fuce.201200174
