ID,Artigo,Sentencas,Titulo,DOI
1,17707,Improved microstructural imaging and characterization methods have recently opened the door for quantitative evaluation of microstructures of such functional materials as solid oxide fuel cell and battery electrodes and composite gas separation membranes.,Determining the representative volume element size for three-dimensional microstructural material characterization. Part 2: Application to experimental data,10.1016/j.jpowsour.2015.02.052
2,17707,Accurate quantitative characterization of these structures relies on the concept of a representative volume element (RVE) to provide a sufficiently large sample to be statistically representative of the material.,Determining the representative volume element size for three-dimensional microstructural material characterization. Part 2: Application to experimental data,10.1016/j.jpowsour.2015.02.052
3,17707,"In Part 1 of this work, several models were described to determine the RVE size for several common microstructural properties: volume fraction, particle size, and network contiguity.",Determining the representative volume element size for three-dimensional microstructural material characterization. Part 2: Application to experimental data,10.1016/j.jpowsour.2015.02.052
4,17707,"In this work, extensive synchrotron X-ray nanotomography imaging of a multiphase composite gas separation membrane is used to provide an experimental comparison to the model predictions.",Determining the representative volume element size for three-dimensional microstructural material characterization. Part 2: Application to experimental data,10.1016/j.jpowsour.2015.02.052
5,17707,"Results suggest that the models provide a reasonable estimate of RVE size, and can serve as a starting point for researchers planning imaging and characterization experiments.",Determining the representative volume element size for three-dimensional microstructural material characterization. Part 2: Application to experimental data,10.1016/j.jpowsour.2015.02.052
6,17707,(C) 2015,Determining the representative volume element size for three-dimensional microstructural material characterization. Part 2: Application to experimental data,10.1016/j.jpowsour.2015.02.052
7,17707,Elsevier B.V. All rights reserved.,Determining the representative volume element size for three-dimensional microstructural material characterization. Part 2: Application to experimental data,10.1016/j.jpowsour.2015.02.052
