ID,Artigo,Sentencas,Titulo,DOI
1,10215,"The results of plasmochemical modification on Crofer 22APU ferritic stainless steel with a SiCxNy:H layer, as well as the impact of these processes on the increase in usability of the steel as intermediate-temperature solid oxide fuel cell (IT-SOFC), interconnects, are presented in this work.",Plasmochemical Modification of Crofer 22APU for Intermediate-Temperature Solid Oxide Fuel Cell Interconnects Using RF PA CVD Method,10.3390/ma15124081
2,10215,"The layer was obtained using Radio-Frequency Plasma-Activated Chemical Vapor Deposition (RF PA CVD, 13.56 MHz) with or without the N+ ion modification process of the steel surface.",Plasmochemical Modification of Crofer 22APU for Intermediate-Temperature Solid Oxide Fuel Cell Interconnects Using RF PA CVD Method,10.3390/ma15124081
3,10215,"To determine the impact of the surface modification on the steel's resistance to high-temperature corrosion and on its mechanical properties, the chemical composition, atomic structure, and microstructure were investigated by means of IR spectroscopy, X-ray diffraction (XRD), scanning electron microscopy (SEM) and energy dispersive spectroscopy (EDS).",Plasmochemical Modification of Crofer 22APU for Intermediate-Temperature Solid Oxide Fuel Cell Interconnects Using RF PA CVD Method,10.3390/ma15124081
4,10215,"Microhardness, Young's modulus, wear rate, as well as electrical resistance, were also determined.",Plasmochemical Modification of Crofer 22APU for Intermediate-Temperature Solid Oxide Fuel Cell Interconnects Using RF PA CVD Method,10.3390/ma15124081
5,10215,Micromechanical experiments showed that the plasmochemical modification has a positive influence on the surface hardness and Young's modulus of the investigated samples.,Plasmochemical Modification of Crofer 22APU for Intermediate-Temperature Solid Oxide Fuel Cell Interconnects Using RF PA CVD Method,10.3390/ma15124081
6,10215,High-temperature oxidation studies performed for the samples indicate that N+ ion modification prior to the deposition of the SiCxNy:H layer improves the corrosion resistance of Crofer 22APU steel modified via CVD.,Plasmochemical Modification of Crofer 22APU for Intermediate-Temperature Solid Oxide Fuel Cell Interconnects Using RF PA CVD Method,10.3390/ma15124081
7,10215,"The area-specific resistance of the studied samples was 0.01 omega center dot cm(2), which is lower than that of bare steel after 500 h of oxidation at 1073 K.",Plasmochemical Modification of Crofer 22APU for Intermediate-Temperature Solid Oxide Fuel Cell Interconnects Using RF PA CVD Method,10.3390/ma15124081
8,10215,It was demonstrated that the deposition of the SiCxNy:H layer preceded by N+ ion modification yields the best properties.,Plasmochemical Modification of Crofer 22APU for Intermediate-Temperature Solid Oxide Fuel Cell Interconnects Using RF PA CVD Method,10.3390/ma15124081
