ID,Artigo,Sentencas,Titulo,DOI
1,1023,Highly active and stable electrocatalysts are mandatory for developing high-performance and long-lasting fuel cells.,Novel LaFe2O4 spinel structure with a large oxygen reduction response towards protonic ceramic fuel cell cathode,10.1016/j.jre.2022.04.031
2,1023,The current study demonstrates a high oxygen reduction reaction (ORR) electro-catalytic activity of a novel spinel-structured LaFe2O4 via a self-doping strategy.,Novel LaFe2O4 spinel structure with a large oxygen reduction response towards protonic ceramic fuel cell cathode,10.1016/j.jre.2022.04.031
3,1023,The LaFe2O4 demon-strates excellent ORR activity in a protonic ceramic fuel cell (PCFC) at temperature range of 350-500 degrees C.,Novel LaFe2O4 spinel structure with a large oxygen reduction response towards protonic ceramic fuel cell cathode,10.1016/j.jre.2022.04.031
4,1023,"The high ORR activity of LaFe2O4 is mainly attributed to the facile release of oxide and proton ions, and improved synergistic incorporation abilities associated with interplay of multivalent Fe3+/Fe2+ and La3+ ions.",Novel LaFe2O4 spinel structure with a large oxygen reduction response towards protonic ceramic fuel cell cathode,10.1016/j.jre.2022.04.031
5,1023,"Using LaFe2O4 as cathode over proton conducting BaZr0.4Ce0.4Y0.2O3 (BZCY) electrolyte, the fuel cell has delivered a high-power density of 806 mW/cm2 operating at 500 degrees C. Different spectroscopic and calculations methods such as UV-visible, Raman, X-ray photoelectron spectroscopy and density func-tional theory (DFT) calculations were performed to screen the potential application of LaFe2O4 as cathode.",Novel LaFe2O4 spinel structure with a large oxygen reduction response towards protonic ceramic fuel cell cathode,10.1016/j.jre.2022.04.031
6,1023,This study would help in developing functional cobalt-free ORR electrocatalysts for low temperature-PCFCs (LT-PCFCs) and solid oxide fuel cells (SOFCs) applications.(c) 2022,Novel LaFe2O4 spinel structure with a large oxygen reduction response towards protonic ceramic fuel cell cathode,10.1016/j.jre.2022.04.031
7,1023,The Authors.,Novel LaFe2O4 spinel structure with a large oxygen reduction response towards protonic ceramic fuel cell cathode,10.1016/j.jre.2022.04.031
8,1023,Published by Elsevier B.V. on behalf of Chinese Society of Rare Earths.,Novel LaFe2O4 spinel structure with a large oxygen reduction response towards protonic ceramic fuel cell cathode,10.1016/j.jre.2022.04.031
9,1023,This is an open access article under the CC BY license (http://creativecommons.org/licenses/by/4.0/).,Novel LaFe2O4 spinel structure with a large oxygen reduction response towards protonic ceramic fuel cell cathode,10.1016/j.jre.2022.04.031
