ID,Artigo,Sentencas,Titulo,DOI
1,16794,"Meso/macroporous La1-xSrxCoO3-delta powder with the specific surface area higher than 140 m(2) g(-1) has been synthesized from the corresponding nitrates, using solution thermal decomposition method.",Development of porous cathode powders for SOFC and influence of cathode structure on the oxygen electroreduction kinetics,10.1016/j.elecom.2008.07.029
2,16794,"These nanopowders have been used for preparation of SOFC cathodes, demonstrating lower oxygen electroreduction activation energy than that for less porous cathodes prepared from the powders synthesized using traditional solid state reaction method.",Development of porous cathode powders for SOFC and influence of cathode structure on the oxygen electroreduction kinetics,10.1016/j.elecom.2008.07.029
3,16794,To increase macroporosity of the cathodes the special pore forming agent has been added into the raw cathode paste.,Development of porous cathode powders for SOFC and influence of cathode structure on the oxygen electroreduction kinetics,10.1016/j.elecom.2008.07.029
4,16794,"The very low total polarization resistance and activation energy values have been obtained for oxygen electroreduction, depending on the cathode porosity and potential applied.",Development of porous cathode powders for SOFC and influence of cathode structure on the oxygen electroreduction kinetics,10.1016/j.elecom.2008.07.029
5,16794,(c) 2008,Development of porous cathode powders for SOFC and influence of cathode structure on the oxygen electroreduction kinetics,10.1016/j.elecom.2008.07.029
6,16794,Elsevier B.V. All rights reserved.,Development of porous cathode powders for SOFC and influence of cathode structure on the oxygen electroreduction kinetics,10.1016/j.elecom.2008.07.029
