ID,Artigo,Sentencas,Titulo,DOI
1,1601,A pyrolysis synthesis method was developed to prepare ceramic nanoparticles for the fabrication of solid oxide fuel cells.,Poly(furfuryl alcohol)-assisted pyrolysis synthesis of ceramic nanoparticles for solid oxide fuel cells,10.1016/j.materresbull.2012.03.052
2,1601,Furfuryl alcohol was used as a polymerizable solvent to dissolve metal nitrates and then polymerized into poly(furfuryl alcohol) (PFA).,Poly(furfuryl alcohol)-assisted pyrolysis synthesis of ceramic nanoparticles for solid oxide fuel cells,10.1016/j.materresbull.2012.03.052
3,1601,"During the pyrolysis at 600 degrees C, a mixture of nitrates/PFA was converted into ceramic nanoparticles/carbon networks nanocomposite, and the carbon networks act as a barrier to prevent the aggregation of newly formed nanoparticles during particle crystallization.",Poly(furfuryl alcohol)-assisted pyrolysis synthesis of ceramic nanoparticles for solid oxide fuel cells,10.1016/j.materresbull.2012.03.052
4,1601,Dispersible nanoparticles with particle sizes ranging from 40 nm to 200 nm were obtained after burning off carbon networks in air.,Poly(furfuryl alcohol)-assisted pyrolysis synthesis of ceramic nanoparticles for solid oxide fuel cells,10.1016/j.materresbull.2012.03.052
5,1601,"As an example, Ce0.8Sm0.2O1.9 nanoparticles were synthesized to prepare solid oxide fuel cells, and the fuel cells achieved maximum power densities of 444.5, 625.5 and 684 mW cm(-2) at 500 degrees C, 550 degrees C and 600 degrees C, respectively.",Poly(furfuryl alcohol)-assisted pyrolysis synthesis of ceramic nanoparticles for solid oxide fuel cells,10.1016/j.materresbull.2012.03.052
6,1601,Our study shows that the pyrolysis synthesis method described here is promising for the effective synthesis of high quality ceramic nanoparticles.,Poly(furfuryl alcohol)-assisted pyrolysis synthesis of ceramic nanoparticles for solid oxide fuel cells,10.1016/j.materresbull.2012.03.052
7,1601,(C) 2012,Poly(furfuryl alcohol)-assisted pyrolysis synthesis of ceramic nanoparticles for solid oxide fuel cells,10.1016/j.materresbull.2012.03.052
8,1601,Elsevier Ltd.,Poly(furfuryl alcohol)-assisted pyrolysis synthesis of ceramic nanoparticles for solid oxide fuel cells,10.1016/j.materresbull.2012.03.052
9,1601,All rights reserved.,Poly(furfuryl alcohol)-assisted pyrolysis synthesis of ceramic nanoparticles for solid oxide fuel cells,10.1016/j.materresbull.2012.03.052
