ID,Artigo,Sentencas,Titulo,DOI
1,17018,Anode/electrolyte two-layer ceramic composites for tubular solid oxide fuel cells were prepared through coextrusion of multiple pastes containing a water-based binder (an aqueous solution of hydroxypropyl methylcellulose).,Preparation of anode/electrolyte ceramic composites by coextrusion of pastes,10.1111/j.1551-2916.2004.00983.x
2,17018,The multibillet extrusion (MBE) technique was found to be effective in achieving the anode/electrolyte composite pipes.,Preparation of anode/electrolyte ceramic composites by coextrusion of pastes,10.1111/j.1551-2916.2004.00983.x
3,17018,"Furthermore, it is possible to reduce the wall thickness of both anode and electrolyte layers by raising the extrusion ratio of each layer.",Preparation of anode/electrolyte ceramic composites by coextrusion of pastes,10.1111/j.1551-2916.2004.00983.x
4,17018,The extrusion pressure and binder content required to obtain sound extrudates decreased with an increase in the fraction of nickel oxide in an anode layer.,Preparation of anode/electrolyte ceramic composites by coextrusion of pastes,10.1111/j.1551-2916.2004.00983.x
5,17018,It is feasible to decrease the difference in the sintering shrinkage between the anode and electrolyte layers by incorporating calcined coarse yttria-stabilized zirconia (YSZ) powder in the electrolyte layer.,Preparation of anode/electrolyte ceramic composites by coextrusion of pastes,10.1111/j.1551-2916.2004.00983.x
6,17018,The incorporation of coarse YSZ powder in an anode is effective in forming a continuous NiO network within the YSZ matrix.,Preparation of anode/electrolyte ceramic composites by coextrusion of pastes,10.1111/j.1551-2916.2004.00983.x
