ID,Artigo,Sentencas,Titulo,DOI
1,10564,Thinsolid oxide films are crucial for developing high-performancesolid oxide-based electrochemical devices aimed at decarbonizing theglobal energy system.,Mathematical Model-Assisted Ultrasonic Spray Coating for Scalable Production of Large-Sized Solid Oxide Electrochemical Cells,10.1021/acsami.3c04208
2,10564,"Among various methods, ultrasonic spray coating(USC) can provide the throughput, scalability, quality consistency,roll-to-roll compatibility, and low material waste necessary for scalableproduction of large-sized solid oxide electrochemical cells.",Mathematical Model-Assisted Ultrasonic Spray Coating for Scalable Production of Large-Sized Solid Oxide Electrochemical Cells,10.1021/acsami.3c04208
3,10564,"However,due to the large number of USC parameters, systematic parameter optimizationis required to ensure optimal settings.",Mathematical Model-Assisted Ultrasonic Spray Coating for Scalable Production of Large-Sized Solid Oxide Electrochemical Cells,10.1021/acsami.3c04208
4,10564,"However, the optimizationsin previous literature are either not discussed or not systematic,facile, and practical for scalable production of thin oxide films.",Mathematical Model-Assisted Ultrasonic Spray Coating for Scalable Production of Large-Sized Solid Oxide Electrochemical Cells,10.1021/acsami.3c04208
5,10564,"In this regard, we propose an USC optimization process assisted withmathematical models.",Mathematical Model-Assisted Ultrasonic Spray Coating for Scalable Production of Large-Sized Solid Oxide Electrochemical Cells,10.1021/acsami.3c04208
6,10564,"Using this method, we obtained optimal settingsfor producing high-quality, uniform 4 x 4 cm(2) oxygenelectrode films with a consistent thickness of & SIM;27 & mu;min 1 min in a facile and systematic way.",Mathematical Model-Assisted Ultrasonic Spray Coating for Scalable Production of Large-Sized Solid Oxide Electrochemical Cells,10.1021/acsami.3c04208
7,10564,The quality of the filmsis evaluated at both micrometer and centimeter scales and meets desirablethickness and uniformity criteria.,Mathematical Model-Assisted Ultrasonic Spray Coating for Scalable Production of Large-Sized Solid Oxide Electrochemical Cells,10.1021/acsami.3c04208
8,10564,"To validate the performance ofUSC-fabricated electrolytes and oxygen electrodes, we employ protonicceramic electrochemical cells, which achieve a peak power densityof 0.88 W cm(-2) in the fuel cell mode and a currentdensity of 1.36 A cm(-2) at 1.3 V in the electrolysismode, with minimal degradation over a period of 200 h. These resultsdemonstrate the potential of USC as a promising technology for scalableproduction of large-sized solid oxide electrochemical cells.",Mathematical Model-Assisted Ultrasonic Spray Coating for Scalable Production of Large-Sized Solid Oxide Electrochemical Cells,10.1021/acsami.3c04208
