ID,Artigo,Sentencas,Titulo,DOI
1,18714,Effects of strain on the surface cation chemistry and the electronic structure are important to understand and control for attaining fast oxygen reduction kinetics on transition-metal oxides.,"New Insights into the Strain Coupling to Surface Chemistry, Electronic Structure, and Reactivity of La0.7Sr0.3MnO3",10.1021/jz200160b
2,18714,"Here we demonstrate and mechanistically interpret the strain coupling to Sr segregation, oxygen vacancy formation, and electronic structure on the surface of La0.7Sr0.3MnO3 (LSM) thin films as a model system.","New Insights into the Strain Coupling to Surface Chemistry, Electronic Structure, and Reactivity of La0.7Sr0.3MnO3",10.1021/jz200160b
3,18714,Our experimental results from X-ray photoelectron spectroscopy and scanning tunneling spectroscopy are discussed in light of our first principles-based simulations.,"New Insights into the Strain Coupling to Surface Chemistry, Electronic Structure, and Reactivity of La0.7Sr0.3MnO3",10.1021/jz200160b
4,18714,A stronger Sr enrichment tendency and a more facile oxygen vacancy formation prevail for the tensile-strained LSM surface.,"New Insights into the Strain Coupling to Surface Chemistry, Electronic Structure, and Reactivity of La0.7Sr0.3MnO3",10.1021/jz200160b
5,18714,"At 500 degrees C in 10(-3) mbar oxygen, both LSM film surfaces exhibit a metallic-like tunneling conductance, with a higher density of electronic states near the Fermi level on the tensile-strained LSM surface, contrary to the behavior at room temperature.","New Insights into the Strain Coupling to Surface Chemistry, Electronic Structure, and Reactivity of La0.7Sr0.3MnO3",10.1021/jz200160b
6,18714,Our findings illustrate the potential role and mechanism of lattice strain in tuning the reactivity of perovskite transition-metal oxides with oxygen in solid oxide fuel cell cathodes.,"New Insights into the Strain Coupling to Surface Chemistry, Electronic Structure, and Reactivity of La0.7Sr0.3MnO3",10.1021/jz200160b
