ID,Artigo,Sentencas,Titulo,DOI
1,15962,The Srn+1FenO3n+1 Ruddlesden-Popper (RP) perovskite family displays promising oxygen permeability and serves as a host stoichiometry for the design of solid oxide electrode materials.,An ab initio study of the oxygen defect formation and oxide ion migration in (Sr1-xPrx)2FeO4±δ,10.1016/j.jpowsour.2021.230602
2,15962,A strategy to tune electronic and ionic properties is the introduction of substitutional dopants like Pr3+ to the A-site.,An ab initio study of the oxygen defect formation and oxide ion migration in (Sr1-xPrx)2FeO4±δ,10.1016/j.jpowsour.2021.230602
3,15962,"In this study, we investigate the bulk structural, electronic, and oxygen migration properties for the n = 1 RP perovskite (Sr1-xPrx)(2)FeO4 +/-delta (x = 0, 0.125, 0.25, 0.375, and 0.5).",An ab initio study of the oxygen defect formation and oxide ion migration in (Sr1-xPrx)2FeO4±δ,10.1016/j.jpowsour.2021.230602
4,15962,The oxygen partial pressure is adjusted to elucidate how anodic and cathodic operating conditions influence the formation of oxygen defects.,An ab initio study of the oxygen defect formation and oxide ion migration in (Sr1-xPrx)2FeO4±δ,10.1016/j.jpowsour.2021.230602
5,15962,"Under anodic conditions, the oxygen vacancy is the dominant oxide defect for all dopant-configurations.",An ab initio study of the oxygen defect formation and oxide ion migration in (Sr1-xPrx)2FeO4±δ,10.1016/j.jpowsour.2021.230602
6,15962,"Under cathodic conditions, oxygen vacancy defects dominate for configurations from x = 0 to x = 0.375 while the oxygen peroxide interstitial defect becomes the primary defect for x = 0.5.",An ab initio study of the oxygen defect formation and oxide ion migration in (Sr1-xPrx)2FeO4±δ,10.1016/j.jpowsour.2021.230602
7,15962,"Next, we examine the relationship between Pr3+ concentration, iron oxidation state, and charge compensation with defect formation to explain the trends in vacancy and peroxide interstitial formation energies.",An ab initio study of the oxygen defect formation and oxide ion migration in (Sr1-xPrx)2FeO4±δ,10.1016/j.jpowsour.2021.230602
8,15962,Results clarify the role of lanthanide A-site substitutional dopants on the electronic conductivity and oxide defect formation and migration in Sr-based RP perovskites.,An ab initio study of the oxygen defect formation and oxide ion migration in (Sr1-xPrx)2FeO4±δ,10.1016/j.jpowsour.2021.230602
9,15962,These atomic-scale insights suggest design directions for RP perovskites in SOFCs.,An ab initio study of the oxygen defect formation and oxide ion migration in (Sr1-xPrx)2FeO4±δ,10.1016/j.jpowsour.2021.230602
