ID,Artigo,Sentencas,Titulo,DOI
1,18489,"Bismuth oxide and scandia co-doped zirconia (Sc2O3)(0.06)(Bi2O3)(x)(ZrO2)(0.94-x) (ScSZB, x = 0, 0.01, 0.03, 0.05, 0.07, 0.1) powders are prepared via a citrate sol-gel method.",High-conductivity electrolyte with a low sintering temperature for solid oxide fuel cells,10.1016/j.ijhydene.2022.01.168
2,18489,Bi2O3 promotes the sintering process of scandia stabilized zirconia (ScSZ) and increases electrical conductivity of system.,High-conductivity electrolyte with a low sintering temperature for solid oxide fuel cells,10.1016/j.ijhydene.2022.01.168
3,18489,A high conductivity of similar to 0.094 S/cm at 800 degrees C is achieved on 5 mol% Bi2O3 doped ScSZ (ScSZB05).,High-conductivity electrolyte with a low sintering temperature for solid oxide fuel cells,10.1016/j.ijhydene.2022.01.168
4,18489,X-ray Rietveld refinement and transmission electron microscope (TEM) analysis of the ScSZB05 reveal the formation of cubic phase and rhombohedral phase at room temperature.,High-conductivity electrolyte with a low sintering temperature for solid oxide fuel cells,10.1016/j.ijhydene.2022.01.168
5,18489,"The electrolyte-supported cell constructed by the ScSZ electrolyte gives the maximum power density of 258.3 mW/cm(2) at 800 degrees C, while the cell with ScSZB05 electrolyte shows a higher value of 387.6 mW/cm(2).",High-conductivity electrolyte with a low sintering temperature for solid oxide fuel cells,10.1016/j.ijhydene.2022.01.168
6,18489,The performance obtained by theoretical simulation of the two electrolyte-supported cells is in good agreement with the experimental results.,High-conductivity electrolyte with a low sintering temperature for solid oxide fuel cells,10.1016/j.ijhydene.2022.01.168
7,18489,(C) 2022 Hydrogen Energy Publications LLC.,High-conductivity electrolyte with a low sintering temperature for solid oxide fuel cells,10.1016/j.ijhydene.2022.01.168
8,18489,Published by Elsevier Ltd.,High-conductivity electrolyte with a low sintering temperature for solid oxide fuel cells,10.1016/j.ijhydene.2022.01.168
9,18489,All rights reserved.,High-conductivity electrolyte with a low sintering temperature for solid oxide fuel cells,10.1016/j.ijhydene.2022.01.168
