ID,Artigo,Sentencas,Titulo,DOI
1,19540,"Features of the local structure of ZrO2-Yb2O3, ZrO2-Y2O3-Yb2O3 and ZrO2-Sc2O3-Yb2O3 single crystals have been studied using optical spectroscopy.",Effect of the ionic radius of stabilizing oxide cation on the local structure and transport properties of zirconia based solid solutions,10.1016/j.jallcom.2021.159396
2,19540,"The probability of oxygen vacancies to occupy the first co-ordination shells of the Sc3+, Yb3+ and Y3+ stabilizing oxide cations has been shown to vary in the test solid solutions.",Effect of the ionic radius of stabilizing oxide cation on the local structure and transport properties of zirconia based solid solutions,10.1016/j.jallcom.2021.159396
3,19540,Furthermore it has been shown that the probability of oxygen vacancies to occupy the first co-ordination shells of the Sc3+ ions is higher than their probability to occupy the first coordination shells of the Yb3+ and Y3+ ions.,Effect of the ionic radius of stabilizing oxide cation on the local structure and transport properties of zirconia based solid solutions,10.1016/j.jallcom.2021.159396
4,19540,It has been shown that the transport properties of the ZrO2-Sc2O3-Yb2O3 and ZrO2-Y2O3-Yb2O3 solid solutions depend significantly on the ionic radii of the stabilizing oxide cations located in the first coordination shells of oxygen vacancies.,Effect of the ionic radius of stabilizing oxide cation on the local structure and transport properties of zirconia based solid solutions,10.1016/j.jallcom.2021.159396
5,19540,"For cations with small ionic radii (Sc3+, Yb3+) the height of the barrier which depends on the potential energy of the elastically deformed lattice is lower and the ionic conductivity is therefore higher.",Effect of the ionic radius of stabilizing oxide cation on the local structure and transport properties of zirconia based solid solutions,10.1016/j.jallcom.2021.159396
6,19540,(C) 2021,Effect of the ionic radius of stabilizing oxide cation on the local structure and transport properties of zirconia based solid solutions,10.1016/j.jallcom.2021.159396
7,19540,Elsevier B.V. All rights reserved.,Effect of the ionic radius of stabilizing oxide cation on the local structure and transport properties of zirconia based solid solutions,10.1016/j.jallcom.2021.159396
