ID,Artigo,Sentencas,Titulo,DOI
1,17717,The surface exchange coefficient (k) of porous mixed ionic-electronic conductors (MIECs) determines the device-level electrochemical performance of solid oxide cells.,Perspective on high-temperature surface oxygen exchange in a porous mixed ionic-electronic conductor for solid oxide cells,10.1039/d3cp00375b
2,17717,"However, a great difference is reported for k values, which are measured using presently available technologies of electrical conductivity relaxation (ECR), electrochemical impedance spectroscopy (EIS), and oxygen isotope exchange (OIE).",Perspective on high-temperature surface oxygen exchange in a porous mixed ionic-electronic conductor for solid oxide cells,10.1039/d3cp00375b
3,17717,"In terms of this issue, this perspective paper estimates the possible physiochemical processes for the oxygen reduction reaction (ORR) in porous MIECs by comparing the oxygen supply/consumption fluxes through calculation.",Perspective on high-temperature surface oxygen exchange in a porous mixed ionic-electronic conductor for solid oxide cells,10.1039/d3cp00375b
4,17717,"Then, the potential problems associated with ECR, EIS, and OIE for application in porous materials are discussed regarding theory, assumptions, sample requirements, and data processing.",Perspective on high-temperature surface oxygen exchange in a porous mixed ionic-electronic conductor for solid oxide cells,10.1039/d3cp00375b
5,17717,"Finally, gas diffusion effects are revealed by comparing the simulated and measured ECR profiles, which show that the ORR process can be significantly delayed by gas diffusion.",Perspective on high-temperature surface oxygen exchange in a porous mixed ionic-electronic conductor for solid oxide cells,10.1039/d3cp00375b
6,17717,This perspective aims to recommend a reasonable method to characterize the true ORR kinetics of porous electrodes and quantify the effect of gas diffusion.,Perspective on high-temperature surface oxygen exchange in a porous mixed ionic-electronic conductor for solid oxide cells,10.1039/d3cp00375b
