ID,Artigo,Sentencas,Titulo,DOI
1,14677,"To significantly increase the amount of exsolved particles, the complete phase reconstruction from simple perovskite to Ruddlesden-Popper (R-P) perovskite is greatly desirable.",Unveiling the key factor for the phase reconstruction and exsolved metallic particle distribution in perovskites,10.1038/s41467-021-26739-1
2,14677,"However, a comprehensive understanding of key parameters affecting the phase reconstruction to R-P perovskite is still unexplored.",Unveiling the key factor for the phase reconstruction and exsolved metallic particle distribution in perovskites,10.1038/s41467-021-26739-1
3,14677,"Herein, we propose the Gibbs free energy for oxygen vacancy formation in Pr-0.5(Ba/Sr)(0.5)TO3-delta (T = Mn, Fe, Co, and Ni) as the important factor in determining the type of phase reconstruction.",Unveiling the key factor for the phase reconstruction and exsolved metallic particle distribution in perovskites,10.1038/s41467-021-26739-1
4,14677,"Furthermore, using in-situ temperature & environment-controlled X-ray diffraction measurements, we report the phase diagram and optimum 'x' range required for the complete phase reconstruction to R-P perovskite in Pr0.5Ba0.5-xSrxFeO3-delta system.",Unveiling the key factor for the phase reconstruction and exsolved metallic particle distribution in perovskites,10.1038/s41467-021-26739-1
5,14677,"Among the Pr0.5Ba0.5-xSrxFeO3-delta, (Pr0.5Ba0.2Sr0.3)(2)FeO4+delta - Fe metal demonstrates the smallest size of exsolved Fe metal particles when the phase reconstruction occurs under reducing condition.",Unveiling the key factor for the phase reconstruction and exsolved metallic particle distribution in perovskites,10.1038/s41467-021-26739-1
6,14677,"The exsolved nano-Fe metal particles exhibit high particle density and are well-distributed on the perovskite surface, showing great catalytic activity in fuel cell and syngas production.",Unveiling the key factor for the phase reconstruction and exsolved metallic particle distribution in perovskites,10.1038/s41467-021-26739-1
7,14677,The complete phase reconstruction to Ruddlesden-Popper perovskite is greatly desirable to increase the exsolved particle distribution.,Unveiling the key factor for the phase reconstruction and exsolved metallic particle distribution in perovskites,10.1038/s41467-021-26739-1
8,14677,"Here, the authors report a key factor for the complete phase reconstruction in perovskites, leading to good catalytic activity in fuel cell and syngas production.",Unveiling the key factor for the phase reconstruction and exsolved metallic particle distribution in perovskites,10.1038/s41467-021-26739-1
