ID,Artigo,Sentencas,Titulo,DOI
1,12725,"The operation of solid oxide fuel cells on various fuels, such as natural gas, biogas and gases derived from biomass or coal gasification and distillate fuel reforming has been an active area of SOFC research in recent years.",Fuel flexibility study of an integrated 25 kW SOFC reformer system,10.1016/j.jpowsour.2004.11.068
2,12725,"In this study, we develop a theoretical understanding and thermodynamic simulation capability for investigation of an integrated SOFC reformer system operating on various fuels.",Fuel flexibility study of an integrated 25 kW SOFC reformer system,10.1016/j.jpowsour.2004.11.068
3,12725,The theoretical understanding and simulation results suggest that significant thermal management challenges may result from the use of different types of fuels in the same integrated fuel cell reformer system.,Fuel flexibility study of an integrated 25 kW SOFC reformer system,10.1016/j.jpowsour.2004.11.068
4,12725,Syngas derived from coal is simulated according to specifications from high-temperature entrained bed coal gasifiers.,Fuel flexibility study of an integrated 25 kW SOFC reformer system,10.1016/j.jpowsour.2004.11.068
5,12725,Diesel syngas is approximated from data obtained in a previous NFCRC study of JP-8 and diesel operation of the integrated 25 kW SOFC reformer system.,Fuel flexibility study of an integrated 25 kW SOFC reformer system,10.1016/j.jpowsour.2004.11.068
6,12725,"The syngas streams consist of mixtures of hydrogen, carbon monoxide, carbon dioxide, methane and nitrogen.",Fuel flexibility study of an integrated 25 kW SOFC reformer system,10.1016/j.jpowsour.2004.11.068
7,12725,"Although the SOFC can tolerate a wide variety in fuel composition, the current analyses suggest that performance of integrated SOFC reformer systems may require significant operating condition changes and/or system design changes in order to operate well on this variety of fuels.",Fuel flexibility study of an integrated 25 kW SOFC reformer system,10.1016/j.jpowsour.2004.11.068
8,12725,(c) 2005,Fuel flexibility study of an integrated 25 kW SOFC reformer system,10.1016/j.jpowsour.2004.11.068
9,12725,Elsevier B.V. All rights reserved.,Fuel flexibility study of an integrated 25 kW SOFC reformer system,10.1016/j.jpowsour.2004.11.068
