ID,Artigo,Sentencas,Titulo,DOI
1,19641,"Although numerous perovskite oxides can enhance the electrochemical activity via exsolved metallic nanoparticles on the surface, most of them can only be applied as catalysts in a reducing atmosphere.",Tailoring the Surface of Perovskite through In Situ Growth of Ru/RuO2Nanoparticles as Robust Symmetrical Electrodes for Reversible Solid Oxide Cells,10.1002/admi.202000828
2,19641,These nanoparticles cause serious performance degradation in oxidizing conditions due to the formation of low-conductive metal oxides.,Tailoring the Surface of Perovskite through In Situ Growth of Ru/RuO2Nanoparticles as Robust Symmetrical Electrodes for Reversible Solid Oxide Cells,10.1002/admi.202000828
3,19641,"This poses a big challenge to the design of highly active catalysts of electrochemical devices, especially for symmetrical solid oxide cells.",Tailoring the Surface of Perovskite through In Situ Growth of Ru/RuO2Nanoparticles as Robust Symmetrical Electrodes for Reversible Solid Oxide Cells,10.1002/admi.202000828
4,19641,"Herein, based on the strategy of exsolved metallic nanoparticles in A-site deficient perovskite, a unique and simple method is demonstrated for the synthesis of Ru/RuO(2)nanoparticles on the surface of perovskite oxide via in situ growth.",Tailoring the Surface of Perovskite through In Situ Growth of Ru/RuO2Nanoparticles as Robust Symmetrical Electrodes for Reversible Solid Oxide Cells,10.1002/admi.202000828
5,19641,The electrode material (La0.75Sr0.25)(0.9)Cr0.5Mn0.45Ru0.05O3-delta(LSCMR) is designed through careful choice of composition and the core idea is to make use of the exsolved nanoparticles concept applied for the first time at both hydrogen electrode and oxygen electrode for symmetrical solid oxide cells.,Tailoring the Surface of Perovskite through In Situ Growth of Ru/RuO2Nanoparticles as Robust Symmetrical Electrodes for Reversible Solid Oxide Cells,10.1002/admi.202000828
6,19641,"Inspired by exsolved Ru and RuO2, the surface-decorated LSCMR exhibits significantly enhanced electrochemical activity for both H(2)and O-2, respectively, accompanied by high redox long-term stability.",Tailoring the Surface of Perovskite through In Situ Growth of Ru/RuO2Nanoparticles as Robust Symmetrical Electrodes for Reversible Solid Oxide Cells,10.1002/admi.202000828
7,19641,"Moreover, simple, low-cost, and environmental-friendly synthesis of Ru/RuO(2)nanoparticles on the substrate of typical perovskites is realized with this in situ growth approach.",Tailoring the Surface of Perovskite through In Situ Growth of Ru/RuO2Nanoparticles as Robust Symmetrical Electrodes for Reversible Solid Oxide Cells,10.1002/admi.202000828
