ID,Artigo,Sentencas,Titulo,DOI
1,12442,Electrochemical devices are central to sustainable energy storage and conversion.,Revitalizing degraded solid oxide fuel cells in sour fuels for bifunctional oxygen catalysis in zinc-air batteries,10.1039/d0gc01699c
2,12442,"Currently, most of the spent devices end up in landfills or the conventional toxic and energy-intensive metal extraction processes.",Revitalizing degraded solid oxide fuel cells in sour fuels for bifunctional oxygen catalysis in zinc-air batteries,10.1039/d0gc01699c
3,12442,Advanced reuse and re-valorization practices are lacking due to both technical and economic barriers.,Revitalizing degraded solid oxide fuel cells in sour fuels for bifunctional oxygen catalysis in zinc-air batteries,10.1039/d0gc01699c
4,12442,"To address this growing concern, we herein demonstrate that the fully degraded electrode of the state-of-the-art anode-supported solid oxide fuel cells (SOFCs) can be revitalizedin situduring the operation.",Revitalizing degraded solid oxide fuel cells in sour fuels for bifunctional oxygen catalysis in zinc-air batteries,10.1039/d0gc01699c
5,12442,The facile treatment involves fueling the SOFC with the readily available fuels containing H2S and the electrode pulverization.,Revitalizing degraded solid oxide fuel cells in sour fuels for bifunctional oxygen catalysis in zinc-air batteries,10.1039/d0gc01699c
6,12442,The resulting powder comprises porous particles with mixed nickel sulfide nanoclusters dispersed on Y-stabilized ZrO2(NiSx/YSZ) which enables superior activity in both the oxygen reduction reaction (ORR) and oxygen evolution reaction (OER).,Revitalizing degraded solid oxide fuel cells in sour fuels for bifunctional oxygen catalysis in zinc-air batteries,10.1039/d0gc01699c
7,12442,"Its voltage gap between the ORR half-wave potential and OER potential at the benchmark 10 mA cm(-2)reached 0.74 V, rendering stable and efficient performance in a rechargeable Zn-air battery.",Revitalizing degraded solid oxide fuel cells in sour fuels for bifunctional oxygen catalysis in zinc-air batteries,10.1039/d0gc01699c
8,12442,This work might boost the awareness of treating end-of-life electrochemical materials sustainably and pave new ways for the circular economy.,Revitalizing degraded solid oxide fuel cells in sour fuels for bifunctional oxygen catalysis in zinc-air batteries,10.1039/d0gc01699c
