ID,Artigo,Sentencas,Titulo,DOI
1,16962,Applying protective coatings on metallic interconnects are being considered as the most effective approach to improve the metal endurance in solid oxide fuel cell (SOFC) technology.,"Electrophoretic deposition of (Mn,Co)3O4 spinel nano powder on SOFC metallic interconnects",10.1016/j.matlet.2012.04.072
2,16962,The importance of a high green density to improve the sintered density and various properties of sintered ceramic materials is also well-known.,"Electrophoretic deposition of (Mn,Co)3O4 spinel nano powder on SOFC metallic interconnects",10.1016/j.matlet.2012.04.072
3,16962,"In the present study, electrophoretic deposition (EPD) of (Mn,Co)(3)O-4 powder in iodine-added ethanol suspension was studied under constant voltage (50 V) and concentration (10 g.l(-1)).","Electrophoretic deposition of (Mn,Co)3O4 spinel nano powder on SOFC metallic interconnects",10.1016/j.matlet.2012.04.072
4,16962,The packing behavior of green layers was investigated during deposition.,"Electrophoretic deposition of (Mn,Co)3O4 spinel nano powder on SOFC metallic interconnects",10.1016/j.matlet.2012.04.072
5,16962,"An increase in solid fraction participating in the coating layer was observed with deposition time, showing that the microstructure of the deposit becomes more close-packed when EPD is prolonged.","Electrophoretic deposition of (Mn,Co)3O4 spinel nano powder on SOFC metallic interconnects",10.1016/j.matlet.2012.04.072
6,16962,A kinetic relation based on density-time proportionality was proposed regarding the mechanism of packing of particles during EPD.,"Electrophoretic deposition of (Mn,Co)3O4 spinel nano powder on SOFC metallic interconnects",10.1016/j.matlet.2012.04.072
7,16962,(C) 2012,"Electrophoretic deposition of (Mn,Co)3O4 spinel nano powder on SOFC metallic interconnects",10.1016/j.matlet.2012.04.072
8,16962,Elsevier B.V. All rights reserved.,"Electrophoretic deposition of (Mn,Co)3O4 spinel nano powder on SOFC metallic interconnects",10.1016/j.matlet.2012.04.072
