ID,Artigo,Sentencas,Titulo,DOI
1,10498,"The development of solid oxide electrochemical devices with symmetrical electrodes, is a promising direction in the field of resource saving and green energy.",Performance and redox stability of a double-layer Sr2Fe1.5Mo0.5O6-δ - based electrode for solid state electrochemical application,10.1016/j.electacta.2020.137058
2,10498,"A feature of symmetrical electrodes is their stability to reduction-oxidation (redox) cycling, which can be useful in the case of carbon or sulphur deposition on a fuel electrode.",Performance and redox stability of a double-layer Sr2Fe1.5Mo0.5O6-δ - based electrode for solid state electrochemical application,10.1016/j.electacta.2020.137058
3,10498,"The results of studies of a double-layer symmetrical electrode, where the functional layer consist of 50 wt.% Sr2Fe1.5Mo0.5O6-delta + 50 wt.% Ce0.8Sm0.2O1.9-delta and the collector is Sr2Fe1.5Mo0.5O6-delta are presented for the first time.",Performance and redox stability of a double-layer Sr2Fe1.5Mo0.5O6-δ - based electrode for solid state electrochemical application,10.1016/j.electacta.2020.137058
4,10498,"It was shown that the introduction of Ce0.8Sm0.2O1.9-delta into the electrode functional layer, as well as the use of the current layer, does not lead to a change in the mechanism of oxygen reduction and hydrogen oxidation reactions.",Performance and redox stability of a double-layer Sr2Fe1.5Mo0.5O6-δ - based electrode for solid state electrochemical application,10.1016/j.electacta.2020.137058
5,10498,An analysis of the fuel cell impedance spectra by the distribution of relaxation times (DRT) method and comparison of the DRT functions with the results of the analysis of symmetric cells made it possible to conclude that during redox cycling the resistance of the oxygen exchange stage increases.,Performance and redox stability of a double-layer Sr2Fe1.5Mo0.5O6-δ - based electrode for solid state electrochemical application,10.1016/j.electacta.2020.137058
6,10498,"It has been suggested that the cause of this is the formation of iron under reducing conditions, followed by its oxidation to oxide in an oxidizing atmosphere.",Performance and redox stability of a double-layer Sr2Fe1.5Mo0.5O6-δ - based electrode for solid state electrochemical application,10.1016/j.electacta.2020.137058
7,10498,(C) 2020,Performance and redox stability of a double-layer Sr2Fe1.5Mo0.5O6-δ - based electrode for solid state electrochemical application,10.1016/j.electacta.2020.137058
8,10498,Elsevier Ltd.,Performance and redox stability of a double-layer Sr2Fe1.5Mo0.5O6-δ - based electrode for solid state electrochemical application,10.1016/j.electacta.2020.137058
9,10498,All rights reserved.,Performance and redox stability of a double-layer Sr2Fe1.5Mo0.5O6-δ - based electrode for solid state electrochemical application,10.1016/j.electacta.2020.137058
