ID,Artigo,Sentencas,Titulo,DOI
1,1993,The direct use of n-butane in solid oxide fuel cell (SOFC) systems has been challenging due to high performance degradation and/or failure due to carbon deposition on the anode.,Thermal partial oxidation of n-butane in a micro-flow reactor and solid oxide fuel cell stability assessment,10.1016/j.enconman.2022.115222
2,1993,"Previous works have explored SOFCs with expensive integrated catalysts to promote the longevity of the SOFC, but few have achieved significant operating hours.",Thermal partial oxidation of n-butane in a micro-flow reactor and solid oxide fuel cell stability assessment,10.1016/j.enconman.2022.115222
3,1993,"In this work, a SOFC with no integrated catalyst is fed n-butane for 288 h utilizing a novel micro fuel reformer.",Thermal partial oxidation of n-butane in a micro-flow reactor and solid oxide fuel cell stability assessment,10.1016/j.enconman.2022.115222
4,1993,"The impact of temperature (800-900 degrees C), total flow rate (10-50 mL.minxfffd; 1), and equivalence ratio (1-5) on the thermal partial oxidation of n-butane in the micro-flow reactor are characterized.",Thermal partial oxidation of n-butane in a micro-flow reactor and solid oxide fuel cell stability assessment,10.1016/j.enconman.2022.115222
5,1993,A literature review of n-butane fueled SOFC systems confirms that the 288-hour long term stability test achieved in this study is among the longest conducted with a low voltage degradation of 0.00034 V.h-1.,Thermal partial oxidation of n-butane in a micro-flow reactor and solid oxide fuel cell stability assessment,10.1016/j.enconman.2022.115222
6,1993,Scanning electron microscope (SEM) images of the SOFC anode confirm no carbon deposition occurred on the surface.,Thermal partial oxidation of n-butane in a micro-flow reactor and solid oxide fuel cell stability assessment,10.1016/j.enconman.2022.115222
7,1993,Microscale partial oxidation with light internal reforming provides an alternative to traditional catalytic oxidation and internal reforming SOFC systems.,Thermal partial oxidation of n-butane in a micro-flow reactor and solid oxide fuel cell stability assessment,10.1016/j.enconman.2022.115222
