ID,Artigo,Sentencas,Titulo,DOI
1,2286,"The operating temperature of solid oxide fuel cell stack (SOFC) is an important parameter to be controlled, which impacts the SOFC performance and its lifetime.",SOFC regulation at constant temperature: Experimental test and data regression study,10.1016/j.enconman.2016.03.028
2,2286,Rapid temperature change implies a significant temperature differences between the surface and the mean body leading to a state of thermal shock.,SOFC regulation at constant temperature: Experimental test and data regression study,10.1016/j.enconman.2016.03.028
3,2286,"Thermal shock and thermal cycling introduce stress in a material, due to temperature differences between the surface and the interior, or between different regions of the cell.",SOFC regulation at constant temperature: Experimental test and data regression study,10.1016/j.enconman.2016.03.028
4,2286,"In this context, in order to determine a control law that permit to maintain constant the fuel cell temperature varying the electrical load and the infeed fuel mixture, an experimental activity were carried out on a planar SOFC short stack to analyse stack temperature.",SOFC regulation at constant temperature: Experimental test and data regression study,10.1016/j.enconman.2016.03.028
5,2286,"Specifically, three different anodic inlet gas compositions were tested: pure hydrogen, reformed natural gas with steam to carbon ratio equal to 2 and 2.5.",SOFC regulation at constant temperature: Experimental test and data regression study,10.1016/j.enconman.2016.03.028
6,2286,"By processing the obtained results, a regression law was defined to regulate the air flow rate to be provided to the fuel cell to maintain constant its operating temperature varying its operating conditions.",SOFC regulation at constant temperature: Experimental test and data regression study,10.1016/j.enconman.2016.03.028
7,2286,(c) 2016,SOFC regulation at constant temperature: Experimental test and data regression study,10.1016/j.enconman.2016.03.028
8,2286,Elsevier Ltd.,SOFC regulation at constant temperature: Experimental test and data regression study,10.1016/j.enconman.2016.03.028
9,2286,All rights reserved.,SOFC regulation at constant temperature: Experimental test and data regression study,10.1016/j.enconman.2016.03.028
