ID,Artigo,Sentencas,Titulo,DOI
1,2916,This work proposes a novel yet practical dragonfly optimization algorithm that addresses four competing ob-jectives simultaneously.,"An innovative four-objective dragonfly-inspired optimization algorithm for an efficient, green, and cost-effective waste heat recovery from SOFC",10.1016/j.energy.2022.125607
2,2916,The proposed algorithm is applied to a hybrid system driven by the solid oxide fuel cell (SOFC) integrated with waste heat recovery units.,"An innovative four-objective dragonfly-inspired optimization algorithm for an efficient, green, and cost-effective waste heat recovery from SOFC",10.1016/j.energy.2022.125607
3,2916,A function-fitting neural network is developed to combine the thermodynamic model of the system with the dragonfly algorithm to mitigate the calculation time.,"An innovative four-objective dragonfly-inspired optimization algorithm for an efficient, green, and cost-effective waste heat recovery from SOFC",10.1016/j.energy.2022.125607
4,2916,"According to the optimization outcomes, the optimum parameters create significantly more power and have a greater exergy efficiency and reduced product costs and CO2 emissions compared to the design condition.","An innovative four-objective dragonfly-inspired optimization algorithm for an efficient, green, and cost-effective waste heat recovery from SOFC",10.1016/j.energy.2022.125607
5,2916,"The sensitivity analysis reveals that while the turbine inlet temperatures of power cycles are ineffective, the fuel utilization factor and the current density significantly impact performance indicators.","An innovative four-objective dragonfly-inspired optimization algorithm for an efficient, green, and cost-effective waste heat recovery from SOFC",10.1016/j.energy.2022.125607
6,2916,The scatter distribution indicates that the fuel cell temperature and steam-to-carbon ratio should be kept at their lowest bound.,"An innovative four-objective dragonfly-inspired optimization algorithm for an efficient, green, and cost-effective waste heat recovery from SOFC",10.1016/j.energy.2022.125607
7,2916,The Sankey graph shows that the fuel cell and afterburner are the main sources of irreversibility.,"An innovative four-objective dragonfly-inspired optimization algorithm for an efficient, green, and cost-effective waste heat recovery from SOFC",10.1016/j.energy.2022.125607
8,2916,"According to the chord diagram, the SOFC unit with a cost rate of 13.2 $/h accounts for more than 29% of the overall cost.","An innovative four-objective dragonfly-inspired optimization algorithm for an efficient, green, and cost-effective waste heat recovery from SOFC",10.1016/j.energy.2022.125607
9,2916,"Finally, under ideal conditions, the flue gas condensation process produces an additional 94.22 kW of power and 760,056 L/day of drinkable water.","An innovative four-objective dragonfly-inspired optimization algorithm for an efficient, green, and cost-effective waste heat recovery from SOFC",10.1016/j.energy.2022.125607
