ID,Artigo,Sentencas,Titulo,DOI
1,2670,"In this study, Ca1-xLaxTiO3 (CLT, x = 0, 0.05, 0.1, 0.15, and 0.2) was characterized as an anode material for solid oxide fuel cells.",Electrochemical properties of Ca1-xLaxTiO3 anode materials for solid oxide fuel cells,
2,2670,The single-phase Ca1-xLaxTiO3 powder was synthesized in a solid-state reaction via calcination at 1100 degrees C in both oxidizing and reducing atmospheres.,Electrochemical properties of Ca1-xLaxTiO3 anode materials for solid oxide fuel cells,
3,2670,"The total conductivity of Ca1-xLaxTiO3 synthesized in a reducing atmosphere was higher than that of Ca1-xLaxTiO3 synthesized in an oxidizing atmosphere at the same composition due to an increase in the amount of Ti3+ ions related to charge carrier, based on X-ray photoelectron spectroscopy (XPS) analysis.",Electrochemical properties of Ca1-xLaxTiO3 anode materials for solid oxide fuel cells,
4,2670,"The Ca1-xLaxTiO3 showed better tolerance to carbon deposition than Ni-YSZ, and the catalytic activity of the Ca1-xLaxTiO3 synthesized in an oxidizing atmosphere decreased with increasing La content.",Electrochemical properties of Ca1-xLaxTiO3 anode materials for solid oxide fuel cells,
5,2670,"Of the Ca1-xLaxTiO3 synthesized in a reducing atmosphere, Ca0.85La0.15TiO3 showed the best electrochemical performance.",Electrochemical properties of Ca1-xLaxTiO3 anode materials for solid oxide fuel cells,
