ID,Artigo,Sentencas,Titulo,DOI
1,20638,"We discuss the thermodynamic meaning of the oxygen overpotential, and derive a fundamental theoretical equation for the impedance spectrum of a system comprising an oxygen ion conductor and a metallic electrode under a mixture of oxygen and inert gas, as might be found at the cathode of a solid oxide fuel cell.",Theoretical modeling of electrode impedance for an oxygen ion conductor and metallic electrode system based on the interfacial conductivity theory,10.1016/j.ssi.2012.11.012
2,20638,"Our derivation combines aspects of classical irreversible thermodynamics, Wagner's theory and the concepts of the interfacial conductivity theory.",Theoretical modeling of electrode impedance for an oxygen ion conductor and metallic electrode system based on the interfacial conductivity theory,10.1016/j.ssi.2012.11.012
3,20638,The oxygen overpotential at the oxygen ion conductor/metallic electrode interface under steady state conditions is found to be related to the rate of entropy production by neutral oxygen diffusion and desorption from the interface to the gas phase.,Theoretical modeling of electrode impedance for an oxygen ion conductor and metallic electrode system based on the interfacial conductivity theory,10.1016/j.ssi.2012.11.012
4,20638,"The generalized impedance equation derived in this study can be applied not only under open cell conditions but also in the steady state polarized condition, which corresponds to experimental impedance measurements under a d.c. bias voltage.",Theoretical modeling of electrode impedance for an oxygen ion conductor and metallic electrode system based on the interfacial conductivity theory,10.1016/j.ssi.2012.11.012
5,20638,"When the oxygen flux, resulting from a small perturbation force, follows Fick's first law, and the relaxation process proceeds via the change in adsorbed concentration of oxygen on the electrode surface, the impedance spectrum becomes semicircular in the Nyquist diagram.",Theoretical modeling of electrode impedance for an oxygen ion conductor and metallic electrode system based on the interfacial conductivity theory,10.1016/j.ssi.2012.11.012
6,20638,"The electrode resistance and the electrode capacitance estimated from equivalent electric circuit analysis reflect the chemical reaction response, or in other words, the chemical resistance and chemical capacitance.",Theoretical modeling of electrode impedance for an oxygen ion conductor and metallic electrode system based on the interfacial conductivity theory,10.1016/j.ssi.2012.11.012
7,20638,(C) 2012,Theoretical modeling of electrode impedance for an oxygen ion conductor and metallic electrode system based on the interfacial conductivity theory,10.1016/j.ssi.2012.11.012
8,20638,Elsevier B.V. All rights reserved.,Theoretical modeling of electrode impedance for an oxygen ion conductor and metallic electrode system based on the interfacial conductivity theory,10.1016/j.ssi.2012.11.012
