ID,Artigo,Sentencas,Titulo,DOI
1,2206,A solid oxide fuel cell (SOFC) is regarded as the first choice of high-efficiency and clean power generation technology in the 21st century due to its characteristics of high power generation efficiency and low pollutant emission.,Effect of steam reinjection mass flow rate on the SOFC-GT system with steam reinjection,10.3389/fenrg.2024.1336807
2,2206,"In this paper, hydrogen is used as a fuel for SOFCs using the EBSILON platform.",Effect of steam reinjection mass flow rate on the SOFC-GT system with steam reinjection,10.3389/fenrg.2024.1336807
3,2206,A sensitivity analysis of the solid oxide fuel cell-gas turbine (SOFC-GT) system with steam reinjection is carried out to investigate the effect of the steam reinjection mass flow rate on the improvement of the electrical efficiency of the system and on the values of the other parameters.,Effect of steam reinjection mass flow rate on the SOFC-GT system with steam reinjection,10.3389/fenrg.2024.1336807
4,2206,The results show that the variation in the steam reinjection mass flow rate has an effect on other parameters.,Effect of steam reinjection mass flow rate on the SOFC-GT system with steam reinjection,10.3389/fenrg.2024.1336807
5,2206,"Changes in several parameters affect the electrical efficiency of the system, which reaches 74.11% at a pressure ratio of 10, SOFC inlet temperature of 783.15 K, turbine back pressure of 70 kPa, and steam reinjection mass flow rate of 6.16 kg/s. Future research can optimize the overall parameter selection of the system in terms of economy and other aspects.",Effect of steam reinjection mass flow rate on the SOFC-GT system with steam reinjection,10.3389/fenrg.2024.1336807
