ID,Artigo,Sentencas,Titulo,DOI
1,2597,Wet Powder Spraying (WPS) is a well-known method of deposition recently used for elaboration of dense electrolytes or porous electrodes thin films in solid oxide fuel cells.,High performance anode-supported proton ceramic fuel cell elaborated by wet powder spraying,10.1016/j.ijhydene.2016.05.094
2,2597,"In this work, WPS has been used to deposit the electrolyte and cathode materials of a proton conducting ceramic fuel cell (PCFC) operating at intermediate temperature.",High performance anode-supported proton ceramic fuel cell elaborated by wet powder spraying,10.1016/j.ijhydene.2016.05.094
3,2597,"A cell with a dense 4 um thick BaZr0.1Ce0.7Y0.1Yb0.1O3 - delta (BZCYYb) electrolyte, a Ba0.5Sr0.5Co0.8Fe0.2O3 (- delta) - BZCYYb (BSCF-BZCYYb) composite cathode and a porous Ni-electrolyte cermet was developed and characterized.",High performance anode-supported proton ceramic fuel cell elaborated by wet powder spraying,10.1016/j.ijhydene.2016.05.094
4,2597,The electrolyte and the cathode materials were successfully deposited by WPS on an anode support of 40 mm in diameter.,High performance anode-supported proton ceramic fuel cell elaborated by wet powder spraying,10.1016/j.ijhydene.2016.05.094
5,2597,"High open-circuit voltages (OCV > 1 V) were observed with this cell, and maximum power densities of 418, 532 and 634 mW cm(-2) were obtained at 600, 650 and 700 degrees C respectively.",High performance anode-supported proton ceramic fuel cell elaborated by wet powder spraying,10.1016/j.ijhydene.2016.05.094
6,2597,"The results demonstrated that WPS is an attractive technique, suitable for up-scaling planar anode supported PCFC.",High performance anode-supported proton ceramic fuel cell elaborated by wet powder spraying,10.1016/j.ijhydene.2016.05.094
7,2597,(C) 2016 Hydrogen Energy Publications LLC.,High performance anode-supported proton ceramic fuel cell elaborated by wet powder spraying,10.1016/j.ijhydene.2016.05.094
8,2597,Published by Elsevier Ltd.,High performance anode-supported proton ceramic fuel cell elaborated by wet powder spraying,10.1016/j.ijhydene.2016.05.094
9,2597,All rights reserved.,High performance anode-supported proton ceramic fuel cell elaborated by wet powder spraying,10.1016/j.ijhydene.2016.05.094
