ID,Artigo,Sentencas,Titulo,DOI
1,2370,"Herein, perovskite oxide Sr2Fe1.4Co0.1Mo0.5O6-delta (SFMCo) is used as the anode of direct propane-fueled solid oxide fuel cells (SOFCs).",Co-generation of liquid chemicals and electricity over Co-Fe alloy/ perovskite anode catalyst in a propane fueled solid oxide fuel cell,10.1016/j.seppur.2022.120890
2,2370,"In reducing operation, single-phase perovskite oxide SFMCo is transformed to Co-Fe bimetallic catalytic nanocatalysts decorated SFMCo composite nanomaterial.",Co-generation of liquid chemicals and electricity over Co-Fe alloy/ perovskite anode catalyst in a propane fueled solid oxide fuel cell,10.1016/j.seppur.2022.120890
3,2370,Good electrochemical performance and outstanding stability are obtained with propane as the fuel and ambient air as the oxidant.,Co-generation of liquid chemicals and electricity over Co-Fe alloy/ perovskite anode catalyst in a propane fueled solid oxide fuel cell,10.1016/j.seppur.2022.120890
4,2370,"Due to the catalytic effect of the exsolved Co-Fe alloy in the SOFC system, polycyclic aromatic compounds are gathered as chemical products in the exhaust of the anode through the aromatization route.",Co-generation of liquid chemicals and electricity over Co-Fe alloy/ perovskite anode catalyst in a propane fueled solid oxide fuel cell,10.1016/j.seppur.2022.120890
5,2370,This novel anode system manifests the successful co-generation of electricity and high-value liquid chemicals from direct hydrocarbonfueled SOFC.,Co-generation of liquid chemicals and electricity over Co-Fe alloy/ perovskite anode catalyst in a propane fueled solid oxide fuel cell,10.1016/j.seppur.2022.120890
