ID,Artigo,Sentencas,Titulo,DOI
1,2462,This work presents a methodology for simulation of fuel cells to be used in power production in small on-site power/cogeneration plants that use natural gas as fuel.,"A methodology for thermodynamic simulation of high temperature, internal reforming fuel cell systems",10.1016/j.jpowsour.2004.09.039
2,2462,"The methodology contemplates thermodynamics and electrochemical aspects related to molten carbonate and solid oxide fuel cells (MCFC and SOFC, respectively).","A methodology for thermodynamic simulation of high temperature, internal reforming fuel cell systems",10.1016/j.jpowsour.2004.09.039
3,2462,Internal steam reforming of the natural gas hydrocarbons is considered for hydrogen production.,"A methodology for thermodynamic simulation of high temperature, internal reforming fuel cell systems",10.1016/j.jpowsour.2004.09.039
4,2462,"From inputs as cell potential, cell power, number of cell in the stack, ancillary systems power consumption, reformed natural gas composition and hydrogen utilization factor, the simulation gives the natural gas consumption, anode and cathode stream gases temperature and composition, and thermodynamic, electrochemical and practical efficiencies.","A methodology for thermodynamic simulation of high temperature, internal reforming fuel cell systems",10.1016/j.jpowsour.2004.09.039
5,2462,Both energetic and exergetic methods are considered for performance analysis.,"A methodology for thermodynamic simulation of high temperature, internal reforming fuel cell systems",10.1016/j.jpowsour.2004.09.039
6,2462,"The results obtained from natural gas reforming thermodynamics simulation show that the hydrogen production is maximum around 700 degrees C, for a steam/carbon ratio equal to 3.","A methodology for thermodynamic simulation of high temperature, internal reforming fuel cell systems",10.1016/j.jpowsour.2004.09.039
7,2462,"As shown in the literature, the found results indicate that the SOFC is more efficient than MCFC.","A methodology for thermodynamic simulation of high temperature, internal reforming fuel cell systems",10.1016/j.jpowsour.2004.09.039
8,2462,(c) 2004,"A methodology for thermodynamic simulation of high temperature, internal reforming fuel cell systems",10.1016/j.jpowsour.2004.09.039
9,2462,Elsevier B.V. All rights reserved.,"A methodology for thermodynamic simulation of high temperature, internal reforming fuel cell systems",10.1016/j.jpowsour.2004.09.039
