ID,Artigo,Sentencas,Titulo,DOI
1,2625,Auxiliary power units (APUs) are devices that can provide all or part of the non-propulsion power of a vehicle.,Impacts assessment and trade-offs of fuel cell-based auxiliary power units Part I: System performance and cost modeling,10.1016/j.jpowsour.2004.07.023
2,2625,"They do not replace the main internal combustion engine, but they complement it offering low consumption, high comfort and low emissions during the idling periods of the vehicle.",Impacts assessment and trade-offs of fuel cell-based auxiliary power units Part I: System performance and cost modeling,10.1016/j.jpowsour.2004.07.023
3,2625,"This work presents an integrated framework to evaluate the trade-offs between cost effectiveness, efficiency and health and environmental impacts of fuel cell power systems considering various stages of the life cycle of the device.",Impacts assessment and trade-offs of fuel cell-based auxiliary power units Part I: System performance and cost modeling,10.1016/j.jpowsour.2004.07.023
4,2625,"The integrated framework has six main components, namely system level modeling, cost modeling, environmental impact assessment, health impact assessment, life cycle assessment and multi-objective optimization.",Impacts assessment and trade-offs of fuel cell-based auxiliary power units Part I: System performance and cost modeling,10.1016/j.jpowsour.2004.07.023
5,2625,"In part I of these two papers, concerning the integrated framework, the first two components are described and applied to a solid oxide fuel cell-based auxiliary power unit.",Impacts assessment and trade-offs of fuel cell-based auxiliary power units Part I: System performance and cost modeling,10.1016/j.jpowsour.2004.07.023
6,2625,All the results are validated with experimental data or other published models.,Impacts assessment and trade-offs of fuel cell-based auxiliary power units Part I: System performance and cost modeling,10.1016/j.jpowsour.2004.07.023
7,2625,(C) 2004,Impacts assessment and trade-offs of fuel cell-based auxiliary power units Part I: System performance and cost modeling,10.1016/j.jpowsour.2004.07.023
8,2625,Elsevier B.V. All rights reserved.,Impacts assessment and trade-offs of fuel cell-based auxiliary power units Part I: System performance and cost modeling,10.1016/j.jpowsour.2004.07.023
