ID,Artigo,Sentencas,Titulo,DOI
1,2362,"Low-temperature solid oxide fuel cells (LT-SOFCs) are a promising next-generation fuel cell due to their low cost and rapid start-up, posing a significant challenge to electrode materials with high electrocatalytic activity.",Nickel-iron nanoparticles encapsulated in carbon nanotubes prepared from waste plastics for low-temperature solid oxide fuel cells,10.1016/j.isci.2022.104855
2,2362,"Herein, we reported the bimetallic nanoparticles encapsulated in carbon nanotubes (NiFe@CNTs) prepared by carefully controlling catalytic pyrolysis of waste plastics.",Nickel-iron nanoparticles encapsulated in carbon nanotubes prepared from waste plastics for low-temperature solid oxide fuel cells,10.1016/j.isci.2022.104855
3,2362,Results showed that plenty of multi-walled CNTs with outer diameters (14.38 +/- 3.84 nm) were observed due to the smallest crystalline size of Ni-Fe alloy nanoparticles.,Nickel-iron nanoparticles encapsulated in carbon nanotubes prepared from waste plastics for low-temperature solid oxide fuel cells,10.1016/j.isci.2022.104855
4,2362,"SOFCs with such NiFe@CNTs blended in anode exhibited remarkable performances, reaching a maximum power density of 885 mW cm(-2) at 500 degrees C.",Nickel-iron nanoparticles encapsulated in carbon nanotubes prepared from waste plastics for low-temperature solid oxide fuel cells,10.1016/j.isci.2022.104855
5,2362,This could be attributed to the well-dispersed alloy nanoparticles and high graphitization degree of NiFe@CNTs to improve HOR activity.,Nickel-iron nanoparticles encapsulated in carbon nanotubes prepared from waste plastics for low-temperature solid oxide fuel cells,10.1016/j.isci.2022.104855
6,2362,"Our strategy could upcycle waste plastics to produce nanocomposites and demonstrate a high-performance LT-SOFCs system, addressing the challenges of sustainable waste management and guaranteeing global energy safety simultaneously.",Nickel-iron nanoparticles encapsulated in carbon nanotubes prepared from waste plastics for low-temperature solid oxide fuel cells,10.1016/j.isci.2022.104855
