ID,Artigo,Sentencas,Titulo,DOI
1,20044,"Since compact structure and centimeter size of solid-oxide fuel cell system equipped with micro gas turbine (SOFC-MGT), the heat of a micro radial-inflow turbine (RIT) is transferred to compressor through wall heat transfer.",Design and experiment study of a micro radial-flow turbine for a SOFC-MGT turbine hybrid system,10.1016/j.enconman.2022.115861
2,20044,"In this work, an integrated design method considering wall heat transfer was proposed to develop an efficient micro-RIT applied to c.",Design and experiment study of a micro radial-flow turbine for a SOFC-MGT turbine hybrid system,10.1016/j.enconman.2022.115861
3,20044,The one-dimensional design method considering wall heat transfer was established according to theoretical analysis and empirical correlations.,Design and experiment study of a micro radial-flow turbine for a SOFC-MGT turbine hybrid system,10.1016/j.enconman.2022.115861
4,20044,"The geometric structure of micro-RIT was produced based on the distribution of blade angle, blade thickness and meridional streamline.",Design and experiment study of a micro radial-flow turbine for a SOFC-MGT turbine hybrid system,10.1016/j.enconman.2022.115861
5,20044,The structural parameters were optimized by three-dimensional numerical simulation of fluid-thermal-structural coupling to obtain the best geometric model of micro-RIT.,Design and experiment study of a micro radial-flow turbine for a SOFC-MGT turbine hybrid system,10.1016/j.enconman.2022.115861
6,20044,A new test method was employed to verify the accuracy of the integrated design method.,Design and experiment study of a micro radial-flow turbine for a SOFC-MGT turbine hybrid system,10.1016/j.enconman.2022.115861
7,20044,The results indicate that the integrated design method under adiabatic condition and considering wall heat transfer have the same design accuracy for the mass flow of micro-RIT.,Design and experiment study of a micro radial-flow turbine for a SOFC-MGT turbine hybrid system,10.1016/j.enconman.2022.115861
8,20044,"However, compared with the integrated design method under adiabatic condition, the integrated design method considering wall heat transfer has better design accuracy for the efficiency of micro-RIT.",Design and experiment study of a micro radial-flow turbine for a SOFC-MGT turbine hybrid system,10.1016/j.enconman.2022.115861
9,20044,"The maximum error of integrated design method under adiabatic condition is 3.53%, that of integrated design method considering wall heat transfer is 2.71%.",Design and experiment study of a micro radial-flow turbine for a SOFC-MGT turbine hybrid system,10.1016/j.enconman.2022.115861
