ID,Artigo,Sentencas,Titulo,DOI
1,2429,"An ultra-thin-film, low-temperature, high performing solid-oxide fuel cell (LT-SOFC) was successfully fabricated on an anodized aluminum oxide (MO) supporting structure via atomic layer deposition (ALD).",High-performance ultra-thin film solid oxide fuel cell using anodized-aluminum-oxide supporting structure,10.1016/j.elecom.2014.07.008
2,2429,"A dense and pinhole free layer of hybrid platinum (Pt) was applied to reduce the size of the substrate pores, in order to facilitate the development of a dense electrolyte on the Pt electrode while maintaining the gaseous fuel access.",High-performance ultra-thin film solid oxide fuel cell using anodized-aluminum-oxide supporting structure,10.1016/j.elecom.2014.07.008
3,2429,"As a result, about 180 nm-thick yttria-stabilized zirconia (YSZ) electrolyte was successfully deposited without pinholes.",High-performance ultra-thin film solid oxide fuel cell using anodized-aluminum-oxide supporting structure,10.1016/j.elecom.2014.07.008
4,2429,"This ultra-thin-film, MO-supported LT-SOFC demonstrates the highest performance with a maximum power density of 380 mW/cm(2) at an operating temperature of 450 degrees C. (C) 2014",High-performance ultra-thin film solid oxide fuel cell using anodized-aluminum-oxide supporting structure,10.1016/j.elecom.2014.07.008
5,2429,Elsevier B.V. All rights reserved.,High-performance ultra-thin film solid oxide fuel cell using anodized-aluminum-oxide supporting structure,10.1016/j.elecom.2014.07.008
