ID,Artigo,Sentencas,Titulo,DOI
1,3300,"Solid oxide fuel cells are extremely flexible energy conversion systems able to operate within a broad temperature range (500-1000 degrees C), with a variety of fuels (from hydrogen to liquid fuels), including concepts able to be scaled to deliver power from the milliwatt to the megawatt range.",Electrolytes for solid oxide fuel cells,10.1002/wene.23
2,3300,"The solid electrolyte, as an ionic charge carrier, is one central component that determines the operational characteristics of the fuel cell system, namely the working temperature.",Electrolytes for solid oxide fuel cells,10.1002/wene.23
3,3300,Design of new electrolytes includes manipulation of ionic defects concentration and mobility.,Electrolytes for solid oxide fuel cells,10.1002/wene.23
4,3300,"Here, particular attention is given to the impact on ionic transport of point defects in various types of structures, dislocations, grain boundaries, and heterostructure interfaces.",Electrolytes for solid oxide fuel cells,10.1002/wene.23
5,3300,"Properties derived from structural and compositional characteristics, but also from microstructural features, including recent complex engineered thin films, are reviewed.",Electrolytes for solid oxide fuel cells,10.1002/wene.23
6,3300,Major families of materials are compared with respect to key performance parameters.,Electrolytes for solid oxide fuel cells,10.1002/wene.23
7,3300,"Finally, the effects of composition, structure, microstructure, and strain on ionic transport are assessed as complementary tools for future developments in solid electrolyte materials.",Electrolytes for solid oxide fuel cells,10.1002/wene.23
8,3300,"(C) 2012 John Wiley & Sons, Ltd.",Electrolytes for solid oxide fuel cells,10.1002/wene.23
