ID,Artigo,Sentencas,Titulo,DOI
1,3302,A co-doped ceria-carbonate (Ce0.8Sm0.2-xCaxO2-delta-Na2CO3) has been synthesized by a co-precipitation method.,Electrochemical study on co-doped ceria-carbonate composite electrolyte,10.1016/j.jpowsour.2011.10.124
2,3302,"The detailed electrochemical characterizations (e.g. impedance spectra, polarization curve and IV curves) of this composite material are reported and discussed.",Electrochemical study on co-doped ceria-carbonate composite electrolyte,10.1016/j.jpowsour.2011.10.124
3,3302,The two phase nanocomposite electrolytes with carbonate coated on the co-doped ceria displays dual (H+/O2-) ion conduction at low temperature (300-600 degrees C) in solid oxide fuel cell.,Electrochemical study on co-doped ceria-carbonate composite electrolyte,10.1016/j.jpowsour.2011.10.124
4,3302,The observed remarkable temperature-dependent of conductivity is attributed to the softening/melting of carbonate phase as the physical state of carbonate phase transforms from solid to molten state.,Electrochemical study on co-doped ceria-carbonate composite electrolyte,10.1016/j.jpowsour.2011.10.124
5,3302,"Coexistence of various charge carriers, oxide phase composition, and the oxide-carbonate interfacial area are investigated by Raman spectra.",Electrochemical study on co-doped ceria-carbonate composite electrolyte,10.1016/j.jpowsour.2011.10.124
6,3302,The enhancement of conductivity is also discussed by the general mixing rule/percolation theory of composite interfaces.,Electrochemical study on co-doped ceria-carbonate composite electrolyte,10.1016/j.jpowsour.2011.10.124
7,3302,The co-doping with 2nd phase gives a good approach to realize challenges for solid oxide fuel cell.,Electrochemical study on co-doped ceria-carbonate composite electrolyte,10.1016/j.jpowsour.2011.10.124
8,3302,(C) 2011,Electrochemical study on co-doped ceria-carbonate composite electrolyte,10.1016/j.jpowsour.2011.10.124
9,3302,Elsevier B.V. All rights reserved.,Electrochemical study on co-doped ceria-carbonate composite electrolyte,10.1016/j.jpowsour.2011.10.124
