ID,Artigo,Sentencas,Titulo,DOI
1,3650,Solid oxide fuel cells powered by renewable fuels will be a panacea for our current challenges to meet the global energy demand and mitigate climate changes stemming from the widespread use of carbon-rich fuels.,Investigating the effects of reactant gas flow geometrical shape on the performance of solid oxide fuel cell,10.1080/19397038.2022.2150936
2,3650,"Accordingly, this numerical investigation has examined the geometrical shape effects of reactant gas ducts, and the thickness of electrodes on solid oxide fuel cell performance.",Investigating the effects of reactant gas flow geometrical shape on the performance of solid oxide fuel cell,10.1080/19397038.2022.2150936
3,3650,The model was also validated using the experimental result of a rectangular shape gas flow duct conducted at Dr. T. Nejat Veziroglu Clean Energy Research Center of Nigde omer Halisdemir University in Turkiye.,Investigating the effects of reactant gas flow geometrical shape on the performance of solid oxide fuel cell,10.1080/19397038.2022.2150936
4,3650,"Thus, the finding of this work disclosed that the semicircular gas flow duct has outstanding performance following rectangular, trapezoidal and triangular geometrical shapes.",Investigating the effects of reactant gas flow geometrical shape on the performance of solid oxide fuel cell,10.1080/19397038.2022.2150936
5,3650,The additional remarkable results of this work are that the shape of the reactant gas flow channel and the thickness of the cathode have more substantial effects on airflow than fuel flow under identical electrolyte thickness.,Investigating the effects of reactant gas flow geometrical shape on the performance of solid oxide fuel cell,10.1080/19397038.2022.2150936
6,3650,The finding also revealed that a peak power density has been achieved when the thickness of an anode gets thicker up to a certain limit then it is sharply decreasing.,Investigating the effects of reactant gas flow geometrical shape on the performance of solid oxide fuel cell,10.1080/19397038.2022.2150936
7,3650,"On the contrary, the performance of the model is increasing as the thickness of the air electrode is increasing.",Investigating the effects of reactant gas flow geometrical shape on the performance of solid oxide fuel cell,10.1080/19397038.2022.2150936
8,3650,9 Solid oxide fuel cells powered by renewable fuels panacea for our current challenges to meet the global energy demand and mitigate climate changes stemming from the widespread use of carbon-rich fuels rectangular shape gas flow duct conducted at Dr. T. Nejat VezirogluNigdeHalisdemir peak power density has been achieved when the thickness of an anode gets thicker up to a certain limitis decreasingincreasing.,Investigating the effects of reactant gas flow geometrical shape on the performance of solid oxide fuel cell,10.1080/19397038.2022.2150936
