ID,Artigo,Sentencas,Titulo,DOI
1,3967,"This study proposed an effective structure for the cathode of SOFC to reduce resistance, the honeycomb structure with dual porosity (micro and macro pores).",Effects of dual porosity honeycomb structure in SSC-SDC composite cathode for SOFCs,10.1016/j.ijhydene.2015.05.043
2,3967,"A Sm0.5Sr0.5CoO3-delta (SSC) -Sm0.2Ce0.8O2-delta (spq composite cathode for solid oxide fuel cells, with a noble honeycombstructure comprising of nano and micro-sized pores, was fabricated by electrostatic slurry spray deposition (ESSD).",Effects of dual porosity honeycomb structure in SSC-SDC composite cathode for SOFCs,10.1016/j.ijhydene.2015.05.043
3,3967,The macro-pores distribute in the whole film with size range of 5-20 mu m and micro-pores were formed throughout the skeleton with the size under 1 mu m.,Effects of dual porosity honeycomb structure in SSC-SDC composite cathode for SOFCs,10.1016/j.ijhydene.2015.05.043
4,3967,This dual porosity composite cathode from interface to surface of the electrode was deposited by electrostatic slurry spray deposition (ESSD).,Effects of dual porosity honeycomb structure in SSC-SDC composite cathode for SOFCs,10.1016/j.ijhydene.2015.05.043
5,3967,Its electrochemical property was evaluated using electrochemical impedance spectroscopy and turned out to be enhanced compared to a conventional porous structure of cathode.,Effects of dual porosity honeycomb structure in SSC-SDC composite cathode for SOFCs,10.1016/j.ijhydene.2015.05.043
6,3967,The polarization resistances were significantly decreased with increasing measurement temperature.,Effects of dual porosity honeycomb structure in SSC-SDC composite cathode for SOFCs,10.1016/j.ijhydene.2015.05.043
7,3967,"Copyright (C) 2015, Hydrogen Energy Publications, LLC.",Effects of dual porosity honeycomb structure in SSC-SDC composite cathode for SOFCs,10.1016/j.ijhydene.2015.05.043
8,3967,Published by Elsevier Ltd.,Effects of dual porosity honeycomb structure in SSC-SDC composite cathode for SOFCs,10.1016/j.ijhydene.2015.05.043
9,3967,All rights reserved.,Effects of dual porosity honeycomb structure in SSC-SDC composite cathode for SOFCs,10.1016/j.ijhydene.2015.05.043
