ID,Artigo,Sentencas,Titulo,DOI
1,3000,"For a solid oxide fuel cell, temperature gradient has a great effect on its efficiency and durability.",Temperature gradient control of a solid oxide fuel cell stack,10.1016/j.jpowsour.2018.12.058
2,3000,"In recent years, several observers are developed to estimate the temperature gradient.",Temperature gradient control of a solid oxide fuel cell stack,10.1016/j.jpowsour.2018.12.058
3,3000,"However, the temperature gradient control strategies with suitable observers are not seen.",Temperature gradient control of a solid oxide fuel cell stack,10.1016/j.jpowsour.2018.12.058
4,3000,"Therefore, a compound nonlinear controller based on a high-order sliding mode observer is proposed to control the temperature gradient at desired values to improve the solid oxide fuel cell performance.",Temperature gradient control of a solid oxide fuel cell stack,10.1016/j.jpowsour.2018.12.058
5,3000,The high-order sliding mode observer is firstly employed to estimate immeasurable internal temperature.,Temperature gradient control of a solid oxide fuel cell stack,10.1016/j.jpowsour.2018.12.058
6,3000,"Under the interference of the variations in the initial values of the internal states and measurement noises, the high-order sliding mode observer can estimate the internal temperature distribution with a high precise and a fast convergence.",Temperature gradient control of a solid oxide fuel cell stack,10.1016/j.jpowsour.2018.12.058
7,3000,The compound controller which includes a feedback linearization controller and a feedforward controller is then applied to regulate the estimated temperature gradient.,Temperature gradient control of a solid oxide fuel cell stack,10.1016/j.jpowsour.2018.12.058
8,3000,"During load current changes, the compound controller has the best dynamic performance compared with the feedback linearization controller.",Temperature gradient control of a solid oxide fuel cell stack,10.1016/j.jpowsour.2018.12.058
9,3000,"However, the observed temperature gradient with the two control strategies can both reach the desired value.",Temperature gradient control of a solid oxide fuel cell stack,10.1016/j.jpowsour.2018.12.058
