ID,Artigo,Sentencas,Titulo,DOI
1,372,"In addition to generate electricity, solid oxide fuel cells also produce a considerable quantity of high-quality waste heat.","Performance assessment of an advanced triple-cycle system based upon solid oxide fuel cells, vacuum thermionic generators and absorption refrigerators",10.1016/j.enconman.2019.04.029
2,372,"To harvest the waste heat, an advanced triple-cycle system based upon solid oxide fuel cells, vacuum thermionic generators and absorption refrigerators is theoretically put forward.","Performance assessment of an advanced triple-cycle system based upon solid oxide fuel cells, vacuum thermionic generators and absorption refrigerators",10.1016/j.enconman.2019.04.029
3,372,"Assuming that the main irreversible losses within the system are thermodynamic and electrochemical losses, the performance parameters mathematically evaluating the whole system are specified under different operating conditions.","Performance assessment of an advanced triple-cycle system based upon solid oxide fuel cells, vacuum thermionic generators and absorption refrigerators",10.1016/j.enconman.2019.04.029
4,372,The effectiveness is also demonstrated through performance comparisons between the proposed system and the stand-alone solid oxide fuel cell system.,"Performance assessment of an advanced triple-cycle system based upon solid oxide fuel cells, vacuum thermionic generators and absorption refrigerators",10.1016/j.enconman.2019.04.029
5,372,"Numerical calculations show that the maximum attainable power density and its corresponding efficiency allow 20.3% and 18.4% larger than that of the stand-alone solid oxide fuel cell system, respectively.","Performance assessment of an advanced triple-cycle system based upon solid oxide fuel cells, vacuum thermionic generators and absorption refrigerators",10.1016/j.enconman.2019.04.029
6,372,Comprehensive parametric studies are further undertaken to reveal the influences of some decisive design parameters and operating conditions on the triple-cycle system performance.,"Performance assessment of an advanced triple-cycle system based upon solid oxide fuel cells, vacuum thermionic generators and absorption refrigerators",10.1016/j.enconman.2019.04.029
7,372,Results show that the microstructure parameters of the solid oxide fuel cell and the anode temperature of the vacuum thermionic generator can be optimally designed to maximize the power density of the triple-cycle system.,"Performance assessment of an advanced triple-cycle system based upon solid oxide fuel cells, vacuum thermionic generators and absorption refrigerators",10.1016/j.enconman.2019.04.029
8,372,The vacuum thermionic generator can be treated as the alternative intermediate cycle for SOFC based triple-cycle systems.,"Performance assessment of an advanced triple-cycle system based upon solid oxide fuel cells, vacuum thermionic generators and absorption refrigerators",10.1016/j.enconman.2019.04.029
