ID,Artigo,Sentencas,Titulo,DOI
1,3539,The study on pure LNF cathode shows that the material sintered at 1100 degrees C exhibits optimal performance.,Optimization of LaNi0.6Fe0.4O3-δ cathode for intermediate temperature solid oxide fuel cells,10.1016/j.jallcom.2009.07.125
2,3539,"In order to improve the electrochemical performance, CGO powder is added to prepare the LaNi0.6Fe0.4O3-delta-Ce0.9Gd0.1O2-alpha (LNF-CGO) composite cathode.",Optimization of LaNi0.6Fe0.4O3-δ cathode for intermediate temperature solid oxide fuel cells,10.1016/j.jallcom.2009.07.125
3,3539,"Electrochemical performance and characteristics of the LNF-CGO composite cathode, which is used for intermediate temperature solid oxide fuel cells, are investigated.",Optimization of LaNi0.6Fe0.4O3-δ cathode for intermediate temperature solid oxide fuel cells,10.1016/j.jallcom.2009.07.125
4,3539,"Effect of the CGO content on the electrochemical performance of the composite cathode, especially the polarization resistance, is investigated.",Optimization of LaNi0.6Fe0.4O3-δ cathode for intermediate temperature solid oxide fuel cells,10.1016/j.jallcom.2009.07.125
5,3539,The optimized specific area resistance is only 0.37 Omega cm(2) when the CGO content is 29.4vol.% (30 wt.%).,Optimization of LaNi0.6Fe0.4O3-δ cathode for intermediate temperature solid oxide fuel cells,10.1016/j.jallcom.2009.07.125
6,3539,The resistance of Cr poisoning was also investigated during along term (200 h) measurement; the result indicated that the composite cathode also showed high resistance of Cr poisoning.,Optimization of LaNi0.6Fe0.4O3-δ cathode for intermediate temperature solid oxide fuel cells,10.1016/j.jallcom.2009.07.125
7,3539,(C) 2009,Optimization of LaNi0.6Fe0.4O3-δ cathode for intermediate temperature solid oxide fuel cells,10.1016/j.jallcom.2009.07.125
8,3539,Elsevier B.V. All rights reserved.,Optimization of LaNi0.6Fe0.4O3-δ cathode for intermediate temperature solid oxide fuel cells,10.1016/j.jallcom.2009.07.125
