ID,Artigo,Sentencas,Titulo,DOI
1,3731,The bending strength of alumina-toughened 8 mol% yttria fully stabilized zirconia was examined after high temperature annealing.,Thermal history of alumina-toughened ionic conductive zirconia ceramics,10.1016/S0167-2738(98)00086-1
2,3731,"When the specimens were annealed at 1000 or 800 degrees C, their bending strengths initially retained their starting value, decreased and then levelled off.",Thermal history of alumina-toughened ionic conductive zirconia ceramics,10.1016/S0167-2738(98)00086-1
3,3731,The toughening mechanisms and the ionic conductivity of the composite were investigated to confirm the suitability of the composite as electrolyte of solid oxide fuel cells.,Thermal history of alumina-toughened ionic conductive zirconia ceramics,10.1016/S0167-2738(98)00086-1
4,3731,(C) 1998 Elsevier Science B.V.,Thermal history of alumina-toughened ionic conductive zirconia ceramics,10.1016/S0167-2738(98)00086-1
5,3731,All rights reserved.,Thermal history of alumina-toughened ionic conductive zirconia ceramics,10.1016/S0167-2738(98)00086-1
