ID,Artigo,Sentencas,Titulo,DOI
1,3347,High-entropy alloys (HEAs) have received a lot of attention in electrocatalysis due to their potent synergistic effects of uniformly mixing many elements.,"High-Entropy Alloys FeCoNiCuX (X = Al, Mo)-Ce0.8Sm0.2O2 as High- Performance Solid Oxide Fuel Cell Anodes",10.1021/acsaem.2c03655
2,3347,"In this study, HEAs FeCoNiCuX (X = Al, Mo)-Ce0.8Sm0.2O2 (SDC) are considered as a prospective intermediate temperature solid oxide fuel cell (SOFC) anode.","High-Entropy Alloys FeCoNiCuX (X = Al, Mo)-Ce0.8Sm0.2O2 as High- Performance Solid Oxide Fuel Cell Anodes",10.1021/acsaem.2c03655
3,3347,"FeCoNiCuX-SDC as a SOFC anode shows comparable high conductivity with a Ni-based anode and exhibits outstanding catalytic capability for H2, CH4, and CO2.","High-Entropy Alloys FeCoNiCuX (X = Al, Mo)-Ce0.8Sm0.2O2 as High- Performance Solid Oxide Fuel Cell Anodes",10.1021/acsaem.2c03655
4,3347,"The LSGM electrolyte-supported single cell with FeCoNiCuAl-SDC as anode shows maximum power densities of 779 and 526 mW cm-2 with H2 and CH4 as fuel gases and testing at 850 degrees C, respectively.","High-Entropy Alloys FeCoNiCuX (X = Al, Mo)-Ce0.8Sm0.2O2 as High- Performance Solid Oxide Fuel Cell Anodes",10.1021/acsaem.2c03655
5,3347,The distribution of relaxation time analysis shows that the prime speed-limiting steps for the FeCoNiCuX-SDC anode are the adsorption/dissociation of fuel gas.,"High-Entropy Alloys FeCoNiCuX (X = Al, Mo)-Ce0.8Sm0.2O2 as High- Performance Solid Oxide Fuel Cell Anodes",10.1021/acsaem.2c03655
6,3347,"X-ray photoelectron spectroscopy results showed that FeCoNiCuX HEAs with the main constituents in different valence states created more active sites, which provided a synergistic effect for H2, CH4, and CO2 catalysis.","High-Entropy Alloys FeCoNiCuX (X = Al, Mo)-Ce0.8Sm0.2O2 as High- Performance Solid Oxide Fuel Cell Anodes",10.1021/acsaem.2c03655
