ID,Artigo,Sentencas,Titulo,DOI
1,3821,A techno-economic optimization study investigating optimal design and operating strategies of solid oxide fuel cell (SOFC) micro-combined heat and power (CHP) systems for application in U.S. residential dwellings is carried out through modeling and simulation of various anode-supported planar SOFC-based system configurations.,Techno-Economic Optimal Design of Solid Oxide Fuel Cell Systems for Micro-Combined Heat and Power Applications in the US,10.1115/1.3211099
2,3821,Five different SOFC system designs operating from either methane or hydrogen fuels are evaluated in terms of their energetic and economic performances and their overall suitability for meeting residential thermal-to-electric ratios.,Techno-Economic Optimal Design of Solid Oxide Fuel Cell Systems for Micro-Combined Heat and Power Applications in the US,10.1115/1.3211099
3,3821,"Life-cycle cost models are developed and employed to generate optimization objective functions, which are utilized to explore the sensitivity of the life-cycle costs to various system designs and economic parameters and to select optimal system configurations and operating parameters for eventual application in single-family, detached residential homes in the U.S.",Techno-Economic Optimal Design of Solid Oxide Fuel Cell Systems for Micro-Combined Heat and Power Applications in the US,10.1115/1.3211099
4,3821,The study compares the results against a baseline SOFC-CHP system that employs primarily external steam reforming of methane.,Techno-Economic Optimal Design of Solid Oxide Fuel Cell Systems for Micro-Combined Heat and Power Applications in the US,10.1115/1.3211099
5,3821,The results of the study indicate that system configurations and operating parameter selections that enable minimum life-cycle cost while achieving maximum CHP-system efficiency are possible.,Techno-Economic Optimal Design of Solid Oxide Fuel Cell Systems for Micro-Combined Heat and Power Applications in the US,10.1115/1.3211099
6,3821,Life-cycle cost reductions of over 30% and CHP efficiency improvements of nearly 20% from the baseline system are detailed.,Techno-Economic Optimal Design of Solid Oxide Fuel Cell Systems for Micro-Combined Heat and Power Applications in the US,10.1115/1.3211099
