ID,Artigo,Sentencas,Titulo,DOI
1,3076,"This paper presents a performance analysis of a planar solid oxide fuel cell (SOFC) with different support structures, i.e., electrode (anode and cathode) and electrolyte supports.",Electrochemical study of a planar solid oxide fuel cell: Role of support structures,10.1016/j.jpowsour.2007.11.079
2,3076,"An electrochemical model, taking into account structural and operational parameters and gas diffusion at the electrodes, is used to analyze the characteristics of the planar SOFC.",Electrochemical study of a planar solid oxide fuel cell: Role of support structures,10.1016/j.jpowsour.2007.11.079
3,3076,"Simulation results demonstrate that under cell operation at an intermediate temperature (1073 K), an anode-supported SOFC is superior to an electrolyte- and cathode-supported SOFC.",Electrochemical study of a planar solid oxide fuel cell: Role of support structures,10.1016/j.jpowsour.2007.11.079
4,3076,Analysis of individual cell voltage loss indicates that ohmic loss dominates the performance of an electrolyte-supported SOFC whereas activation and ohmic overpotentials constitute the major loss in an electrode-supported counterpart.,Electrochemical study of a planar solid oxide fuel cell: Role of support structures,10.1016/j.jpowsour.2007.11.079
5,3076,Sensitivity analyses of the anode-supported SOFC show that decreasing the electrolyte and anode thickness can improve cell performance.,Electrochemical study of a planar solid oxide fuel cell: Role of support structures,10.1016/j.jpowsour.2007.11.079
6,3076,A decrease in operating temperature causes the cell to operate at a lower range of current density due to an increase in ohmic and activation overpotentials.,Electrochemical study of a planar solid oxide fuel cell: Role of support structures,10.1016/j.jpowsour.2007.11.079
7,3076,"Further, increasing the operating pressure and degree of pre-reforming reduces the concentration overpotential and thereby enhances cell performance.",Electrochemical study of a planar solid oxide fuel cell: Role of support structures,10.1016/j.jpowsour.2007.11.079
8,3076,(C) 2007,Electrochemical study of a planar solid oxide fuel cell: Role of support structures,10.1016/j.jpowsour.2007.11.079
9,3076,Elsevier B.V. All rights reserved.,Electrochemical study of a planar solid oxide fuel cell: Role of support structures,10.1016/j.jpowsour.2007.11.079
