ID,Artigo,Sentencas,Titulo,DOI
1,350,Electrolysis behaviors have been investigated based on ceria-based composite electrolytes and fuel cells.,Electrolysis studies based on ceria-based composites,10.1016/j.elecom.2006.01.011
2,350,The results showed that both proton and oxygen ion conduction exist in the ceria-based composite electrolytes resulting in high current outputs in both fuel cell and electrolysis operations.,Electrolysis studies based on ceria-based composites,10.1016/j.elecom.2006.01.011
3,350,"Corresponding to high current output in the electrolysis cell, a high hydrogen production can be expected.",Electrolysis studies based on ceria-based composites,10.1016/j.elecom.2006.01.011
4,350,This work has first demonstrated the ceria-based composite electrolyte used for electrolysis process.,Electrolysis studies based on ceria-based composites,10.1016/j.elecom.2006.01.011
5,350,(c) 2006,Electrolysis studies based on ceria-based composites,10.1016/j.elecom.2006.01.011
6,350,Elsevier B.V. All rights reserved.,Electrolysis studies based on ceria-based composites,10.1016/j.elecom.2006.01.011
