ID,Artigo,Sentencas,Titulo,DOI
1,3977,Natural gas is one of the most attractive fuels for solid oxide fuel cells (SOFCs) because of the existing fuel distribution infrastructure.,Understanding the Impact of Sulfur Poisoning on the Methane-Reforming Activity of a Solid Oxide Fuel Cell Anode,10.1021/acscatal.1c02470
2,3977,"Unfortunately, natural gas routinely contains small concentrations of sulfur-containing compounds, which may result in degradation in performance of fuel cells due to sulfur poisoning of Ni-based anodes.",Understanding the Impact of Sulfur Poisoning on the Methane-Reforming Activity of a Solid Oxide Fuel Cell Anode,10.1021/acscatal.1c02470
3,3977,"To date, the deactivation mechanism of anodes by sulfur remains poorly understood, making it extremely challenging to mitigate the problem.",Understanding the Impact of Sulfur Poisoning on the Methane-Reforming Activity of a Solid Oxide Fuel Cell Anode,10.1021/acscatal.1c02470
4,3977,"Here, we report our findings in unveiling the mechanism of the electrode processes on a Ni-yttria-stabilized-zirconia (Ni-YSZ) anode, enabled by highly surface-sensitive, in situ surface-enhanced Raman spectroscopy (SERS).",Understanding the Impact of Sulfur Poisoning on the Methane-Reforming Activity of a Solid Oxide Fuel Cell Anode,10.1021/acscatal.1c02470
5,3977,"While two different configurations of CO reformates were observed on the Ni-YSZ surface during steam methane-reforming (SMR) processes, the accumulation of S-S bonds at the sulfur-contaminated solid-gas interface significantly hinders the subsequent methane-reforming process.",Understanding the Impact of Sulfur Poisoning on the Methane-Reforming Activity of a Solid Oxide Fuel Cell Anode,10.1021/acscatal.1c02470
6,3977,The identification of the key steps responsible for sulfur poisoning is vital to the development of effective strategies for minimizing the impact of sulfur on robust SOFC operations.,Understanding the Impact of Sulfur Poisoning on the Methane-Reforming Activity of a Solid Oxide Fuel Cell Anode,10.1021/acscatal.1c02470
