ID,Artigo,Sentencas,Titulo,DOI
1,4026,"A 2D Model considering momentum, heat/species transport and electrochemical phenomena, has been proposed for tubular solid oxide fuel cell.",Numerical Analysis of Thermal and Electrochemical Phenomena for Anode Supported Microtubular SOFC,10.1002/aic.11697
2,4026,The model was validated using experimental polarization curves and the good agreement with the experimental data was attained.,Numerical Analysis of Thermal and Electrochemical Phenomena for Anode Supported Microtubular SOFC,10.1002/aic.11697
3,4026,The temperature distributions show that temperature varies severely at the tube inlet than at the tube outlet.,Numerical Analysis of Thermal and Electrochemical Phenomena for Anode Supported Microtubular SOFC,10.1002/aic.11697
4,4026,"The heat generation and transfer mechanisms in electrodes, electrolyte and electrochemical reaction interface were investigated.",Numerical Analysis of Thermal and Electrochemical Phenomena for Anode Supported Microtubular SOFC,10.1002/aic.11697
5,4026,"The results show that the overall electrochemical reaction heat is produced at cathode/electrolyte interface, and a small portion of the heat is consumed at anode/electrolyte interface.",Numerical Analysis of Thermal and Electrochemical Phenomena for Anode Supported Microtubular SOFC,10.1002/aic.11697
6,4026,The heat produced at cathode/electrolyte interface is about five times as much as that consumed at anode/electrolyte interface.,Numerical Analysis of Thermal and Electrochemical Phenomena for Anode Supported Microtubular SOFC,10.1002/aic.11697
7,4026,Over-whelming part of the heat transfer between cell and outside occurs at cathode external surface.,Numerical Analysis of Thermal and Electrochemical Phenomena for Anode Supported Microtubular SOFC,10.1002/aic.11697
8,4026,Most current flow goes into anode from a very small area where the current collectors locates.,Numerical Analysis of Thermal and Electrochemical Phenomena for Anode Supported Microtubular SOFC,10.1002/aic.11697
9,4026,"(c) 2009 American Institute of Chemical Engineers AIChE J, 55: 771-782, 2009",Numerical Analysis of Thermal and Electrochemical Phenomena for Anode Supported Microtubular SOFC,10.1002/aic.11697
