ID,Artigo,Sentencas,Titulo,DOI
1,4284,A 6 kW class interconnector-type anode-supported tubular solid oxide fuel cell (ICT SOFC) stack is fabricated and operated in this study.,Fabrication and operation of a 6 kWe class interconnector-type anode-supported tubular solid oxide fuel cell stack,10.1016/j.ijhydene.2014.06.080
2,4284,"An optimized current-collection method, which the method for current collection at the cathode using the winding method and is the method for the connection between cells using interconnect, is suggested to enhance the performance of the fabricated cell.",Fabrication and operation of a 6 kWe class interconnector-type anode-supported tubular solid oxide fuel cell stack,10.1016/j.ijhydene.2014.06.080
3,4284,That method can increase the current collection area because of usage of winding method for cell and make the connection between cells easy.,Fabrication and operation of a 6 kWe class interconnector-type anode-supported tubular solid oxide fuel cell stack,10.1016/j.ijhydene.2014.06.080
4,4284,"The performance of a single cell with an effective electrode area of 205 cm(2) exhibits 51 W at 750 degrees C and 0.7 V. To assemble a 1 kW class stack, the prepared ICT SOFC cells are connected in series to 20 cells connected in parallel (20 cells in series x two in parallel, 20S2P).",Fabrication and operation of a 6 kWe class interconnector-type anode-supported tubular solid oxide fuel cell stack,10.1016/j.ijhydene.2014.06.080
5,4284,Four modules are assembled for a 6 kWe class stack.,Fabrication and operation of a 6 kWe class interconnector-type anode-supported tubular solid oxide fuel cell stack,10.1016/j.ijhydene.2014.06.080
6,4284,"For one module, the prepared ICT SOFC cells are connected in series to 48 cells, in which one unit bundle consists of two cells connected in parallel.",Fabrication and operation of a 6 kWe class interconnector-type anode-supported tubular solid oxide fuel cell stack,10.1016/j.ijhydene.2014.06.080
7,4284,"The performance of the stack in 3% humidified H-2 and air at 750 degrees C exhibits the maximum electrical power of 7425 W. Copyright (C) 2014, Hydrogen Energy Publications, LLC.",Fabrication and operation of a 6 kWe class interconnector-type anode-supported tubular solid oxide fuel cell stack,10.1016/j.ijhydene.2014.06.080
8,4284,Published by Elsevier Ltd.,Fabrication and operation of a 6 kWe class interconnector-type anode-supported tubular solid oxide fuel cell stack,10.1016/j.ijhydene.2014.06.080
9,4284,All rights reserved.,Fabrication and operation of a 6 kWe class interconnector-type anode-supported tubular solid oxide fuel cell stack,10.1016/j.ijhydene.2014.06.080
