ID,Artigo,Sentencas,Titulo,DOI
1,415,"In the present work, the effect of the hydrogen and the air temperature values on the temperature distribution in a Planar Solid Oxide Fuel Cell is studied by the aid of a two-dimensional mathematical model.",Thermal field in SOFC fed by hydrogen: Inlet gases temperature effect,10.1016/j.ijhydene.2013.01.004
2,415,Two different configurations of the Solid Oxide Fuel Cells are examined: i) the Anode Supported Planar Solid Oxide Fuel Cell (ASP_SOFC) and the Electrolyte Supported Planar Solid Oxide Fuel Cell (ESP_SOFC).,Thermal field in SOFC fed by hydrogen: Inlet gases temperature effect,10.1016/j.ijhydene.2013.01.004
3,415,"In order to describe the temperature distribution within the SOFC, the coupling of the mass and energy transport phenomena along with the electrochemistry is required.",Thermal field in SOFC fed by hydrogen: Inlet gases temperature effect,10.1016/j.ijhydene.2013.01.004
4,415,The studied parameters are: a) the hydrogen and the air temperature values and b) the geometry configurations.,Thermal field in SOFC fed by hydrogen: Inlet gases temperature effect,10.1016/j.ijhydene.2013.01.004
5,415,The complex system of the governing equations is numerically solved with the finite differences method and the calculation of the temperature distribution within each domain of the SOFCs is calculated via the 2-D mathematical model processed by FORTRAN language.,Thermal field in SOFC fed by hydrogen: Inlet gases temperature effect,10.1016/j.ijhydene.2013.01.004
6,415,"Finally, the mathematical model predictions for the temperature distribution under the influence of the studied parameters are thoroughly discussed.",Thermal field in SOFC fed by hydrogen: Inlet gases temperature effect,10.1016/j.ijhydene.2013.01.004
7,415,"Copyright (C) 2013, Hydrogen Energy Publications, LLC.",Thermal field in SOFC fed by hydrogen: Inlet gases temperature effect,10.1016/j.ijhydene.2013.01.004
8,415,Published by Elsevier Ltd.,Thermal field in SOFC fed by hydrogen: Inlet gases temperature effect,10.1016/j.ijhydene.2013.01.004
9,415,All rights reserved.,Thermal field in SOFC fed by hydrogen: Inlet gases temperature effect,10.1016/j.ijhydene.2013.01.004
