ID,Artigo,Sentencas,Titulo,DOI
1,4886,The stability of solid oxide fuel cells (SOFCs) cathodes is often severely damaged by impurity poisonings from Cr vapors.,Configuration entropy tailored beneficial surface segregation on double perovskite cathode with enhanced Cr-tolerance for SOFC,10.1016/j.ceramint.2024.01.426
2,4886,"Here we report a medium entropy GdBa(Mn0.2Fe0.2Co1.2Ni0.2Cu0.2)O5+delta (ME-GBCO) double perovskite cathode, which exhibits remarkably improved Cr-tolerant ability.",Configuration entropy tailored beneficial surface segregation on double perovskite cathode with enhanced Cr-tolerance for SOFC,10.1016/j.ceramint.2024.01.426
3,4886,The polarization resistance (Rp) of GBCO increases from -0.44 to -0.70 Omega cm2 after 20 h exposure to Cr in air at 700 degrees C.,Configuration entropy tailored beneficial surface segregation on double perovskite cathode with enhanced Cr-tolerance for SOFC,10.1016/j.ceramint.2024.01.426
4,4886,"In contrast, Rp value of ME-GBCO cathode increases from -0.16 to -0.24",Configuration entropy tailored beneficial surface segregation on double perovskite cathode with enhanced Cr-tolerance for SOFC,10.1016/j.ceramint.2024.01.426
5,4886,Omega cm2 under the same condition.,Configuration entropy tailored beneficial surface segregation on double perovskite cathode with enhanced Cr-tolerance for SOFC,10.1016/j.ceramint.2024.01.426
6,4886,"The enhanced operational stability is attributed to the in situ formed BaCoO3-delta (BCO) nanoparticles on ME-GBCO surface, which is very inactive to Cr vapors.",Configuration entropy tailored beneficial surface segregation on double perovskite cathode with enhanced Cr-tolerance for SOFC,10.1016/j.ceramint.2024.01.426
7,4886,This work highlights that the configuration entropy modulation is an effective avenue for surface engineering and for the development of robust cathode materials for SOFCs.,Configuration entropy tailored beneficial surface segregation on double perovskite cathode with enhanced Cr-tolerance for SOFC,10.1016/j.ceramint.2024.01.426
