ID,Artigo,Sentencas,Titulo,DOI
1,4891,"In an attempt to optimize the properties of FeCoNi coating for planar solid oxide fuel cell (SOFC) interconnect application, the coating composition is modified by increasing the ratio of Fe/Ni.",Sputtered Fe1•5CoNi0.5 coating: An improved protective coating for SOFC interconnect applications,10.1016/j.ijhydene.2022.01.188
2,4891,"An Fe1.5CoNi0.5 (Fe:Co:Ni = 1.5:1:0.5, atomic ratio) metallic coating is fabricated on SUS 430 stainless steel by magnetron sputtering, followed by oxidation in air at 800 degrees C. The Fe1.5CoNi0.5 coating is thermally converted to (Fe,Co,Ni)(3)O-4 and (Fe,Co,Mn,Ni)(3)O-4 without (Ni,Co)O particles.",Sputtered Fe1•5CoNi0.5 coating: An improved protective coating for SOFC interconnect applications,10.1016/j.ijhydene.2022.01.188
3,4891,"After oxidation for 1680 h, no further migration of Cr is detected in the thermally converted coating region.",Sputtered Fe1•5CoNi0.5 coating: An improved protective coating for SOFC interconnect applications,10.1016/j.ijhydene.2022.01.188
4,4891,A low oxidation rate of 5.9 x 10(-14) g(2) cm(-4) s(-1) and area specific resistance of 12.64 m Omega center dot cm(2) is obtained for Fe1.5CoNi0.5 coated steels.,Sputtered Fe1•5CoNi0.5 coating: An improved protective coating for SOFC interconnect applications,10.1016/j.ijhydene.2022.01.188
5,4891,(c) 2022 Hydrogen Energy Publications LLC.,Sputtered Fe1•5CoNi0.5 coating: An improved protective coating for SOFC interconnect applications,10.1016/j.ijhydene.2022.01.188
6,4891,Published by Elsevier Ltd.,Sputtered Fe1•5CoNi0.5 coating: An improved protective coating for SOFC interconnect applications,10.1016/j.ijhydene.2022.01.188
7,4891,All rights reserved.,Sputtered Fe1•5CoNi0.5 coating: An improved protective coating for SOFC interconnect applications,10.1016/j.ijhydene.2022.01.188
