ID,Artigo,Sentencas,Titulo,DOI
1,4906,Sm(0.)5Ba(0.5)MnO(3-delta) (SBMO) has been synthesized with the Pechini method and investigated as an anode material of solid oxide fuel cells with H-2 and methanol as fuels.,Sm0.5Ba0.5MnO3-δ anode for solid oxide fuel cells with hydrogen and methanol as fuels,10.1016/j.cattod.2017.06.034
2,4906,A cubic perovskite structure is formed after reduction.,Sm0.5Ba0.5MnO3-δ anode for solid oxide fuel cells with hydrogen and methanol as fuels,10.1016/j.cattod.2017.06.034
3,4906,The reduction process of SBMO is studied with X-ray photoelectron spectroscopy and temperature programmed reduction techniques.,Sm0.5Ba0.5MnO3-δ anode for solid oxide fuel cells with hydrogen and methanol as fuels,10.1016/j.cattod.2017.06.034
4,4906,"The electrical conductivities of an SBMO sample sintered at 950 degrees C are 1.15 and 0.10 S cm(-1) at 850 degrees C in air and H-2, respectively.",Sm0.5Ba0.5MnO3-δ anode for solid oxide fuel cells with hydrogen and methanol as fuels,10.1016/j.cattod.2017.06.034
5,4906,A single cell with an SBMO anode layer and a 300-mu m La0.8Sr0.2Ga0.8Mg0.2O3-delta electrolyte layer exhibits a maximum power density (P-max) of about 150 mW cm(-2) at 850 degrees C with H-2 as fuel.,Sm0.5Ba0.5MnO3-δ anode for solid oxide fuel cells with hydrogen and methanol as fuels,10.1016/j.cattod.2017.06.034
6,4906,"The electrical conductivity of the anode layer with methanol as fuel is improved by the moderate carbon deposition, and the Pmax increases to about 415 mW cm(-2).",Sm0.5Ba0.5MnO3-δ anode for solid oxide fuel cells with hydrogen and methanol as fuels,10.1016/j.cattod.2017.06.034
7,4906,The cell fed with methanol also shows a promising stability.,Sm0.5Ba0.5MnO3-δ anode for solid oxide fuel cells with hydrogen and methanol as fuels,10.1016/j.cattod.2017.06.034
