ID,Artigo,Sentencas,Titulo,DOI
1,4162,The solid oxide fuel cell (SOFC) is a new energy technology that has the advantages of low emissions and high efficiency.,Source Diagnosis of Solid Oxide Fuel Cell System Oscillation Based on Data Driven,10.3390/en13164069
2,4162,"However, oscillation and propagation often occur during the power generation of the system, which causes system performance degradation and reduced service life.",Source Diagnosis of Solid Oxide Fuel Cell System Oscillation Based on Data Driven,10.3390/en13164069
3,4162,"To determine the root cause of multi-loop oscillation in an SOFC system, a data-driven diagnostic method is proposed in this paper.",Source Diagnosis of Solid Oxide Fuel Cell System Oscillation Based on Data Driven,10.3390/en13164069
4,4162,"In our method, kernel principal component analysis (KPCA) and transfer entropy were applied to the system oscillation fault location.",Source Diagnosis of Solid Oxide Fuel Cell System Oscillation Based on Data Driven,10.3390/en13164069
5,4162,"First, based on the KPCA method and the Oscillation Significance Index (OSI) of the system process variable, the process variables that were most affected by the oscillations were selected.",Source Diagnosis of Solid Oxide Fuel Cell System Oscillation Based on Data Driven,10.3390/en13164069
6,4162,"Then, transfer entropy was used to quantitatively analyze the causal relationship between the oscillation variables and the oscillation propagation path, which determined the root cause of the oscillation.",Source Diagnosis of Solid Oxide Fuel Cell System Oscillation Based on Data Driven,10.3390/en13164069
7,4162,"Finally, Granger causality (GC) analysis was used to verify the correctness of our method.",Source Diagnosis of Solid Oxide Fuel Cell System Oscillation Based on Data Driven,10.3390/en13164069
8,4162,The experimental results show that the proposed method can accurately and effectively locate the root cause of the SOFC system's oscillation.,Source Diagnosis of Solid Oxide Fuel Cell System Oscillation Based on Data Driven,10.3390/en13164069
