ID,Artigo,Sentencas,Titulo,DOI
1,5571,Barium zirconate-based high-temperature proton conductors have not been widely used as electrolytes for solid oxide fuel cells (SOFCs) due to the poor sintering activity and the difficulty in preparing dense and highly conductive electrolyte films.,Proton-conducting solid oxide fuel cells with yttrium-doped barium zirconate electrolyte films sintered at reduced temperatures,10.1016/j.jallcom.2015.10.275
2,5571,"In this work, thin BaZr0.8Y0.2O3-delta (BZY) proton-conducting electrolyte films were prepared by a conventional dry-pressing method followed by sintering in flowing oxygen.",Proton-conducting solid oxide fuel cells with yttrium-doped barium zirconate electrolyte films sintered at reduced temperatures,10.1016/j.jallcom.2015.10.275
3,5571,BZY films got fully dense after sintered at a low temperature of 1350 degrees C for 5 h. Single cells with BZY electrolyte films prepared at various temperatures were assembled and tested.,Proton-conducting solid oxide fuel cells with yttrium-doped barium zirconate electrolyte films sintered at reduced temperatures,10.1016/j.jallcom.2015.10.275
4,5571,The influence of sintering temperature on the morphology of BZY films and electrochemical performances of single cells was investigated.,Proton-conducting solid oxide fuel cells with yttrium-doped barium zirconate electrolyte films sintered at reduced temperatures,10.1016/j.jallcom.2015.10.275
5,5571,"Besides, the open circuit voltages of the single cells as well as those previously reported BZY-based SOFCs were also discussed.",Proton-conducting solid oxide fuel cells with yttrium-doped barium zirconate electrolyte films sintered at reduced temperatures,10.1016/j.jallcom.2015.10.275
6,5571,(C) 2015,Proton-conducting solid oxide fuel cells with yttrium-doped barium zirconate electrolyte films sintered at reduced temperatures,10.1016/j.jallcom.2015.10.275
7,5571,Elsevier B.V. All rights reserved.,Proton-conducting solid oxide fuel cells with yttrium-doped barium zirconate electrolyte films sintered at reduced temperatures,10.1016/j.jallcom.2015.10.275
