ID,Artigo,Sentencas,Titulo,DOI
1,5540,"The electrical power generation characteristics of SOFCs where LaGaO3- based perovskite type oxide is applied as the electrolyte, were studied for the decreased temperature solid oxide fuel cells.",Intermediate temperature solid oxide fuel cells with LaGaO3 based perovskite type electrolyte,10.5796/kogyobutsurikagaku.64.642
2,5540,"The power generation characteristics of cells were strongly affected by the electrode, both anode and cathode.",Intermediate temperature solid oxide fuel cells with LaGaO3 based perovskite type electrolyte,10.5796/kogyobutsurikagaku.64.642
3,5540,"The maxi-mum power density of cells increased in the following order, Pt < La0.75Sr0.25CrO3",Intermediate temperature solid oxide fuel cells with LaGaO3 based perovskite type electrolyte,10.5796/kogyobutsurikagaku.64.642
4,5540,"< (La0.6Sr0.4)(0.9)MnO3 < La0.6Sr0.4FeO3 < La0.6Sr0.4CoO3 for the cathode, and Ru < Pt < Co < Ni for the anode.",Intermediate temperature solid oxide fuel cells with LaGaO3 based perovskite type electrolyte,10.5796/kogyobutsurikagaku.64.642
5,5540,Rare earth cations in the Ln-site of Co-based perovskite oxides cathode also have a great effect on the power generation characteristics.,Intermediate temperature solid oxide fuel cells with LaGaO3 based perovskite type electrolyte,10.5796/kogyobutsurikagaku.64.642
6,5540,"In particular, a high power density could be attained in the temperature range from 973 K to 1273 K by using a doped SmCoO3 for the cathode.",Intermediate temperature solid oxide fuel cells with LaGaO3 based perovskite type electrolyte,10.5796/kogyobutsurikagaku.64.642
7,5540,"density of the SOFC, which consisted of Ni anode and Sm0.6Sr0.4CoO3 cathode attained the values as high as 0.44 and 0.14 W/cm(2) at 1073 and 973 K, respectively.",Intermediate temperature solid oxide fuel cells with LaGaO3 based perovskite type electrolyte,10.5796/kogyobutsurikagaku.64.642
