ID,Artigo,Sentencas,Titulo,DOI
1,501,"An innovative control strategy is proposed of hybrid distributed generation (HDG) systems, including solid oxide fuel cell (SOFC) as the main energy source and battery energy storage as the auxiliary power source.",Fuzzy neural control of a hybrid fuel cell/battery distributed power generation system,10.1049/iet-rpg.2008.0027
2,501,"The overall configuration of the HDG system is given, and dynamic models for the SOFC power plant, battery bank and its power electronic interfacing are briefly described, and controller design methodologies for the power conditioning units and fuel cell to control the power flow from the hybrid power plant to the utility grid are presented.",Fuzzy neural control of a hybrid fuel cell/battery distributed power generation system,10.1049/iet-rpg.2008.0027
3,501,"To distribute the power between power sources, the fuzzy switching controller has been developed.",Fuzzy neural control of a hybrid fuel cell/battery distributed power generation system,10.1049/iet-rpg.2008.0027
4,501,"Then, a Lyapunov based-neuro fuzzy algorithm is presented for designing the controllers of fuel cell power plant, DC/DC and DC/AC converters; to regulate the input fuel flow and meet a desirable output power demand.",Fuzzy neural control of a hybrid fuel cell/battery distributed power generation system,10.1049/iet-rpg.2008.0027
5,501,Simulation results are given to show the overall system performance including load-following and power management of the system.,Fuzzy neural control of a hybrid fuel cell/battery distributed power generation system,10.1049/iet-rpg.2008.0027
