ID,Artigo,Sentencas,Titulo,DOI
1,5794,Solid oxide fuel cell electrolytes are currently manufactured from zirconia.,Characterisation of Ce0.8Gd0.2O1.9/3Y-TZP composite electrolytes -: effects of weight % 3Y-TZP particles,10.1023/A:1022947825861
2,5794,This is due to its high ionic conductivity and mechanical strength.,Characterisation of Ce0.8Gd0.2O1.9/3Y-TZP composite electrolytes -: effects of weight % 3Y-TZP particles,10.1023/A:1022947825861
3,5794,"However, a disadvantage of zirconia is the high temperatures required for efficient operation, greater than 900degreesC for cells not utilising thin supported electrolytes.",Characterisation of Ce0.8Gd0.2O1.9/3Y-TZP composite electrolytes -: effects of weight % 3Y-TZP particles,10.1023/A:1022947825861
4,5794,"A study to characterise the properties of an alternative composite solid electrolyte, based on a gadolinia doped ceria matrix surrounding yttria stabilised tetragonal zirconia particles is presented.",Characterisation of Ce0.8Gd0.2O1.9/3Y-TZP composite electrolytes -: effects of weight % 3Y-TZP particles,10.1023/A:1022947825861
5,5794,"Composite samples produced using 1, 2, 5, 10 and 20 wt% zirconia particles were characterised using a range of different experimental techniques including scanning electron microscopy, transmission electron microscopy, X-ray diffraction, mechanical testing and impedance spectroscopy.",Characterisation of Ce0.8Gd0.2O1.9/3Y-TZP composite electrolytes -: effects of weight % 3Y-TZP particles,10.1023/A:1022947825861
6,5794,Results showed a lowering in flexure strength of the experimental composite samples with the addition of particles.,Characterisation of Ce0.8Gd0.2O1.9/3Y-TZP composite electrolytes -: effects of weight % 3Y-TZP particles,10.1023/A:1022947825861
7,5794,It is considered that the particles acted as regions where cracks could initiate.,Characterisation of Ce0.8Gd0.2O1.9/3Y-TZP composite electrolytes -: effects of weight % 3Y-TZP particles,10.1023/A:1022947825861
8,5794,(C) 2003,Characterisation of Ce0.8Gd0.2O1.9/3Y-TZP composite electrolytes -: effects of weight % 3Y-TZP particles,10.1023/A:1022947825861
9,5794,Kluwer Academic Publishers.,Characterisation of Ce0.8Gd0.2O1.9/3Y-TZP composite electrolytes -: effects of weight % 3Y-TZP particles,10.1023/A:1022947825861
