ID,Artigo,Sentencas,Titulo,DOI
1,570,This paper focuses on the fabrication of micro-coplanar interdigitated single chamber solid oxide fuel cell (mu-SC-SOFC) using a combination of micropatterning technique and thin-film deposition technology.,Fabrication of Micro Single Chamber Solid Oxide Fuel Cell Using Photolithography and Pulsed Laser Deposition,10.1115/1.4029094
2,570,Photolithography was used to generate the micro-interdigitated photoresist patterns on the substrates.,Fabrication of Micro Single Chamber Solid Oxide Fuel Cell Using Photolithography and Pulsed Laser Deposition,10.1115/1.4029094
3,570,Pulsed laser deposition (PLD) method was used to deposit thin films of microstructured electrolytes yttrium stabilized zirconia (YSZ) and electrodes (anode: YSZ + NiO and cathode:,Fabrication of Micro Single Chamber Solid Oxide Fuel Cell Using Photolithography and Pulsed Laser Deposition,10.1115/1.4029094
4,570,lanthanum strontium ferrous cobalt (LSCF)).,Fabrication of Micro Single Chamber Solid Oxide Fuel Cell Using Photolithography and Pulsed Laser Deposition,10.1115/1.4029094
5,570,Process parameters were optimized to obtain consistent functional microstructure and crystal morphology.,Fabrication of Micro Single Chamber Solid Oxide Fuel Cell Using Photolithography and Pulsed Laser Deposition,10.1115/1.4029094
6,570,This research shows good potential for combinatorial manufacturing methods to fabricate high quality and repeatable micro fuel cell components.,Fabrication of Micro Single Chamber Solid Oxide Fuel Cell Using Photolithography and Pulsed Laser Deposition,10.1115/1.4029094
