ID,Artigo,Sentencas,Titulo,DOI
1,5042,Additive manufacturing represents a revolution due to its unique capabilities for freeform fabrication of near net shapes with strong reduction of waste material and capital cost.,Three-dimensional printed yttria-stabilized zirconia self-supported electrolytes for solid oxide fuel cell applications,10.1016/j.jeurceramsoc.2017.11.033
2,5042,"These unfair advantages are especially relevant for expensive and energy-demanding manufacturing processes of advanced ceramics such as Yttria-stabilized Zirconia, the state-of-the-art electrolyte in Solid Oxide Fuel Cell applications.",Three-dimensional printed yttria-stabilized zirconia self-supported electrolytes for solid oxide fuel cell applications,10.1016/j.jeurceramsoc.2017.11.033
3,5042,"In this study, self-supported electrolytes of yttria-stabilized zirconia have been printed by using a stereolithography three-dimensional printer.",Three-dimensional printed yttria-stabilized zirconia self-supported electrolytes for solid oxide fuel cell applications,10.1016/j.jeurceramsoc.2017.11.033
4,5042,"Printed electrolytes and complete cells fabricated with cathode and anode layers of lanthanum strontium manganite- and nickel oxide-yttria-stabilized zirconia composites, respectively, were electrochemical characterized showing full functionality.",Three-dimensional printed yttria-stabilized zirconia self-supported electrolytes for solid oxide fuel cell applications,10.1016/j.jeurceramsoc.2017.11.033
5,5042,"In addition, more complex configurations of the electrolyte have been printed yielding an increase of the performance entirely based on geometrical aspects.",Three-dimensional printed yttria-stabilized zirconia self-supported electrolytes for solid oxide fuel cell applications,10.1016/j.jeurceramsoc.2017.11.033
6,5042,"Complementary, a numerical model has been developed and validated as predictive tool for designing more advanced configurations that will enable highly performing and fully customized devices in the next future.",Three-dimensional printed yttria-stabilized zirconia self-supported electrolytes for solid oxide fuel cell applications,10.1016/j.jeurceramsoc.2017.11.033
