ID,Artigo,Sentencas,Titulo,DOI
1,5096,Lateral impedance and local characteristics of anode-supported solid oxide fuel cells (SOFCs) are studied in this paper.,Measurements of Lateral Impedance and Local Characteristics of Solid Oxide Fuel Cells,10.1115/1.4006799
2,5096,"The testing device, which combines the original cell housing with a four-point probe equipment, is set for measuring SOFC single cell.",Measurements of Lateral Impedance and Local Characteristics of Solid Oxide Fuel Cells,10.1115/1.4006799
3,5096,"The current collectors on anode and cathode in the original cell housing are, respectively, replaced by four independent probe units.",Measurements of Lateral Impedance and Local Characteristics of Solid Oxide Fuel Cells,10.1115/1.4006799
4,5096,"They are not only to collect current, but also become measuring probes.",Measurements of Lateral Impedance and Local Characteristics of Solid Oxide Fuel Cells,10.1115/1.4006799
5,5096,"Therefore, the lateral impedance of anode and cathode can be measured.",Measurements of Lateral Impedance and Local Characteristics of Solid Oxide Fuel Cells,10.1115/1.4006799
6,5096,"Furthermore, the local characteristics are examined by open circuit voltage (OCV), I-V curve, and electrochemical impedance spectroscopy (EIS) measurements.",Measurements of Lateral Impedance and Local Characteristics of Solid Oxide Fuel Cells,10.1115/1.4006799
7,5096,"The results show that the lateral impedance is substantially varied with temperature, the OCV at the center of the cell are higher than the edge, the central location on cell have better performance and lower impedance than the marginal location.",Measurements of Lateral Impedance and Local Characteristics of Solid Oxide Fuel Cells,10.1115/1.4006799
8,5096,[DOI: 10.1115/1.4006799],Measurements of Lateral Impedance and Local Characteristics of Solid Oxide Fuel Cells,10.1115/1.4006799
