ID,Artigo,Sentencas,Titulo,DOI
1,6077,Electrostatic spray deposition (ESD) was applied to fabricate a thin-layer (similar to3 mum thickness),Fabrication of YSZ electrolyte using electrostatic spray deposition (ESD):I -: a comprehensive parametric study,10.1007/s10800-004-3464-4
2,6077,yttria-stabilized zirconia (YSZ) electrolyte on a solid oxide fuel cell (SOFC) anode substrate consisting of nickel-YSZ cermet.,Fabrication of YSZ electrolyte using electrostatic spray deposition (ESD):I -: a comprehensive parametric study,10.1007/s10800-004-3464-4
3,6077,"Reducing the thickness of a state-of-the-art electrolyte, and thereby reducing the cell internal IR drop, is a promising strategy to make the intermediate temperature SOFC (ITSOFC) operating at 600-800degreesC possible.",Fabrication of YSZ electrolyte using electrostatic spray deposition (ESD):I -: a comprehensive parametric study,10.1007/s10800-004-3464-4
4,6077,About 8 mol% YSZ colloidal solution in ethanol was sprayed onto the substrate anode surface at 250-300degreesC by ESD.,Fabrication of YSZ electrolyte using electrostatic spray deposition (ESD):I -: a comprehensive parametric study,10.1007/s10800-004-3464-4
5,6077,"After sintering the deposited layer at 1250-1400degreesC for 1-6 h, the cathode layer, consisting of lanthanum strontium manganate (LSM), was sprayed or brush coated onto the electrolyte layer.",Fabrication of YSZ electrolyte using electrostatic spray deposition (ESD):I -: a comprehensive parametric study,10.1007/s10800-004-3464-4
6,6077,Performance tests on the cell were carried out at 800degreesC to evaluate the electrolyte layer formed by ESD.,Fabrication of YSZ electrolyte using electrostatic spray deposition (ESD):I -: a comprehensive parametric study,10.1007/s10800-004-3464-4
7,6077,"With a 97 H-2/3 H2O mixture and air as fuel and oxidant gas, respectively, open circuit voltage (OCV) was found to be close to the theoretical value.",Fabrication of YSZ electrolyte using electrostatic spray deposition (ESD):I -: a comprehensive parametric study,10.1007/s10800-004-3464-4
