ID,Artigo,Sentencas,Titulo,DOI
1,6607,Vanadium molybdenum oxide system (VxMo(1-x)Oy for x <= 0.13) is synthesized through reducing acidified vanadate and molybdate solution at 60 degrees C by passing hydrogen sulfide gas through the solution.,Electrochemical behaviour and sulfur tolerance of VxMo(1-x)Oy as solid oxide fuel cell anode,10.1016/j.ceramint.2013.02.045
2,6607,The electrochemical performance of the mixed oxide is tested at various operation temperatures as an anode material for intermediate temperature solid oxide fuel cell (IT-SOFC) under pure and 50 ppm H2S-containing hydrogen fuel.,Electrochemical behaviour and sulfur tolerance of VxMo(1-x)Oy as solid oxide fuel cell anode,10.1016/j.ceramint.2013.02.045
3,6607,The highest cell performance of 0.18 W cm(-2) peak power is reached at an operation temperature of 750 degrees C for dry H-2.,Electrochemical behaviour and sulfur tolerance of VxMo(1-x)Oy as solid oxide fuel cell anode,10.1016/j.ceramint.2013.02.045
4,6607,It is found that the addition of 50 ppm H2S to the anode gas causes a 22% decrease in the cell peak power.,Electrochemical behaviour and sulfur tolerance of VxMo(1-x)Oy as solid oxide fuel cell anode,10.1016/j.ceramint.2013.02.045
5,6607,The loss in the cell performance is attributed to both gas conversion and diffusion.,Electrochemical behaviour and sulfur tolerance of VxMo(1-x)Oy as solid oxide fuel cell anode,10.1016/j.ceramint.2013.02.045
6,6607,Short-term regeneration tests indicate that 1 h-exposure to sulfur-free gas is insufficient for the reactivation of the cell performance.,Electrochemical behaviour and sulfur tolerance of VxMo(1-x)Oy as solid oxide fuel cell anode,10.1016/j.ceramint.2013.02.045
7,6607,(C) 2013,Electrochemical behaviour and sulfur tolerance of VxMo(1-x)Oy as solid oxide fuel cell anode,10.1016/j.ceramint.2013.02.045
8,6607,Elsevier Ltd and Techna Group S.r.l.,Electrochemical behaviour and sulfur tolerance of VxMo(1-x)Oy as solid oxide fuel cell anode,10.1016/j.ceramint.2013.02.045
9,6607,All rights reserved.,Electrochemical behaviour and sulfur tolerance of VxMo(1-x)Oy as solid oxide fuel cell anode,10.1016/j.ceramint.2013.02.045
