ID,Artigo,Sentencas,Titulo,DOI
1,6846,"A comparative analysis of the features of the formation, morphology, and electrochemical activity of composite anodes of solid oxide fuel cells was performed using nanosized particles of NiO and Ce0.8Gd0.2O2 - delta.",Formation and Electrochemical Activity of Nanostructured Anodes of Solid Oxide Fuel Cells in Hydrogen-Containing Atmospheres,10.1134/S1995078020030143
2,6846,"The direct introduction of NiO nanoparticles into cermet composition leads to technological problems during screen printing of electrode layers associated with the oxidation of organic components of electrode pastes with oxygen, which is desorbed from the NiO surface.",Formation and Electrochemical Activity of Nanostructured Anodes of Solid Oxide Fuel Cells in Hydrogen-Containing Atmospheres,10.1134/S1995078020030143
3,6846,Such problems can be solved by pre-heating treatment of,Formation and Electrochemical Activity of Nanostructured Anodes of Solid Oxide Fuel Cells in Hydrogen-Containing Atmospheres,10.1134/S1995078020030143
4,6846,"NiO. However, this treatment and subsequent firing of the anodes leads to an increase in the particle size to submicron.",Formation and Electrochemical Activity of Nanostructured Anodes of Solid Oxide Fuel Cells in Hydrogen-Containing Atmospheres,10.1134/S1995078020030143
5,6846,An increase in electrochemical activity can be achieved by impregnating the anodes with the formation of nanosized catalytically active particles on their surface.,Formation and Electrochemical Activity of Nanostructured Anodes of Solid Oxide Fuel Cells in Hydrogen-Containing Atmospheres,10.1134/S1995078020030143
