ID,Artigo,Sentencas,Titulo,DOI
1,742,Porous Ni-Al-CGO cermet (CGO = Ce0.9Gd0.1O2) for use in solid oxide fuel cells was fabricated by thermal explosion (volume reaction) in Ni-Al-CGO powder compacts in different heat sink conditions.,Porous Ni-Al-CGO Cermet for Use in Solid Oxide Fuel Cells,10.3103/S1061386219040137
2,742,Temperature profiles of thermal explosion were recorded and analyzed as a function of green composition.,Porous Ni-Al-CGO Cermet for Use in Solid Oxide Fuel Cells,10.3103/S1061386219040137
3,742,Phase composition of resultant porous materials was found to depend on the CGO content of green mixture and temperature of vacuum annealing.,Porous Ni-Al-CGO Cermet for Use in Solid Oxide Fuel Cells,10.3103/S1061386219040137
4,742,"Starting and final materials were characterized by XRD, SEM, and EDS.",Porous Ni-Al-CGO Cermet for Use in Solid Oxide Fuel Cells,10.3103/S1061386219040137
5,742,Synthesized uniform cermets with a porosity of 50-60% can be recommended for use as a support for solid oxide fuel cells with Ni/CGO anode.,Porous Ni-Al-CGO Cermet for Use in Solid Oxide Fuel Cells,10.3103/S1061386219040137
