ID,Artigo,Sentencas,Titulo,DOI
1,792,"Chemical stability of lanthanum silicate, La10Si6O27 (LSO) as a solid electrolyte for intermediate-temperature solid oxide fuel cells (IT-SOFCs) was investigated.",Chemical stability of La10Si6O27 and its application to electrolytes for solid oxide fuel cells,10.1016/j.ssi.2008.02.030
2,792,"For this purpose, a dense ceramic pellet of LSO was prepared using the solid-state method.",Chemical stability of La10Si6O27 and its application to electrolytes for solid oxide fuel cells,10.1016/j.ssi.2008.02.030
3,792,"It was found that the dense LSO, whose real composition was La9.69Si6O26.54, was highly stable under a wet-H-2 atmosphere at 1073 K over 50 h, and under a wet-CO2 atmosphere at 873 K over 200 h.",Chemical stability of La10Si6O27 and its application to electrolytes for solid oxide fuel cells,10.1016/j.ssi.2008.02.030
4,792,"In addition, a solid oxide fuel cell using LSO and platinum as an electrolyte and both electrodes, respectively, could be operated under a presence of CO2 in a fuel gas.",Chemical stability of La10Si6O27 and its application to electrolytes for solid oxide fuel cells,10.1016/j.ssi.2008.02.030
5,792,The cell voltage under a constant current density was stable during the operation for over 100 h. (C) 2008,Chemical stability of La10Si6O27 and its application to electrolytes for solid oxide fuel cells,10.1016/j.ssi.2008.02.030
6,792,Elsevier B.V. All rights reserved.,Chemical stability of La10Si6O27 and its application to electrolytes for solid oxide fuel cells,10.1016/j.ssi.2008.02.030
