ID,Artigo,Sentencas,Titulo,DOI
1,7448,"At present, the insufficient thermo-mechanical stability of sealing glass presents a challenge for solid oxide fuel cells (SOFCs).",Rigid-resilient transition in calcium borosilicate sealing glass-ceramics: Effect of preferred orientation,10.1016/j.jeurceramsoc.2018.01.005
2,7448,"In this work, we report for the first time that a rigid-resilient transition occurs in a calcium borosilicate sealing glass upon heating at 700 degrees C for different durations.",Rigid-resilient transition in calcium borosilicate sealing glass-ceramics: Effect of preferred orientation,10.1016/j.jeurceramsoc.2018.01.005
3,7448,"The elastic modulus increases from 28.1-40.0 GPa for 24 h to 92.3-105.1 GPa for 100 h, while the corresponding hardness increases from 2.5-3.1 GPa to 8.1-9.2 GPa.",Rigid-resilient transition in calcium borosilicate sealing glass-ceramics: Effect of preferred orientation,10.1016/j.jeurceramsoc.2018.01.005
4,7448,"In addition, a possible mechanism for the rigid-resilient transition has been proposed.",Rigid-resilient transition in calcium borosilicate sealing glass-ceramics: Effect of preferred orientation,10.1016/j.jeurceramsoc.2018.01.005
5,7448,The reported results provide a new approach to solve the sealing problem of SOFCs.,Rigid-resilient transition in calcium borosilicate sealing glass-ceramics: Effect of preferred orientation,10.1016/j.jeurceramsoc.2018.01.005
