ID,Artigo,Sentencas,Titulo,DOI
1,7622,Triple-conducting perovskites are the focus of extensive research and have emerged as high-performance cathode materials for proton-conducting solid oxide fuel cells (H-SOFCs).,Balance the conductivity and enhance chemical stability of BaCe0.3Fe0.7O3-δ by tuning A-site cation deficiency,10.1016/j.ceramint.2024.01.375
2,7622,"Notably, BaCe0.36Fe0.64O3-delta (BCF36) has recently garnered attention for its ability to provide suitable oxygen ion conductivity and proton conductivity, all through skillful composition tuning.",Balance the conductivity and enhance chemical stability of BaCe0.3Fe0.7O3-δ by tuning A-site cation deficiency,10.1016/j.ceramint.2024.01.375
3,7622,"Here, A-site deficient BaCe0.3Fe0.7O3-delta (D-BCF30) is prepared to further boost the cathode activity.",Balance the conductivity and enhance chemical stability of BaCe0.3Fe0.7O3-δ by tuning A-site cation deficiency,10.1016/j.ceramint.2024.01.375
4,7622,The composition content is modified by introducing Ba cation deficiency according to XRD and calculation results.,Balance the conductivity and enhance chemical stability of BaCe0.3Fe0.7O3-δ by tuning A-site cation deficiency,10.1016/j.ceramint.2024.01.375
5,7622,"Remarkably, the single cell equipped with D-BCF30 cathode demonstrates a significantly enhancement in performance, featuring a high power density of 1425 mW cm -2 and a low polarization resistance of 0.045 Omega cm2 at 700 degrees C compared to stoichiometric BCF30.",Balance the conductivity and enhance chemical stability of BaCe0.3Fe0.7O3-δ by tuning A-site cation deficiency,10.1016/j.ceramint.2024.01.375
6,7622,"Moreover, the cell operation durability has markedly improved which is further substantiated through experiments and density functional theory (DFT) calculations, suggesting a promising avenue to improve performance and stability of H-SOFCs.",Balance the conductivity and enhance chemical stability of BaCe0.3Fe0.7O3-δ by tuning A-site cation deficiency,10.1016/j.ceramint.2024.01.375
