ID,Artigo,Sentencas,Titulo,DOI
1,7767,Free-standing solid-state ion conducing thin film membranes are key components in micro-energy conversion devices such as micro-solid oxide fuel cells or electrolyzers.,Zigzag or spiral-shaped nanostructures improve mechanical stability in yttria-stabilized zirconia membranes for micro-energy conversion devices,10.1016/j.nanoen.2019.03.017
2,7767,"Through this work, we explore the design and fabrication of thin film architectures with either straight, zigzag or spiral-shaped columnar grain nanostructures of 8 mol% doped Yttria stabilized zirconia (8YSZ) in order to modify the ceramics elastic properties and mechanical stability for MEMS integration.",Zigzag or spiral-shaped nanostructures improve mechanical stability in yttria-stabilized zirconia membranes for micro-energy conversion devices,10.1016/j.nanoen.2019.03.017
3,7767,We report that the zigzag and spiral-shaped nanomorphologies' can be engineered with a -44% reduced elastic modulus.,Zigzag or spiral-shaped nanostructures improve mechanical stability in yttria-stabilized zirconia membranes for micro-energy conversion devices,10.1016/j.nanoen.2019.03.017
4,7767,"Ultimately, this results in an increased fabrication yield when the thin ionic conductor thin film structures are turned into free-standing membranes as required for different micro energy converter applications.",Zigzag or spiral-shaped nanostructures improve mechanical stability in yttria-stabilized zirconia membranes for micro-energy conversion devices,10.1016/j.nanoen.2019.03.017
5,7767,Raman spectroscopy reveals that the symmetry is lowered by the existence of monoclinic distortions in the cubic phase which modifies the elastic moduli of films with straight columnar structures.,Zigzag or spiral-shaped nanostructures improve mechanical stability in yttria-stabilized zirconia membranes for micro-energy conversion devices,10.1016/j.nanoen.2019.03.017
6,7767,"Fundamentally, we show here evidence that for yttria-stabilized zirconia modifications in membrane nano-architectures and strain can lead to phase changes, which agrees well with findings published in the 1970s based on applied external stress's on macroscopic structures (i.e. pellets).",Zigzag or spiral-shaped nanostructures improve mechanical stability in yttria-stabilized zirconia membranes for micro-energy conversion devices,10.1016/j.nanoen.2019.03.017
7,7767,The influence of the change in nanomorphology on the cross-plane ionic conductivity is minor.,Zigzag or spiral-shaped nanostructures improve mechanical stability in yttria-stabilized zirconia membranes for micro-energy conversion devices,10.1016/j.nanoen.2019.03.017
8,7767,"The oxygen ion conducing thin film nanomorphology design exhibits potential to optimize grain connectivity and tortuosity by growth as either columnar, zigzag or spiral-shaped morphologies, in order to obtain membranes with controllable phases and elastic moduli for micro-energy conversion devices.",Zigzag or spiral-shaped nanostructures improve mechanical stability in yttria-stabilized zirconia membranes for micro-energy conversion devices,10.1016/j.nanoen.2019.03.017
