ID,Artigo,Sentencas,Titulo,DOI
1,8824,"In this work, we report a comparative study of Ni-based anode compositions, made of Cu and Co (40 and 80 mol %) and gadolinia-doped ceria (CGO) matrices, for application the dry reforming of methane (DRM) reaction using Solid Oxide Fuel Cells (SOFCs).",Synthesis of Co-Ni and Cu-Ni based-catalysts for dry reforming of methane as potential components for SOFC anodes,10.1016/j.ceramint.2021.08.220
2,8824,"The new compositions are synthesized by a one-step synthesis route, using citric acid as chelating agent, and characterized at three different stages: i) after synthesis, ii) after reduction, and iii) after DRM.",Synthesis of Co-Ni and Cu-Ni based-catalysts for dry reforming of methane as potential components for SOFC anodes,10.1016/j.ceramint.2021.08.220
3,8824,"X-ray diffraction (XRD) analysis combined with thermodynamic calculations is used to understand phase evolution along the different stages, revealing that complete solid solutions of NiCo- and NiCu-based alloys are formed after DRM reaction.",Synthesis of Co-Ni and Cu-Ni based-catalysts for dry reforming of methane as potential components for SOFC anodes,10.1016/j.ceramint.2021.08.220
4,8824,"Transmission Electron Microscopy (TEM) shows the formation of nanocrystalline powders, while surface area (SBET) measurements show higher values in the case of the NiCo-based samples.",Synthesis of Co-Ni and Cu-Ni based-catalysts for dry reforming of methane as potential components for SOFC anodes,10.1016/j.ceramint.2021.08.220
5,8824,"Moreover, the Co-containing compositions exhibit higher reducibility and stronger metal-ceramic interactions than the Cu-containing samples, according to the Temperature Programmed Reduction (TPR) results.",Synthesis of Co-Ni and Cu-Ni based-catalysts for dry reforming of methane as potential components for SOFC anodes,10.1016/j.ceramint.2021.08.220
6,8824,"Finally, DRM results demonstrate higher CO2 and CH4 conversions in the case of the Co-containing samples, as well as increased resistance towards carbon deposition, as confirmed by Thermogravimetric and Differential Scanning Calorimetry analyses (TG-DSC).",Synthesis of Co-Ni and Cu-Ni based-catalysts for dry reforming of methane as potential components for SOFC anodes,10.1016/j.ceramint.2021.08.220
7,8824,"Overall, the Co-based compositions are highly beneficial for their use as anodes for the CO2 reforming of methane in SOFCs.",Synthesis of Co-Ni and Cu-Ni based-catalysts for dry reforming of methane as potential components for SOFC anodes,10.1016/j.ceramint.2021.08.220
