ID,Artigo,Sentencas,Titulo,DOI
1,8663,Thin film ZnO-doped Ce-4.67(SiO4)(3)O (ZCS) oxy-apatite was synthesized via room temperature sputtering of binary oxide precursor components followed by low oxygen partial pressure (p(O-2) similar to 10(-20) atm) annealing at temperatures not exceeding 1100 K to enable interfacial reactions and phase formation.,Thin Film Oxy-Apatite Anodes for Solid Oxide Fuel Cells,10.1149/2.1361607jes
2,8663,"During the synthesis, the emergence of apatite phase is identified by in-situ electrical conductivity measurements and this is correlated with ex-situ investigations including X-ray diffraction and X-ray photoelectron spectroscopy.",Thin Film Oxy-Apatite Anodes for Solid Oxide Fuel Cells,10.1149/2.1361607jes
3,8663,The synthesized ZCS apatite films show good mixed conductivity.,Thin Film Oxy-Apatite Anodes for Solid Oxide Fuel Cells,10.1149/2.1361607jes
4,8663,Solid oxide fuel cells (SOFC) implementing Ni-apatite co-deposited composite electrodes are demonstrated for the first time with a peak power density of similar to 105 mW cm(-2) at 823 K which presents feasibility of thin film solid state reactions as a means of synthesis of challenging metastable phases and their explorations in energy conversion.,Thin Film Oxy-Apatite Anodes for Solid Oxide Fuel Cells,10.1149/2.1361607jes
5,8663,(C) 2016 The Electrochemical Society.,Thin Film Oxy-Apatite Anodes for Solid Oxide Fuel Cells,10.1149/2.1361607jes
6,8663,All rights reserved.,Thin Film Oxy-Apatite Anodes for Solid Oxide Fuel Cells,10.1149/2.1361607jes
