ID,Artigo,Sentencas,Titulo,DOI
1,874,"Detailed thermodynamic, kinetic, geometric, and cost models are developed, implemented, and validated for the synthesis/design and operational analysis of hybrid solid oxide fuel cell (SOFC)-gas turbine-steam turbine systems ranging in size from 1.5 MWe to 10 MWe.",Thermoeconomic Modeling and Parametric Study of Hybrid Solid Oxide Fuel Cell-Gas Turbine-Steam Turbine Power Plants Ranging From 1.5 MWe to 10 MWe,10.1115/1.2971127
2,874,"The fuel cell model used in this research work is based on a tubular Siemens-Westinghouse-type SOFC, which is integrated with a gas turbine and a heat recovery steam generator (HRSG) integrated in turn with a steam turbine cycle.",Thermoeconomic Modeling and Parametric Study of Hybrid Solid Oxide Fuel Cell-Gas Turbine-Steam Turbine Power Plants Ranging From 1.5 MWe to 10 MWe,10.1115/1.2971127
3,874,"The current work considers the possible benefits of using the exhaust gases in a HRSG in order to produce steam, which drives a steam turbine for additional power output.",Thermoeconomic Modeling and Parametric Study of Hybrid Solid Oxide Fuel Cell-Gas Turbine-Steam Turbine Power Plants Ranging From 1.5 MWe to 10 MWe,10.1115/1.2971127
4,874,"Four different steam turbine cycles are considered in this research work: a single-pressure, a dual-pressure, a triple-pressure, and a triple-pressure with reheat.",Thermoeconomic Modeling and Parametric Study of Hybrid Solid Oxide Fuel Cell-Gas Turbine-Steam Turbine Power Plants Ranging From 1.5 MWe to 10 MWe,10.1115/1.2971127
5,874,The models have been developed to function both at design (full load) and off-design (partial load) conditions.,Thermoeconomic Modeling and Parametric Study of Hybrid Solid Oxide Fuel Cell-Gas Turbine-Steam Turbine Power Plants Ranging From 1.5 MWe to 10 MWe,10.1115/1.2971127
6,874,"In addition, different solid oxide fuel cell sizes are examined to assure a proper selection of SOFC size based on efficiency or cost.",Thermoeconomic Modeling and Parametric Study of Hybrid Solid Oxide Fuel Cell-Gas Turbine-Steam Turbine Power Plants Ranging From 1.5 MWe to 10 MWe,10.1115/1.2971127
7,874,The thermoeconomic analysis includes cost functions developed specifically for the different system and component sizes (capacities) analyzed.,Thermoeconomic Modeling and Parametric Study of Hybrid Solid Oxide Fuel Cell-Gas Turbine-Steam Turbine Power Plants Ranging From 1.5 MWe to 10 MWe,10.1115/1.2971127
8,874,A parametric study is used to determine the most viable system/component syntheses/designs based on maximizing the total system efficiency or minimizing the total system life cycle cost.,Thermoeconomic Modeling and Parametric Study of Hybrid Solid Oxide Fuel Cell-Gas Turbine-Steam Turbine Power Plants Ranging From 1.5 MWe to 10 MWe,10.1115/1.2971127
