ID,Artigo,Sentencas,Titulo,DOI
1,8304,The present research focuses on a novel ceramic/glass composite seal.,Thermomechanical Properties of Cycled Ceramic/Glass Composite Seals for Solid Oxide Fuel Cells,10.1115/1.4029876
2,8304,These seals first underwent a curing cycle.,Thermomechanical Properties of Cycled Ceramic/Glass Composite Seals for Solid Oxide Fuel Cells,10.1115/1.4029876
3,8304,"The cycled seal was then characterized with a laser dilatometer to identify the glass transition, softening temperature, and thermal expansion properties.",Thermomechanical Properties of Cycled Ceramic/Glass Composite Seals for Solid Oxide Fuel Cells,10.1115/1.4029876
4,8304,High temperature ring-on-ring (RoR) experiments were performed to study the effect of glass transition and softening temperatures on mechanical response.,Thermomechanical Properties of Cycled Ceramic/Glass Composite Seals for Solid Oxide Fuel Cells,10.1115/1.4029876
5,8304,X-ray diffraction (XRD) techniques in conjunction with post-test micrographs were used to understand the observed mechanical response.,Thermomechanical Properties of Cycled Ceramic/Glass Composite Seals for Solid Oxide Fuel Cells,10.1115/1.4029876
6,8304,"In addition, Weibull statistical analysis performed on cycled seals showed that Weibull modulus had decreased and Weibull characteristics strength had increased with multiple thermal cycles.",Thermomechanical Properties of Cycled Ceramic/Glass Composite Seals for Solid Oxide Fuel Cells,10.1115/1.4029876
