ID,Artigo,Sentencas,Titulo,DOI
1,8224,"Double perovskite SmSrCo2-xMnxO5+delta (SSCM, x=0.0, 0.2, 0.4, 0.6, 0.8, 1.0) oxides are designed and evaluated as cathode materials for intermediate temperature solid oxide fuel cells (IT-SOFCs).","Synthesis and characterization of SmSrCo2-xMnxO5+δ (x=0.0, 0.2, 0.4, 0.6, 0.8, 1.0) cathode materials for intermediate-temperature solid-oxide fuel cells",10.1016/j.ceramint.2014.03.113
2,8224,"Effect of Mn/Co molar ratio on structural, conductivity, thermal and electrochemical properties for SSCM is systematically investigated.","Synthesis and characterization of SmSrCo2-xMnxO5+δ (x=0.0, 0.2, 0.4, 0.6, 0.8, 1.0) cathode materials for intermediate-temperature solid-oxide fuel cells",10.1016/j.ceramint.2014.03.113
3,8224,"With increasing x from 0.0 to 1.0, the structure does not change.","Synthesis and characterization of SmSrCo2-xMnxO5+δ (x=0.0, 0.2, 0.4, 0.6, 0.8, 1.0) cathode materials for intermediate-temperature solid-oxide fuel cells",10.1016/j.ceramint.2014.03.113
4,8224,"At the same time, the SSCM material exhibits good chemical compatibility with Ce0.9Gd0.1O1.95 (GDC) electrolytes at 950 degrees C for 6 h. The thermal expansion coefficient of SSCM decreases with increasing x, which is helpful to thermally match with the electrolyte.","Synthesis and characterization of SmSrCo2-xMnxO5+δ (x=0.0, 0.2, 0.4, 0.6, 0.8, 1.0) cathode materials for intermediate-temperature solid-oxide fuel cells",10.1016/j.ceramint.2014.03.113
5,8224,The electrical conductivity decreases with x and the SSCM system exhibits a metal to semiconductor transition around x=0.4 and 0.6.,"Synthesis and characterization of SmSrCo2-xMnxO5+δ (x=0.0, 0.2, 0.4, 0.6, 0.8, 1.0) cathode materials for intermediate-temperature solid-oxide fuel cells",10.1016/j.ceramint.2014.03.113
6,8224,"With increasing Mn substitution content for Co, the area specific resistance (ASR) increases from 0.073 Omega cm(2) (x=0.0) to 0.140 Omega cm(2) (x=0.8) at 700 degrees C. Preliminary results indicate that SSCM is especially promising as a cathode for IT-SOFCs.","Synthesis and characterization of SmSrCo2-xMnxO5+δ (x=0.0, 0.2, 0.4, 0.6, 0.8, 1.0) cathode materials for intermediate-temperature solid-oxide fuel cells",10.1016/j.ceramint.2014.03.113
7,8224,(C) 2014,"Synthesis and characterization of SmSrCo2-xMnxO5+δ (x=0.0, 0.2, 0.4, 0.6, 0.8, 1.0) cathode materials for intermediate-temperature solid-oxide fuel cells",10.1016/j.ceramint.2014.03.113
8,8224,Elsevier Ltd and Techna Group S.r.l.,"Synthesis and characterization of SmSrCo2-xMnxO5+δ (x=0.0, 0.2, 0.4, 0.6, 0.8, 1.0) cathode materials for intermediate-temperature solid-oxide fuel cells",10.1016/j.ceramint.2014.03.113
9,8224,All rights reserved.,"Synthesis and characterization of SmSrCo2-xMnxO5+δ (x=0.0, 0.2, 0.4, 0.6, 0.8, 1.0) cathode materials for intermediate-temperature solid-oxide fuel cells",10.1016/j.ceramint.2014.03.113
