ID,Artigo,Sentencas,Titulo,DOI
1,80,Fast and accurate parameter extraction of fuel cells is crucial to the control and performance analysis of fuel cell power systems.,"Fast, and accurate parameter extraction for different types of fuel cells with decomposition and nature-inspired optimization method",10.1016/j.enconman.2018.08.082
2,80,"Unfortunately, due to the multivariable and nonlinear features of fuel cell models, it is a difficult task to identify the parameters of the models.","Fast, and accurate parameter extraction for different types of fuel cells with decomposition and nature-inspired optimization method",10.1016/j.enconman.2018.08.082
3,80,"In this paper, we propose a decomposition technique, where the unknown parameters are divided into two groups: nonlinear and linear.","Fast, and accurate parameter extraction for different types of fuel cells with decomposition and nature-inspired optimization method",10.1016/j.enconman.2018.08.082
4,80,"The optimization techniques only need to optimize the nonlinear parameters, and then the linear parameters are determined based on the nonlinear ones.","Fast, and accurate parameter extraction for different types of fuel cells with decomposition and nature-inspired optimization method",10.1016/j.enconman.2018.08.082
5,80,"With the help of the decomposition technique, a generalized framework by using the nature-inspired optimization method is proposed to try to fast and accurately extract the parameters for different types of fuel cells.","Fast, and accurate parameter extraction for different types of fuel cells with decomposition and nature-inspired optimization method",10.1016/j.enconman.2018.08.082
6,80,"To test the performances of our approach, two widely used types of fuel cells are studied, i.e., proton exchange membrane fuel cell and solid oxide fuel cell.","Fast, and accurate parameter extraction for different types of fuel cells with decomposition and nature-inspired optimization method",10.1016/j.enconman.2018.08.082
7,80,Extensive simulation tests with thirty-two instances are carried out for comparing our approach with existing approaches.,"Fast, and accurate parameter extraction for different types of fuel cells with decomposition and nature-inspired optimization method",10.1016/j.enconman.2018.08.082
8,80,The comparison demonstrates the efficiency of the decomposition technique.,"Fast, and accurate parameter extraction for different types of fuel cells with decomposition and nature-inspired optimization method",10.1016/j.enconman.2018.08.082
9,80,"Moreover, the results show that our approach can not only significantly reduce the computational resources, but also yields high quality solutions.","Fast, and accurate parameter extraction for different types of fuel cells with decomposition and nature-inspired optimization method",10.1016/j.enconman.2018.08.082
