ID,Artigo,Sentencas,Titulo,DOI
1,8607,"In this study, a two-dimensional micro/macroscale model is developed to simulate the operation of anode-supported, planar, intermediate-temperature solid oxide fuel cells (IT-SOFCs) fed with partially reformed methane fuel.",Two-dimensional micro/macroscale model for intermediate-temperature solid oxide fuel cells considering the direct internal reforming of methane,10.1016/j.ijhydene.2016.01.161
2,8607,The previous micro/macroscale model for hydrogen-fueled IT-SOFCs is extended to take into account the direct internal reforming (DIR) of methane inside the porous cermet anode and the multi-component mass transport and reforming reaction heat consumption.,Two-dimensional micro/macroscale model for intermediate-temperature solid oxide fuel cells considering the direct internal reforming of methane,10.1016/j.ijhydene.2016.01.161
3,8607,The intrinsic reaction kinetics for steam methane reforming (SMR) at the nickel catalyst surface is fully considered based on the micro/macroscale calculation framework under the assumption of fully-developed laminar channel flow.,Two-dimensional micro/macroscale model for intermediate-temperature solid oxide fuel cells considering the direct internal reforming of methane,10.1016/j.ijhydene.2016.01.161
4,8607,"Using the developed micro/macroscale model, a detailed investigation of the methane-fueled IT-SOFC operation is conducted, followed by parametric studies on the effects of the inlet temperature, the co- or counter-flow configuration, the air flow rate, and the cell length on performance.",Two-dimensional micro/macroscale model for intermediate-temperature solid oxide fuel cells considering the direct internal reforming of methane,10.1016/j.ijhydene.2016.01.161
5,8607,"Copyright (C) 2016, Hydrogen Energy Publications, LLC.",Two-dimensional micro/macroscale model for intermediate-temperature solid oxide fuel cells considering the direct internal reforming of methane,10.1016/j.ijhydene.2016.01.161
6,8607,Published by Elsevier Ltd.,Two-dimensional micro/macroscale model for intermediate-temperature solid oxide fuel cells considering the direct internal reforming of methane,10.1016/j.ijhydene.2016.01.161
7,8607,All rights reserved.,Two-dimensional micro/macroscale model for intermediate-temperature solid oxide fuel cells considering the direct internal reforming of methane,10.1016/j.ijhydene.2016.01.161
