ID,Artigo,Sentencas,Titulo,DOI
1,8920,One dimensional (1-D) Sr0.7Y0.3CoO2.65-delta (SYCO) nanofibers and nanofiber-based Sr0.7Y0.3CoO2.65-delta-Gd0.2Ce0.8O1.9 (SYCO-GDC) composites have been prepared and studied as cathode materials for intermediate temperature solid oxide fuel cells (IT-SOFCs).,One-dimensional Sr0.7Y0.3CoO2.65-δ nanofibers as cathode material for IT-SOFCs,10.1016/j.ijhydene.2014.02.030
2,8920,1-D SYCO nanofibers are synthesized by electrospinning technique and the subsequent calcination processes.,One-dimensional Sr0.7Y0.3CoO2.65-δ nanofibers as cathode material for IT-SOFCs,10.1016/j.ijhydene.2014.02.030
3,8920,"X-ray diffraction (XRD) results indicate that 900 degrees C is adequate for the formation of phase pure SYCO, much lower than the temperatures adopted in other reported methods for SYCO synthesis.",One-dimensional Sr0.7Y0.3CoO2.65-δ nanofibers as cathode material for IT-SOFCs,10.1016/j.ijhydene.2014.02.030
4,8920,"1-D nanofiber-based SYCO-GDC composite cathodes have been fabricated by infiltrating the ionic conducting GDC phase into the porous SYCO nanofiber scaffolds, achieving interfacial polarization resistances of 0.651, 0.200, 0.057 and 0.011 Omega cm(2) at 600, 650, 700 and 750 degrees C, respectively, with an optimized SYCO:GDC mass ratio of 1:0.44.",One-dimensional Sr0.7Y0.3CoO2.65-δ nanofibers as cathode material for IT-SOFCs,10.1016/j.ijhydene.2014.02.030
5,8920,The stability of this SYCO-GDC (1:0.44) composite cathode was affirmed by 108-h constant current test.,One-dimensional Sr0.7Y0.3CoO2.65-δ nanofibers as cathode material for IT-SOFCs,10.1016/j.ijhydene.2014.02.030
6,8920,All these results suggest that 1-D nanofiber-based SYCO-GDC composite is a promising cathode material for IT-SOFCs.,One-dimensional Sr0.7Y0.3CoO2.65-δ nanofibers as cathode material for IT-SOFCs,10.1016/j.ijhydene.2014.02.030
7,8920,"Copyright (C) 2014, Hydrogen Energy Publications, LLC.",One-dimensional Sr0.7Y0.3CoO2.65-δ nanofibers as cathode material for IT-SOFCs,10.1016/j.ijhydene.2014.02.030
8,8920,Published by Elsevier Ltd.,One-dimensional Sr0.7Y0.3CoO2.65-δ nanofibers as cathode material for IT-SOFCs,10.1016/j.ijhydene.2014.02.030
9,8920,All rights reserved.,One-dimensional Sr0.7Y0.3CoO2.65-δ nanofibers as cathode material for IT-SOFCs,10.1016/j.ijhydene.2014.02.030
