ID,Artigo,Sentencas,Titulo,DOI
1,9369,The perovskite structure materials used as an oxygen ion conductor in solid oxide fuel cells have been widely studied.,Realizing oxygen ion conduction in perovskite structure NaNbO3 by A-site Bismuth doping,10.1016/j.jallcom.2022.166506
2,9369,"Here, we report novel property of NaNbO3-based ceramics about oxygen ion conduction.",Realizing oxygen ion conduction in perovskite structure NaNbO3 by A-site Bismuth doping,10.1016/j.jallcom.2022.166506
3,9369,The grain size is significantly increased as well as the structural symmetry is enhanced with bismuth doping.,Realizing oxygen ion conduction in perovskite structure NaNbO3 by A-site Bismuth doping,10.1016/j.jallcom.2022.166506
4,9369,"Based on the analysis of AC impedance in serial pO(2), nearly pure oxide ions conduction characteristic was realized in Na0.4Bi0.2NbO3 composition.",Realizing oxygen ion conduction in perovskite structure NaNbO3 by A-site Bismuth doping,10.1016/j.jallcom.2022.166506
5,9369,"Remarkably, electrical conductivity of Na0.4Bi0.2NbO3 sharply increased 3 orders of magnitude to 0.01 S/cm at 700 degrees C compared to that of NaNbO3 oxides.",Realizing oxygen ion conduction in perovskite structure NaNbO3 by A-site Bismuth doping,10.1016/j.jallcom.2022.166506
6,9369,"This study not only discovered the novel ionic conductor properties of Na0.4Bi0.2NbO3, but also provided a new candidate for the solid electrolyte of medium-temperature solid oxide fuel cells (IT-SOFCs).",Realizing oxygen ion conduction in perovskite structure NaNbO3 by A-site Bismuth doping,10.1016/j.jallcom.2022.166506
7,9369,(c) 2022 Published by Elsevier B.V.,Realizing oxygen ion conduction in perovskite structure NaNbO3 by A-site Bismuth doping,10.1016/j.jallcom.2022.166506
