ID,Artigo,Sentencas,Titulo,DOI
1,98,One of the most innovative solutions concerning CHP for residential and industrial applications consists in using fuel cell devices.,Fuel cell systems and traditional technologies. Part I: Experimental CHP approach,10.1016/j.applthermaleng.2006.11.002
2,98,The importance of this technology is connected to the possibility of having a nearly complete energetic independence.,Fuel cell systems and traditional technologies. Part I: Experimental CHP approach,10.1016/j.applthermaleng.2006.11.002
3,98,A comparison between traditional systems for energy generation and co-generative fuel cell systems is needed to properly evaluate whether fuel cells could be a reasonable alternative to conventional systems.,Fuel cell systems and traditional technologies. Part I: Experimental CHP approach,10.1016/j.applthermaleng.2006.11.002
4,98,The present work describes the project of an experimental setup which is focused on testing the high temperature Solid Oxide Fuel Cells (SOFC) concept as a promising innovative system.,Fuel cell systems and traditional technologies. Part I: Experimental CHP approach,10.1016/j.applthermaleng.2006.11.002
5,98,"The problem of planning facilities based on fuel cell devices is faced, and the still-to-be-solved question of thermal storage is addressed.",Fuel cell systems and traditional technologies. Part I: Experimental CHP approach,10.1016/j.applthermaleng.2006.11.002
6,98,The core of the work consists of a theoretical calculation and comparison of fuel consumption for both the fuel cell and traditional systems.,Fuel cell systems and traditional technologies. Part I: Experimental CHP approach,10.1016/j.applthermaleng.2006.11.002
7,98,(c) 2006,Fuel cell systems and traditional technologies. Part I: Experimental CHP approach,10.1016/j.applthermaleng.2006.11.002
8,98,Elsevier Ltd.,Fuel cell systems and traditional technologies. Part I: Experimental CHP approach,10.1016/j.applthermaleng.2006.11.002
9,98,All rights reserved.,Fuel cell systems and traditional technologies. Part I: Experimental CHP approach,10.1016/j.applthermaleng.2006.11.002
