ID,Artigo,Sentencas,Titulo,DOI
1,9670,Perovskite thin film electrode for SOFC was prepared on a YSZ single crystal by laser ablation method.,Impedance spectroscopy of perovskite air electrodes for SOFC prepared by laser ablation method,10.1016/j.ssi.2004.06.019
2,9670,The deposited film appeared in pore-free and dense polycrystals oriented in a specific direction.,Impedance spectroscopy of perovskite air electrodes for SOFC prepared by laser ablation method,10.1016/j.ssi.2004.06.019
3,9670,The crystal orientation was controlled by the surface structure of the single crystal substrate.,Impedance spectroscopy of perovskite air electrodes for SOFC prepared by laser ablation method,10.1016/j.ssi.2004.06.019
4,9670,The electrochemical impedance spectroscopy was used to disintegrate the electrode reaction into the constituting basic several processes.,Impedance spectroscopy of perovskite air electrodes for SOFC prepared by laser ablation method,10.1016/j.ssi.2004.06.019
5,9670,"For each process, the pO(2) and temperature dependence was discussed.",Impedance spectroscopy of perovskite air electrodes for SOFC prepared by laser ablation method,10.1016/j.ssi.2004.06.019
6,9670,"In the surface reactions, the dissociative adsorption of oxygen molecules on La0.8Sr0.2CoO3 (LSC) is rate limiting, while the charge transfer process becomes a limiting step on La0.8Sr0.2MnO3 (LSM).",Impedance spectroscopy of perovskite air electrodes for SOFC prepared by laser ablation method,10.1016/j.ssi.2004.06.019
7,9670,The kinetics of these processes shows dependence on the kind of electrode material and the crystal plane of perovskite surface.,Impedance spectroscopy of perovskite air electrodes for SOFC prepared by laser ablation method,10.1016/j.ssi.2004.06.019
8,9670,(C) 2004,Impedance spectroscopy of perovskite air electrodes for SOFC prepared by laser ablation method,10.1016/j.ssi.2004.06.019
9,9670,Elsevier B.V. All rights reserved.,Impedance spectroscopy of perovskite air electrodes for SOFC prepared by laser ablation method,10.1016/j.ssi.2004.06.019
