ID,Artigo,Sentencas,Titulo,DOI
1,912,Reformed fuel gases utilized in solid oxide fuel cells (SOFCs) contain significant amounts of carbon in the form of CO and CO2.,Carburisation of interconnect materials in solid oxide fuel cells,10.1016/S0378-7753(03)00535-4
2,912,"Alloys, Such as ferritic stainless steels, which are utilized as interconnect materials in intermediate temperature SOFCs may, therefore, be susceptible to carburisation.",Carburisation of interconnect materials in solid oxide fuel cells,10.1016/S0378-7753(03)00535-4
3,912,"Long-term exposure of ferritic stainless steel, with and without a nickel protective layer, to simulated carbon-containing fuel gas environments has been Studied.",Carburisation of interconnect materials in solid oxide fuel cells,10.1016/S0378-7753(03)00535-4
4,912,Optical and electron microscopy (both SEM and TEM) techniques were utilized to characterize the microstructures prior to and after carburising.,Carburisation of interconnect materials in solid oxide fuel cells,10.1016/S0378-7753(03)00535-4
5,912,(C) 2003 Elsevier Science B.V.,Carburisation of interconnect materials in solid oxide fuel cells,10.1016/S0378-7753(03)00535-4
6,912,All rights reserved.,Carburisation of interconnect materials in solid oxide fuel cells,10.1016/S0378-7753(03)00535-4
