ID,Artigo,Sentencas,Titulo,DOI
1,9962,The introduction of promising energy sources to satisfy human desires is extremely crucial.,Performance evaluation of a novel fuel cell and wind-powered multigeneration system,10.1016/j.egyr.2024.04.030
2,9962,"The present work studies the performance of an original solid oxide fuel cell-wind-based polygeneration system for producing hydrogen, sodium hypochlorite, potable water, heating, cooling, and electrical power.",Performance evaluation of a novel fuel cell and wind-powered multigeneration system,10.1016/j.egyr.2024.04.030
3,9962,"In the methodological concept, energy, exergy, economic, and exergoenvironmental assessments are carried out to evaluate the system performance concerning different parameters.",Performance evaluation of a novel fuel cell and wind-powered multigeneration system,10.1016/j.egyr.2024.04.030
4,9962,"The technical outcomes depict that the system can produce 363 kW of electrical power, 162 kW of cooling, and 46.5 kW of heating at the design operating settings while the energy and exergy efficiencies are 55.5% and 38.1%, respectively.",Performance evaluation of a novel fuel cell and wind-powered multigeneration system,10.1016/j.egyr.2024.04.030
5,9962,"Moreover, over a year of operation, the system can provide 19.9 x 10(-4) m(3) gaseous hydrogen, 50.9 x 10(3) m(3) potable water, and 5.31 tonnes of sodium hypochlorite to increase the gained benefits from this efficient and cost-effective system.",Performance evaluation of a novel fuel cell and wind-powered multigeneration system,10.1016/j.egyr.2024.04.030
6,9962,"To evaluate the prevalence of the designed system, the economic outcomes demonstrate that the payback period is 1.5 years while the internal rate of return is 0.70.",Performance evaluation of a novel fuel cell and wind-powered multigeneration system,10.1016/j.egyr.2024.04.030
7,9962,"Moreover, the system presents relatively proper environmental benefits based on the obtained outcomes from the exergoenvironmental study; the exergoenvironmental factor, exergy stability factor, and sustainability index are 0.50, 0.56, and 1.6, respectively.",Performance evaluation of a novel fuel cell and wind-powered multigeneration system,10.1016/j.egyr.2024.04.030
