ID,Artigo,Sentencas,Titulo,DOI
1,9224,"For solid oxide fuel cell (SOFC) development, load tracking, heat management, air excess ratio constraint, high efficiency, low cost and fault diagnosis are six key issues.",Optimal fault-tolerant control strategy of a solid oxide fuel cell system,10.1016/j.jpowsour.2017.08.017
2,9224,"However, no literature studies the control techniques combining optimization and fault diagnosis for the SOFC system.",Optimal fault-tolerant control strategy of a solid oxide fuel cell system,10.1016/j.jpowsour.2017.08.017
3,9224,"An optimal fault-tolerant control strategy is presented in this paper, which involves four parts: a fault diagnosis module, a switching module, two backup optimizers and a controller loop.",Optimal fault-tolerant control strategy of a solid oxide fuel cell system,10.1016/j.jpowsour.2017.08.017
4,9224,"The fault diagnosis part is presented to identify the SOFC current fault type, and the switching module is used to select the appropriate backup optimizer based on the diagnosis result.",Optimal fault-tolerant control strategy of a solid oxide fuel cell system,10.1016/j.jpowsour.2017.08.017
5,9224,NSGA-II and TOPSIS are employed to design the two backup optimizers under normal and air compressor fault states.,Optimal fault-tolerant control strategy of a solid oxide fuel cell system,10.1016/j.jpowsour.2017.08.017
6,9224,"PID algorithm is proposed to design the control loop, which includes a power tracking controller, an anode inlet temperature controller, a cathode inlet temperature controller and an air excess ratio controller.",Optimal fault-tolerant control strategy of a solid oxide fuel cell system,10.1016/j.jpowsour.2017.08.017
7,9224,"The simulation results show the proposed optimal fault-tolerant control method can track the power, temperature and air excess ratio at the desired values, simultaneously achieving the maximum efficiency and the minimum unit cost in the case of SOFC normal and even in the air compressor fault.",Optimal fault-tolerant control strategy of a solid oxide fuel cell system,10.1016/j.jpowsour.2017.08.017
8,9224,(C) 2017,Optimal fault-tolerant control strategy of a solid oxide fuel cell system,10.1016/j.jpowsour.2017.08.017
9,9224,Elsevier B.V. All rights reserved.,Optimal fault-tolerant control strategy of a solid oxide fuel cell system,10.1016/j.jpowsour.2017.08.017
