ID,Artigo,Sentencas,Titulo,DOI
1,992,"Electrical performance of a 3D planar solid oxide fuel cell, with ammonia internal decomposition as fuel and yttrium-stabled zirconia as electrolyte, has been simulated numerically, incorporated with the software Comsol Multiphysics.",Numerical Simulation on the Performance of a Solid Oxide Fuel Cell with Direct Ammonia Internal Decomposition,10.1080/15567036.2011.569837
2,992,"With the help of the software, gas concentration distribution in an anode/cathode channel as well as current density distribution was demonstrated.",Numerical Simulation on the Performance of a Solid Oxide Fuel Cell with Direct Ammonia Internal Decomposition,10.1080/15567036.2011.569837
3,992,The poor gas concentration distribution in the cathode channel is mainly responsible for the poor current density distribution.,Numerical Simulation on the Performance of a Solid Oxide Fuel Cell with Direct Ammonia Internal Decomposition,10.1080/15567036.2011.569837
4,992,"Furthermore, the effect of current density on the solid oxide fuel cell ohmic and activation overpotential was analyzed.",Numerical Simulation on the Performance of a Solid Oxide Fuel Cell with Direct Ammonia Internal Decomposition,10.1080/15567036.2011.569837
5,992,The simulation results conform to the data in the experimental literature well.,Numerical Simulation on the Performance of a Solid Oxide Fuel Cell with Direct Ammonia Internal Decomposition,10.1080/15567036.2011.569837
