ID,Artigo,Sentencas,Titulo,DOI
1,9232,"Bi and Sn co-doped perovskite BaFe0.8-XSn0.2BiXO3-d materials have been designed and characterized as a series of new cathodes for proton-conducting solid oxide fuel cells (SOFCs), providing a new life for the traditional BaFeO3-based cathodes.",A novel cobalt-free cathode with triple-conduction for proton-conducting solid oxide fuel cells with unprecedented performance,10.1039/c9ta02449b
2,9232,"Proton uptake of the cathode increases significantly with bismuthdoping, favoring the application of Bi and Sn co-doped perovskite BaFe0.8-XSn0.2BiXO3-d materials in proton-conducting SOFCs.",A novel cobalt-free cathode with triple-conduction for proton-conducting solid oxide fuel cells with unprecedented performance,10.1039/c9ta02449b
3,9232,The density functional theory (DFT) calculation also suggests that the bismuth-doping leads to a dramatic increase of hydration energy and acceleration of proton migration for the BFS material.,A novel cobalt-free cathode with triple-conduction for proton-conducting solid oxide fuel cells with unprecedented performance,10.1039/c9ta02449b
4,9232,"The XPS results show that the oxygen reduction reaction (ORR) activity of the cathode is enhanced after bismuth is added, which is consistent with the experimental results of the power density of the single cell.",A novel cobalt-free cathode with triple-conduction for proton-conducting solid oxide fuel cells with unprecedented performance,10.1039/c9ta02449b
5,9232,"The maximum power density of the single cells with the structure of NiOBaZr0.1Ce0.7Y0.2O3-delta vertical bar BaZr0.1Ce0.7Y0.2O3-delta vertical bar BaFe0.5Sn0.2Bi0.3O3-d (BFSBi0.3) reached 1277 mW cm(-2) at 700 degrees C, which is a record-high performance for proton-conducting SOFCs using cobalt-free cathodes, compared with previous reports.",A novel cobalt-free cathode with triple-conduction for proton-conducting solid oxide fuel cells with unprecedented performance,10.1039/c9ta02449b
6,9232,The outstanding fuel cell performance and good long term stability indicate that bismuth-doping is an effective way of promoting proton-conduction in traditional cathodes.,A novel cobalt-free cathode with triple-conduction for proton-conducting solid oxide fuel cells with unprecedented performance,10.1039/c9ta02449b
7,9232,This study opens a new door to the design of high performance cathodes for proton-conducting SOFCs.,A novel cobalt-free cathode with triple-conduction for proton-conducting solid oxide fuel cells with unprecedented performance,10.1039/c9ta02449b
